sleeping in the home at the time of the infant’s death. The range of people living or sleeping in,sleeping in the home at the time of the infant’s death. The range of people living or sleeping in,sleeping in the home at the time of the infant’s death. The range of people living or sleeping in,sleeping in the home at the time of the infant’s death. The range of people living or sleeping in,sleeping in the home at the time of the infant’s death. The range of people living or sleeping in,sleeping in the home at the time of the infant’s death. The range of people living or sleeping in,sleeping in the home at the time of the infant’s death. The range of people living or sleeping in,sleeping in the home at the time of the infant’s death. The range of people living or sleeping in,sleeping in the home at the time of the infant’s death. The range of people living or sleeping in,sleeping in the home at the time of the infant’s death. The range of people living or sleeping in,sleeping in the home at the time of the infant’s death. The range of people living or sleeping in,sleeping in the home at the time of the infant’s death. The range of people living or sleeping in,sleeping in the home at the time of the infant’s death. The range of people living or sleeping in,sleeping in the home at the time of the infant’s death. The range of people living or sleeping in,sleeping in the home at the time of the infant’s death. The range of people living or sleeping in,sleeping in the home at the time of the infant’s death. The range of people living or sleeping in,sleeping in the home at the time of the infant’s death. The range of people living or sleeping in
a single home at the time of the infant’s death was 2-12. The time between when the infant was,a single home at the time of the infant’s death was 2-12. The time between when the infant was,a single home at the time of the infant’s death was 2-12. The time between when the infant was,a single home at the time of the infant’s death was 2-12. The time between when the infant was,a single home at the time of the infant’s death was 2-12. The time between when the infant was,a single home at the time of the infant’s death was 2-12. The time between when the infant was,a single home at the time of the infant’s death was 2-12. The time between when the infant was,a single home at the time of the infant’s death was 2-12. The time between when the infant was,a single home at the time of the infant’s death was 2-12. The time between when the infant was,a single home at the time of the infant’s death was 2-12. The time between when the infant was,a single home at the time of the infant’s death was 2-12. The time between when the infant was,a single home at the time of the infant’s death was 2-12. The time between when the infant was,a single home at the time of the infant’s death was 2-12. The time between when the infant was,a single home at the time of the infant’s death was 2-12. The time between when the infant was,a single home at the time of the infant’s death was 2-12. The time between when the infant was,a single home at the time of the infant’s death was 2-12. The time between when the infant was,a single home at the time of the infant’s death was 2-12. The time between when the infant was
last,seen,and,the,time,found,ranged,from 0,minutes,(when,the,infant,was,in,sight,of,the
caregiver) to 14 hours.,caregiver) to 14 hours.,caregiver) to 14 hours.,caregiver) to 14 hours.,caregiver) to 14 hours.,Four infants had gone nine or more hours without being checked on by,Four infants had gone nine or more hours without being checked on by,Four infants had gone nine or more hours without being checked on by,Four infants had gone nine or more hours without being checked on by,Four infants had gone nine or more hours without being checked on by,Four infants had gone nine or more hours without being checked on by,Four infants had gone nine or more hours without being checked on by,Four infants had gone nine or more hours without being checked on by,Four infants had gone nine or more hours without being checked on by,Four infants had gone nine or more hours without being checked on by,Four infants had gone nine or more hours without being checked on by,Four infants had gone nine or more hours without being checked on by
a caregiver when they were found.,a caregiver when they were found.,a caregiver when they were found.,a caregiver when they were found.,a caregiver when they were found.,a caregiver when they were found.,a caregiver when they were found.,,,,,,,,,,
VIRGINIA,VIRGINIA,STATE,STATE,CHILD,CHILD,FATALITY,REVIEW,TEAM,–,MARCH,2014,,,,Page 23,Page 23
