Name: “Table 1 of 1 on page 14 of 110”,Name: “Table 1 of 1 on page 14 of 110”,Name: “Table 1 of 1 on page 14 of 110”,Name: “Table 1 of 1 on page 14 of 110”,Name: “Table 1 of 1 on page 14 of 110”,Name: “Table 1 of 1 on page 14 of 110”,Name: “Table 1 of 1 on page 14 of 110”,Name: “Table 1 of 1 on page 14 of 110”,Name: “Table 1 of 1 on page 14 of 110”,Name: “Table 1 of 1 on page 14 of 110”,Name: “Table 1 of 1 on page 14 of 110”,Name: “Table 1 of 1 on page 14 of 110”,Name: “Table 1 of 1 on page 14 of 110”,Name: “Table 1 of 1 on page 14 of 110”,Name: “Table 1 of 1 on page 14 of 110”
Table: 14,Table: 14,Table: 14,Table: 14,Table: 14,Table: 14,Table: 14,Table: 14,Table: 14,Table: 14,Table: 14,Table: 14,Table: 14,Table: 14,Table: 14
,,,,,,,,,,,,,,
SECTION 2: TOTAL CASES,SECTION 2: TOTAL CASES,SECTION 2: TOTAL CASES,SECTION 2: TOTAL CASES,SECTION 2: TOTAL CASES,,,,,,,,,,.
Since 1999 the number of deaths investigated annually by the OCME has increased by a total of,Since 1999 the number of deaths investigated annually by the OCME has increased by a total of,Since 1999 the number of deaths investigated annually by the OCME has increased by a total of,Since 1999 the number of deaths investigated annually by the OCME has increased by a total of,Since 1999 the number of deaths investigated annually by the OCME has increased by a total of,Since 1999 the number of deaths investigated annually by the OCME has increased by a total of,Since 1999 the number of deaths investigated annually by the OCME has increased by a total of,Since 1999 the number of deaths investigated annually by the OCME has increased by a total of,Since 1999 the number of deaths investigated annually by the OCME has increased by a total of,Since 1999 the number of deaths investigated annually by the OCME has increased by a total of,Since 1999 the number of deaths investigated annually by the OCME has increased by a total of,Since 1999 the number of deaths investigated annually by the OCME has increased by a total of,Since 1999 the number of deaths investigated annually by the OCME has increased by a total of,Since 1999 the number of deaths investigated annually by the OCME has increased by a total of,Since 1999 the number of deaths investigated annually by the OCME has increased by a total of
"14.0 percent, while during the same time frame the population of Virginia has increased by 10.1","14.0 percent, while during the same time frame the population of Virginia has increased by 10.1","14.0 percent, while during the same time frame the population of Virginia has increased by 10.1","14.0 percent, while during the same time frame the population of Virginia has increased by 10.1","14.0 percent, while during the same time frame the population of Virginia has increased by 10.1","14.0 percent, while during the same time frame the population of Virginia has increased by 10.1","14.0 percent, while during the same time frame the population of Virginia has increased by 10.1","14.0 percent, while during the same time frame the population of Virginia has increased by 10.1","14.0 percent, while during the same time frame the population of Virginia has increased by 10.1","14.0 percent, while during the same time frame the population of Virginia has increased by 10.1","14.0 percent, while during the same time frame the population of Virginia has increased by 10.1","14.0 percent, while during the same time frame the population of Virginia has increased by 10.1","14.0 percent, while during the same time frame the population of Virginia has increased by 10.1","14.0 percent, while during the same time frame the population of Virginia has increased by 10.1","14.0 percent, while during the same time frame the population of Virginia has increased by 10.1"
percent.,"In 2005, the OCME investigated 5,907 deaths, representing 10.3 percent of the estimated","In 2005, the OCME investigated 5,907 deaths, representing 10.3 percent of the estimated","In 2005, the OCME investigated 5,907 deaths, representing 10.3 percent of the estimated","In 2005, the OCME investigated 5,907 deaths, representing 10.3 percent of the estimated","In 2005, the OCME investigated 5,907 deaths, representing 10.3 percent of the estimated","In 2005, the OCME investigated 5,907 deaths, representing 10.3 percent of the estimated","In 2005, the OCME investigated 5,907 deaths, representing 10.3 percent of the estimated","In 2005, the OCME investigated 5,907 deaths, representing 10.3 percent of the estimated","In 2005, the OCME investigated 5,907 deaths, representing 10.3 percent of the estimated","In 2005, the OCME investigated 5,907 deaths, representing 10.3 percent of the estimated","In 2005, the OCME investigated 5,907 deaths, representing 10.3 percent of the estimated","In 2005, the OCME investigated 5,907 deaths, representing 10.3 percent of the estimated","In 2005, the OCME investigated 5,907 deaths, representing 10.3 percent of the estimated","In 2005, the OCME investigated 5,907 deaths, representing 10.3 percent of the estimated"
total deaths in Virginia. Of the deaths investigated by the OCME in 2005:,total deaths in Virginia. Of the deaths investigated by the OCME in 2005:,total deaths in Virginia. Of the deaths investigated by the OCME in 2005:,total deaths in Virginia. Of the deaths investigated by the OCME in 2005:,total deaths in Virginia. Of the deaths investigated by the OCME in 2005:,total deaths in Virginia. Of the deaths investigated by the OCME in 2005:,total deaths in Virginia. Of the deaths investigated by the OCME in 2005:,total deaths in Virginia. Of the deaths investigated by the OCME in 2005:,total deaths in Virginia. Of the deaths investigated by the OCME in 2005:,total deaths in Virginia. Of the deaths investigated by the OCME in 2005:,total deaths in Virginia. Of the deaths investigated by the OCME in 2005:,total deaths in Virginia. Of the deaths investigated by the OCME in 2005:,,,
•,The total number of deaths investigated represents a 1.9 percent increase from the 2004,The total number of deaths investigated represents a 1.9 percent increase from the 2004,The total number of deaths investigated represents a 1.9 percent increase from the 2004,The total number of deaths investigated represents a 1.9 percent increase from the 2004,The total number of deaths investigated represents a 1.9 percent increase from the 2004,The total number of deaths investigated represents a 1.9 percent increase from the 2004,The total number of deaths investigated represents a 1.9 percent increase from the 2004,The total number of deaths investigated represents a 1.9 percent increase from the 2004,The total number of deaths investigated represents a 1.9 percent increase from the 2004,The total number of deaths investigated represents a 1.9 percent increase from the 2004,The total number of deaths investigated represents a 1.9 percent increase from the 2004,The total number of deaths investigated represents a 1.9 percent increase from the 2004,The total number of deaths investigated represents a 1.9 percent increase from the 2004,The total number of deaths investigated represents a 1.9 percent increase from the 2004
,total and an overall increase 11.9 percent since 1999.,total and an overall increase 11.9 percent since 1999.,total and an overall increase 11.9 percent since 1999.,total and an overall increase 11.9 percent since 1999.,total and an overall increase 11.9 percent since 1999.,total and an overall increase 11.9 percent since 1999.,total and an overall increase 11.9 percent since 1999.,total and an overall increase 11.9 percent since 1999.,,,,,,
•,"The highest total number of deaths occurred in July, and the fewest in February.","The highest total number of deaths occurred in July, and the fewest in February.","The highest total number of deaths occurred in July, and the fewest in February.","The highest total number of deaths occurred in July, and the fewest in February.","The highest total number of deaths occurred in July, and the fewest in February.","The highest total number of deaths occurred in July, and the fewest in February.","The highest total number of deaths occurred in July, and the fewest in February.","The highest total number of deaths occurred in July, and the fewest in February.","The highest total number of deaths occurred in July, and the fewest in February.","The highest total number of deaths occurred in July, and the fewest in February.","The highest total number of deaths occurred in July, and the fewest in February.","The highest total number of deaths occurred in July, and the fewest in February.","The highest total number of deaths occurred in July, and the fewest in February.",More
,"deaths occurred on Saturdays than any other day of the week, and the least on Wednesdays.","deaths occurred on Saturdays than any other day of the week, and the least on Wednesdays.","deaths occurred on Saturdays than any other day of the week, and the least on Wednesdays.","deaths occurred on Saturdays than any other day of the week, and the least on Wednesdays.","deaths occurred on Saturdays than any other day of the week, and the least on Wednesdays.","deaths occurred on Saturdays than any other day of the week, and the least on Wednesdays.","deaths occurred on Saturdays than any other day of the week, and the least on Wednesdays.","deaths occurred on Saturdays than any other day of the week, and the least on Wednesdays.","deaths occurred on Saturdays than any other day of the week, and the least on Wednesdays.","deaths occurred on Saturdays than any other day of the week, and the least on Wednesdays.","deaths occurred on Saturdays than any other day of the week, and the least on Wednesdays.","deaths occurred on Saturdays than any other day of the week, and the least on Wednesdays.","deaths occurred on Saturdays than any other day of the week, and the least on Wednesdays.","deaths occurred on Saturdays than any other day of the week, and the least on Wednesdays."
•,The ratio of male to female deaths was 2.4:1.,The ratio of male to female deaths was 2.4:1.,The ratio of male to female deaths was 2.4:1.,The ratio of male to female deaths was 2.4:1.,The ratio of male to female deaths was 2.4:1.,The ratio of male to female deaths was 2.4:1.,Decedents classified as white represented,Decedents classified as white represented,Decedents classified as white represented,Decedents classified as white represented,Decedents classified as white represented,Decedents classified as white represented,Decedents classified as white represented,Decedents classified as white represented
,71.5 percent of the total.,71.5 percent of the total.,71.5 percent of the total.,,,,,,,,,,,
•,The City of Richmond continued to have the greatest number of homicide deaths with 105,The City of Richmond continued to have the greatest number of homicide deaths with 105,The City of Richmond continued to have the greatest number of homicide deaths with 105,The City of Richmond continued to have the greatest number of homicide deaths with 105,The City of Richmond continued to have the greatest number of homicide deaths with 105,The City of Richmond continued to have the greatest number of homicide deaths with 105,The City of Richmond continued to have the greatest number of homicide deaths with 105,The City of Richmond continued to have the greatest number of homicide deaths with 105,The City of Richmond continued to have the greatest number of homicide deaths with 105,The City of Richmond continued to have the greatest number of homicide deaths with 105,The City of Richmond continued to have the greatest number of homicide deaths with 105,The City of Richmond continued to have the greatest number of homicide deaths with 105,The City of Richmond continued to have the greatest number of homicide deaths with 105,The City of Richmond continued to have the greatest number of homicide deaths with 105
,"deaths; 49.1% greater than Norfolk, which was the locality with the second greatest number","deaths; 49.1% greater than Norfolk, which was the locality with the second greatest number","deaths; 49.1% greater than Norfolk, which was the locality with the second greatest number","deaths; 49.1% greater than Norfolk, which was the locality with the second greatest number","deaths; 49.1% greater than Norfolk, which was the locality with the second greatest number","deaths; 49.1% greater than Norfolk, which was the locality with the second greatest number","deaths; 49.1% greater than Norfolk, which was the locality with the second greatest number","deaths; 49.1% greater than Norfolk, which was the locality with the second greatest number","deaths; 49.1% greater than Norfolk, which was the locality with the second greatest number","deaths; 49.1% greater than Norfolk, which was the locality with the second greatest number","deaths; 49.1% greater than Norfolk, which was the locality with the second greatest number","deaths; 49.1% greater than Norfolk, which was the locality with the second greatest number","deaths; 49.1% greater than Norfolk, which was the locality with the second greatest number","deaths; 49.1% greater than Norfolk, which was the locality with the second greatest number"
,of homicides (82) in 2005.,of homicides (82) in 2005.,of homicides (82) in 2005.,"Fairfax County experienced the greatest number of accidental,","Fairfax County experienced the greatest number of accidental,","Fairfax County experienced the greatest number of accidental,","Fairfax County experienced the greatest number of accidental,","Fairfax County experienced the greatest number of accidental,","Fairfax County experienced the greatest number of accidental,","Fairfax County experienced the greatest number of accidental,","Fairfax County experienced the greatest number of accidental,","Fairfax County experienced the greatest number of accidental,","Fairfax County experienced the greatest number of accidental,","Fairfax County experienced the greatest number of accidental,"
,"natural, and suicide deaths in its residents.","natural, and suicide deaths in its residents.","natural, and suicide deaths in its residents.","natural, and suicide deaths in its residents.","natural, and suicide deaths in its residents.","natural, and suicide deaths in its residents.",,,,,,,,
•,"Autopsies were conducted in 37.8 percent of cases due to accidental deaths, 98.2 percent of","Autopsies were conducted in 37.8 percent of cases due to accidental deaths, 98.2 percent of","Autopsies were conducted in 37.8 percent of cases due to accidental deaths, 98.2 percent of","Autopsies were conducted in 37.8 percent of cases due to accidental deaths, 98.2 percent of","Autopsies were conducted in 37.8 percent of cases due to accidental deaths, 98.2 percent of","Autopsies were conducted in 37.8 percent of cases due to accidental deaths, 98.2 percent of","Autopsies were conducted in 37.8 percent of cases due to accidental deaths, 98.2 percent of","Autopsies were conducted in 37.8 percent of cases due to accidental deaths, 98.2 percent of","Autopsies were conducted in 37.8 percent of cases due to accidental deaths, 98.2 percent of","Autopsies were conducted in 37.8 percent of cases due to accidental deaths, 98.2 percent of","Autopsies were conducted in 37.8 percent of cases due to accidental deaths, 98.2 percent of","Autopsies were conducted in 37.8 percent of cases due to accidental deaths, 98.2 percent of","Autopsies were conducted in 37.8 percent of cases due to accidental deaths, 98.2 percent of","Autopsies were conducted in 37.8 percent of cases due to accidental deaths, 98.2 percent of"
,"homicides,",38.9,percent,of,natural,"causes,",83.1,percent,percent,of,"suicides,",96.3,percent,of
,"undetermined deaths, and 50.8 percent of all cases in 2005.","undetermined deaths, and 50.8 percent of all cases in 2005.","undetermined deaths, and 50.8 percent of all cases in 2005.","undetermined deaths, and 50.8 percent of all cases in 2005.","undetermined deaths, and 50.8 percent of all cases in 2005.","undetermined deaths, and 50.8 percent of all cases in 2005.","undetermined deaths, and 50.8 percent of all cases in 2005.","undetermined deaths, and 50.8 percent of all cases in 2005.","undetermined deaths, and 50.8 percent of all cases in 2005.",,,,,
•,"Gunshot wounds were the cause of death in 887 deaths in 2005, 15.0 percent of total cases.","Gunshot wounds were the cause of death in 887 deaths in 2005, 15.0 percent of total cases.","Gunshot wounds were the cause of death in 887 deaths in 2005, 15.0 percent of total cases.","Gunshot wounds were the cause of death in 887 deaths in 2005, 15.0 percent of total cases.","Gunshot wounds were the cause of death in 887 deaths in 2005, 15.0 percent of total cases.","Gunshot wounds were the cause of death in 887 deaths in 2005, 15.0 percent of total cases.","Gunshot wounds were the cause of death in 887 deaths in 2005, 15.0 percent of total cases.","Gunshot wounds were the cause of death in 887 deaths in 2005, 15.0 percent of total cases.","Gunshot wounds were the cause of death in 887 deaths in 2005, 15.0 percent of total cases.","Gunshot wounds were the cause of death in 887 deaths in 2005, 15.0 percent of total cases.","Gunshot wounds were the cause of death in 887 deaths in 2005, 15.0 percent of total cases.","Gunshot wounds were the cause of death in 887 deaths in 2005, 15.0 percent of total cases.","Gunshot wounds were the cause of death in 887 deaths in 2005, 15.0 percent of total cases.","Gunshot wounds were the cause of death in 887 deaths in 2005, 15.0 percent of total cases."
•,Whites,represented,the,greatest,proportion,proportion,of,cases,by,all,manners,of,death,except
,homicide in which blacks represented 58.4 percent of cases.,homicide in which blacks represented 58.4 percent of cases.,homicide in which blacks represented 58.4 percent of cases.,homicide in which blacks represented 58.4 percent of cases.,homicide in which blacks represented 58.4 percent of cases.,homicide in which blacks represented 58.4 percent of cases.,homicide in which blacks represented 58.4 percent of cases.,homicide in which blacks represented 58.4 percent of cases.,homicide in which blacks represented 58.4 percent of cases.,,,,,
•,The number of suicides (875) was 75 percent greater than the number of homicides (498) in,The number of suicides (875) was 75 percent greater than the number of homicides (498) in,The number of suicides (875) was 75 percent greater than the number of homicides (498) in,The number of suicides (875) was 75 percent greater than the number of homicides (498) in,The number of suicides (875) was 75 percent greater than the number of homicides (498) in,The number of suicides (875) was 75 percent greater than the number of homicides (498) in,The number of suicides (875) was 75 percent greater than the number of homicides (498) in,The number of suicides (875) was 75 percent greater than the number of homicides (498) in,The number of suicides (875) was 75 percent greater than the number of homicides (498) in,The number of suicides (875) was 75 percent greater than the number of homicides (498) in,The number of suicides (875) was 75 percent greater than the number of homicides (498) in,The number of suicides (875) was 75 percent greater than the number of homicides (498) in,The number of suicides (875) was 75 percent greater than the number of homicides (498) in,The number of suicides (875) was 75 percent greater than the number of homicides (498) in
,2005.,,,,,,,,,,,,,
,,,"Virginia Department of Health, Office of the Chief Medical Examiner ♦ October 2006","Virginia Department of Health, Office of the Chief Medical Examiner ♦ October 2006","Virginia Department of Health, Office of the Chief Medical Examiner ♦ October 2006","Virginia Department of Health, Office of the Chief Medical Examiner ♦ October 2006","Virginia Department of Health, Office of the Chief Medical Examiner ♦ October 2006","Virginia Department of Health, Office of the Chief Medical Examiner ♦ October 2006","Virginia Department of Health, Office of the Chief Medical Examiner ♦ October 2006","Virginia Department of Health, Office of the Chief Medical Examiner ♦ October 2006","Virginia Department of Health, Office of the Chief Medical Examiner ♦ October 2006",,,
,,,,,,Page 8,,,,,,,,
