OTHER AGENCIES,POPULATION ,"INCIDENT RATE PER 100,000",TOTAL INCIDENTS ,Murder and Non-negligent Manslaughter ,Kidnaping/Abduction ,Forcible Rape ,Other Forcible Sex Offenses,Robbbery,Aggravated Assault,Simple Assault/Intimidation,Arson,Extortion/Blackmail,Burglary,Larceny,Motor Vehicle Theft,Counterfeiting/Forgery,Fraud,Embezzlement,Stolen Property,Destruction/Damage/Vandalism,Drug/Narcotic Offenses,Non-forcible Sex Offenses,Pornography,Gambling,Prostitution,Bribery,Weapon Law Violation
Chesapeake Bay Bridge Tunnel PD 0 ,,,0,0,0,0,0,0,0,0,0,0,0,0,0,0,0,0,0,0,0,0,0,0,0,0,0
Alcoholic Beverage Control ,,,216,0,0,0,0,0,0,11,0,0,1,26,0,23,60,16,0,1,90,0,0,2,1,0,9
Dept. of Conservation and Recreation ,,,47,0,0,0,1,0,1,1,0,0,0,18,1,0,0,0,0,16,8,1,0,0,0,0,3
Division of Capitol Police ,,,100,0,0,0,0,0,0,4,0,0,2,61,0,2,0,0,0,27,4,0,0,0,0,0,1
Metro. Washington Airport Authority PD ,,,872,0,0,0,0,1,4,45,0,0,0,360,124,6,27,5,15,238,32,0,0,0,0,0,46
Norfolk Airport Authority PD ,,,98,0,0,0,0,0,0,4,0,0,0,57,0,0,0,0,0,24,9,0,0,0,0,0,6
Richmond International Airport PD ,,,53,0,0,0,0,0,0,1,0,0,0,34,10,0,1,1,0,3,2,0,0,0,0,0,2
Southside Virginia Training Center ,,,120,0,0,2,4,0,1,81,0,0,0,28,0,0,0,0,0,2,2,0,0,0,0,0,0
Virginia Port Authority ,,,4,0,0,0,0,0,0,1,0,0,0,1,0,0,0,0,0,0,1,0,0,0,0,0,1