Name: “Table 1 of 1 on page 8 of 87”,Name: “Table 1 of 1 on page 8 of 87”,Name: “Table 1 of 1 on page 8 of 87”,Name: “Table 1 of 1 on page 8 of 87”,Name: “Table 1 of 1 on page 8 of 87”,Name: “Table 1 of 1 on page 8 of 87”,Name: “Table 1 of 1 on page 8 of 87”,Name: “Table 1 of 1 on page 8 of 87”,Name: “Table 1 of 1 on page 8 of 87”,Name: “Table 1 of 1 on page 8 of 87”,Name: “Table 1 of 1 on page 8 of 87”,Name: “Table 1 of 1 on page 8 of 87”,Name: “Table 1 of 1 on page 8 of 87”,Name: “Table 1 of 1 on page 8 of 87”,Name: “Table 1 of 1 on page 8 of 87”,Name: “Table 1 of 1 on page 8 of 87”,Name: “Table 1 of 1 on page 8 of 87”,Name: “Table 1 of 1 on page 8 of 87”
Table: 8,Table: 8,Table: 8,Table: 8,Table: 8,Table: 8,Table: 8,Table: 8,Table: 8,Table: 8,Table: 8,Table: 8,Table: 8,Table: 8,Table: 8,Table: 8,Table: 8,Table: 8
,,,,,,,,,,,,,,,,,
The,overall,vision,of,the,OCME,is,to,be,the,best,medical,medical,examiner,system in,the,world.,The
following missions form the core of OCME staff members’ efforts in accomplishing this goal:,following missions form the core of OCME staff members’ efforts in accomplishing this goal:,following missions form the core of OCME staff members’ efforts in accomplishing this goal:,following missions form the core of OCME staff members’ efforts in accomplishing this goal:,following missions form the core of OCME staff members’ efforts in accomplishing this goal:,following missions form the core of OCME staff members’ efforts in accomplishing this goal:,following missions form the core of OCME staff members’ efforts in accomplishing this goal:,following missions form the core of OCME staff members’ efforts in accomplishing this goal:,following missions form the core of OCME staff members’ efforts in accomplishing this goal:,following missions form the core of OCME staff members’ efforts in accomplishing this goal:,following missions form the core of OCME staff members’ efforts in accomplishing this goal:,following missions form the core of OCME staff members’ efforts in accomplishing this goal:,following missions form the core of OCME staff members’ efforts in accomplishing this goal:,following missions form the core of OCME staff members’ efforts in accomplishing this goal:,following missions form the core of OCME staff members’ efforts in accomplishing this goal:,following missions form the core of OCME staff members’ efforts in accomplishing this goal:,following missions form the core of OCME staff members’ efforts in accomplishing this goal:,
•,Conduct medicolegal death investigations.,Conduct medicolegal death investigations.,Conduct medicolegal death investigations.,Conduct medicolegal death investigations.,Conduct medicolegal death investigations.,Conduct medicolegal death investigations.,Conduct medicolegal death investigations.,Conduct medicolegal death investigations.,Conduct medicolegal death investigations.,Conduct medicolegal death investigations.,,,,,,,
•,Perform autopsies to certify cause and manner of death.,Perform autopsies to certify cause and manner of death.,Perform autopsies to certify cause and manner of death.,Perform autopsies to certify cause and manner of death.,Perform autopsies to certify cause and manner of death.,Perform autopsies to certify cause and manner of death.,Perform autopsies to certify cause and manner of death.,Perform autopsies to certify cause and manner of death.,Perform autopsies to certify cause and manner of death.,Perform autopsies to certify cause and manner of death.,Perform autopsies to certify cause and manner of death.,Perform autopsies to certify cause and manner of death.,,,,,
•,Provide public service to citizens and professional colleagues throughout the,Provide public service to citizens and professional colleagues throughout the,Provide public service to citizens and professional colleagues throughout the,Provide public service to citizens and professional colleagues throughout the,Provide public service to citizens and professional colleagues throughout the,Provide public service to citizens and professional colleagues throughout the,Provide public service to citizens and professional colleagues throughout the,Provide public service to citizens and professional colleagues throughout the,Provide public service to citizens and professional colleagues throughout the,Provide public service to citizens and professional colleagues throughout the,Provide public service to citizens and professional colleagues throughout the,Provide public service to citizens and professional colleagues throughout the,Provide public service to citizens and professional colleagues throughout the,Provide public service to citizens and professional colleagues throughout the,,,
,Commonwealth.,Commonwealth.,Commonwealth.,,,,,,,,,,,,,,
•,Educate peers and professionals on subjects related to death investigation.,Educate peers and professionals on subjects related to death investigation.,Educate peers and professionals on subjects related to death investigation.,Educate peers and professionals on subjects related to death investigation.,Educate peers and professionals on subjects related to death investigation.,Educate peers and professionals on subjects related to death investigation.,Educate peers and professionals on subjects related to death investigation.,Educate peers and professionals on subjects related to death investigation.,Educate peers and professionals on subjects related to death investigation.,Educate peers and professionals on subjects related to death investigation.,Educate peers and professionals on subjects related to death investigation.,Educate peers and professionals on subjects related to death investigation.,Educate peers and professionals on subjects related to death investigation.,Educate peers and professionals on subjects related to death investigation.,,,
•,Reduce violent death by conducting surveillance and fatality review.,Reduce violent death by conducting surveillance and fatality review.,Reduce violent death by conducting surveillance and fatality review.,Reduce violent death by conducting surveillance and fatality review.,Reduce violent death by conducting surveillance and fatality review.,Reduce violent death by conducting surveillance and fatality review.,Reduce violent death by conducting surveillance and fatality review.,Reduce violent death by conducting surveillance and fatality review.,Reduce violent death by conducting surveillance and fatality review.,Reduce violent death by conducting surveillance and fatality review.,Reduce violent death by conducting surveillance and fatality review.,Reduce violent death by conducting surveillance and fatality review.,Reduce violent death by conducting surveillance and fatality review.,Reduce violent death by conducting surveillance and fatality review.,,,
•,Provide support and technical assistance to local fatality review teams.,Provide support and technical assistance to local fatality review teams.,Provide support and technical assistance to local fatality review teams.,Provide support and technical assistance to local fatality review teams.,Provide support and technical assistance to local fatality review teams.,Provide support and technical assistance to local fatality review teams.,Provide support and technical assistance to local fatality review teams.,Provide support and technical assistance to local fatality review teams.,Provide support and technical assistance to local fatality review teams.,Provide support and technical assistance to local fatality review teams.,Provide support and technical assistance to local fatality review teams.,Provide support and technical assistance to local fatality review teams.,Provide support and technical assistance to local fatality review teams.,Provide support and technical assistance to local fatality review teams.,,,
•,Administer the State Anatomical Program.,Administer the State Anatomical Program.,Administer the State Anatomical Program.,Administer the State Anatomical Program.,Administer the State Anatomical Program.,Administer the State Anatomical Program.,Administer the State Anatomical Program.,Administer the State Anatomical Program.,Administer the State Anatomical Program.,Administer the State Anatomical Program.,,,,,,,
Virginia’s medical examiners and forensic pathologists are committed to public safety and to public,Virginia’s medical examiners and forensic pathologists are committed to public safety and to public,Virginia’s medical examiners and forensic pathologists are committed to public safety and to public,Virginia’s medical examiners and forensic pathologists are committed to public safety and to public,Virginia’s medical examiners and forensic pathologists are committed to public safety and to public,Virginia’s medical examiners and forensic pathologists are committed to public safety and to public,Virginia’s medical examiners and forensic pathologists are committed to public safety and to public,Virginia’s medical examiners and forensic pathologists are committed to public safety and to public,Virginia’s medical examiners and forensic pathologists are committed to public safety and to public,Virginia’s medical examiners and forensic pathologists are committed to public safety and to public,Virginia’s medical examiners and forensic pathologists are committed to public safety and to public,Virginia’s medical examiners and forensic pathologists are committed to public safety and to public,Virginia’s medical examiners and forensic pathologists are committed to public safety and to public,Virginia’s medical examiners and forensic pathologists are committed to public safety and to public,Virginia’s medical examiners and forensic pathologists are committed to public safety and to public,Virginia’s medical examiners and forensic pathologists are committed to public safety and to public,Virginia’s medical examiners and forensic pathologists are committed to public safety and to public,Virginia’s medical examiners and forensic pathologists are committed to public safety and to public
"health. To promote public safety, they testify to their findings in civil and criminal courts throughout","health. To promote public safety, they testify to their findings in civil and criminal courts throughout","health. To promote public safety, they testify to their findings in civil and criminal courts throughout","health. To promote public safety, they testify to their findings in civil and criminal courts throughout","health. To promote public safety, they testify to their findings in civil and criminal courts throughout","health. To promote public safety, they testify to their findings in civil and criminal courts throughout","health. To promote public safety, they testify to their findings in civil and criminal courts throughout","health. To promote public safety, they testify to their findings in civil and criminal courts throughout","health. To promote public safety, they testify to their findings in civil and criminal courts throughout","health. To promote public safety, they testify to their findings in civil and criminal courts throughout","health. To promote public safety, they testify to their findings in civil and criminal courts throughout","health. To promote public safety, they testify to their findings in civil and criminal courts throughout","health. To promote public safety, they testify to their findings in civil and criminal courts throughout","health. To promote public safety, they testify to their findings in civil and criminal courts throughout","health. To promote public safety, they testify to their findings in civil and criminal courts throughout","health. To promote public safety, they testify to their findings in civil and criminal courts throughout","health. To promote public safety, they testify to their findings in civil and criminal courts throughout","health. To promote public safety, they testify to their findings in civil and criminal courts throughout"
the Commonwealth. They advance public health through their investigations of deaths that present a,the Commonwealth. They advance public health through their investigations of deaths that present a,the Commonwealth. They advance public health through their investigations of deaths that present a,the Commonwealth. They advance public health through their investigations of deaths that present a,the Commonwealth. They advance public health through their investigations of deaths that present a,the Commonwealth. They advance public health through their investigations of deaths that present a,the Commonwealth. They advance public health through their investigations of deaths that present a,the Commonwealth. They advance public health through their investigations of deaths that present a,the Commonwealth. They advance public health through their investigations of deaths that present a,the Commonwealth. They advance public health through their investigations of deaths that present a,the Commonwealth. They advance public health through their investigations of deaths that present a,the Commonwealth. They advance public health through their investigations of deaths that present a,the Commonwealth. They advance public health through their investigations of deaths that present a,the Commonwealth. They advance public health through their investigations of deaths that present a,the Commonwealth. They advance public health through their investigations of deaths that present a,the Commonwealth. They advance public health through their investigations of deaths that present a,the Commonwealth. They advance public health through their investigations of deaths that present a,the Commonwealth. They advance public health through their investigations of deaths that present a
"hazard to Virginia’s citizens, such as emerging infections and bioterrorism.","hazard to Virginia’s citizens, such as emerging infections and bioterrorism.","hazard to Virginia’s citizens, such as emerging infections and bioterrorism.","hazard to Virginia’s citizens, such as emerging infections and bioterrorism.","hazard to Virginia’s citizens, such as emerging infections and bioterrorism.","hazard to Virginia’s citizens, such as emerging infections and bioterrorism.","hazard to Virginia’s citizens, such as emerging infections and bioterrorism.","hazard to Virginia’s citizens, such as emerging infections and bioterrorism.","hazard to Virginia’s citizens, such as emerging infections and bioterrorism.","hazard to Virginia’s citizens, such as emerging infections and bioterrorism.","hazard to Virginia’s citizens, such as emerging infections and bioterrorism.","hazard to Virginia’s citizens, such as emerging infections and bioterrorism.","hazard to Virginia’s citizens, such as emerging infections and bioterrorism.","hazard to Virginia’s citizens, such as emerging infections and bioterrorism.","hazard to Virginia’s citizens, such as emerging infections and bioterrorism.",,,
In addition to its central mission – conducting medico-legal death investigation to identify the cause,In addition to its central mission – conducting medico-legal death investigation to identify the cause,In addition to its central mission – conducting medico-legal death investigation to identify the cause,In addition to its central mission – conducting medico-legal death investigation to identify the cause,In addition to its central mission – conducting medico-legal death investigation to identify the cause,In addition to its central mission – conducting medico-legal death investigation to identify the cause,In addition to its central mission – conducting medico-legal death investigation to identify the cause,In addition to its central mission – conducting medico-legal death investigation to identify the cause,In addition to its central mission – conducting medico-legal death investigation to identify the cause,In addition to its central mission – conducting medico-legal death investigation to identify the cause,In addition to its central mission – conducting medico-legal death investigation to identify the cause,In addition to its central mission – conducting medico-legal death investigation to identify the cause,In addition to its central mission – conducting medico-legal death investigation to identify the cause,In addition to its central mission – conducting medico-legal death investigation to identify the cause,In addition to its central mission – conducting medico-legal death investigation to identify the cause,In addition to its central mission – conducting medico-legal death investigation to identify the cause,In addition to its central mission – conducting medico-legal death investigation to identify the cause,In addition to its central mission – conducting medico-legal death investigation to identify the cause
and manner of death – the OCME has another mission related to injury and violence prevention.,and manner of death – the OCME has another mission related to injury and violence prevention.,and manner of death – the OCME has another mission related to injury and violence prevention.,and manner of death – the OCME has another mission related to injury and violence prevention.,and manner of death – the OCME has another mission related to injury and violence prevention.,and manner of death – the OCME has another mission related to injury and violence prevention.,and manner of death – the OCME has another mission related to injury and violence prevention.,and manner of death – the OCME has another mission related to injury and violence prevention.,and manner of death – the OCME has another mission related to injury and violence prevention.,and manner of death – the OCME has another mission related to injury and violence prevention.,and manner of death – the OCME has another mission related to injury and violence prevention.,and manner of death – the OCME has another mission related to injury and violence prevention.,and manner of death – the OCME has another mission related to injury and violence prevention.,and manner of death – the OCME has another mission related to injury and violence prevention.,and manner of death – the OCME has another mission related to injury and violence prevention.,and manner of death – the OCME has another mission related to injury and violence prevention.,and manner of death – the OCME has another mission related to injury and violence prevention.,and manner of death – the OCME has another mission related to injury and violence prevention.
"The OCME houses four fatality review and surveillance projects, which are designed to:","The OCME houses four fatality review and surveillance projects, which are designed to:","The OCME houses four fatality review and surveillance projects, which are designed to:","The OCME houses four fatality review and surveillance projects, which are designed to:","The OCME houses four fatality review and surveillance projects, which are designed to:","The OCME houses four fatality review and surveillance projects, which are designed to:","The OCME houses four fatality review and surveillance projects, which are designed to:","The OCME houses four fatality review and surveillance projects, which are designed to:","The OCME houses four fatality review and surveillance projects, which are designed to:","The OCME houses four fatality review and surveillance projects, which are designed to:","The OCME houses four fatality review and surveillance projects, which are designed to:","The OCME houses four fatality review and surveillance projects, which are designed to:","The OCME houses four fatality review and surveillance projects, which are designed to:","The OCME houses four fatality review and surveillance projects, which are designed to:","The OCME houses four fatality review and surveillance projects, which are designed to:","The OCME houses four fatality review and surveillance projects, which are designed to:",,
•,understand the circumstances of death.,understand the circumstances of death.,understand the circumstances of death.,understand the circumstances of death.,understand the circumstances of death.,understand the circumstances of death.,understand the circumstances of death.,understand the circumstances of death.,understand the circumstances of death.,,,,,,,,
•,"provide information to legislators, policy makers, and other","provide information to legislators, policy makers, and other","provide information to legislators, policy makers, and other","provide information to legislators, policy makers, and other","provide information to legislators, policy makers, and other","provide information to legislators, policy makers, and other","provide information to legislators, policy makers, and other","provide information to legislators, policy makers, and other","provide information to legislators, policy makers, and other","provide information to legislators, policy makers, and other","provide information to legislators, policy makers, and other","provide information to legislators, policy makers, and other",advocates for injury prevention.,advocates for injury prevention.,advocates for injury prevention.,advocates for injury prevention.,advocates for injury prevention.
•,make direct recommendations for prevention and intervention.,make direct recommendations for prevention and intervention.,make direct recommendations for prevention and intervention.,make direct recommendations for prevention and intervention.,make direct recommendations for prevention and intervention.,make direct recommendations for prevention and intervention.,make direct recommendations for prevention and intervention.,make direct recommendations for prevention and intervention.,make direct recommendations for prevention and intervention.,make direct recommendations for prevention and intervention.,make direct recommendations for prevention and intervention.,make direct recommendations for prevention and intervention.,make direct recommendations for prevention and intervention.,,,,
•,measure the impact of prevention programs and practices.,measure the impact of prevention programs and practices.,measure the impact of prevention programs and practices.,measure the impact of prevention programs and practices.,measure the impact of prevention programs and practices.,measure the impact of prevention programs and practices.,measure the impact of prevention programs and practices.,measure the impact of prevention programs and practices.,measure the impact of prevention programs and practices.,measure the impact of prevention programs and practices.,measure the impact of prevention programs and practices.,measure the impact of prevention programs and practices.,,,,,
•,make something good come from the violence and destruction of human life.,make something good come from the violence and destruction of human life.,make something good come from the violence and destruction of human life.,make something good come from the violence and destruction of human life.,make something good come from the violence and destruction of human life.,make something good come from the violence and destruction of human life.,make something good come from the violence and destruction of human life.,make something good come from the violence and destruction of human life.,make something good come from the violence and destruction of human life.,make something good come from the violence and destruction of human life.,make something good come from the violence and destruction of human life.,make something good come from the violence and destruction of human life.,make something good come from the violence and destruction of human life.,make something good come from the violence and destruction of human life.,,,
The,Child,Fatality,Review,Review,Team,Team,was,established,established,established,by,the,Virginia,General,Assembly,and,the
Governor,of,Virginia.,Virginia.,Working,Working,in,the,spirit,spirit,of,public,"health,",this,Team,reviews,violent,and
unexpected child deaths and develops consensus recommendations to prevent similar deaths in the,unexpected child deaths and develops consensus recommendations to prevent similar deaths in the,unexpected child deaths and develops consensus recommendations to prevent similar deaths in the,unexpected child deaths and develops consensus recommendations to prevent similar deaths in the,unexpected child deaths and develops consensus recommendations to prevent similar deaths in the,unexpected child deaths and develops consensus recommendations to prevent similar deaths in the,unexpected child deaths and develops consensus recommendations to prevent similar deaths in the,unexpected child deaths and develops consensus recommendations to prevent similar deaths in the,unexpected child deaths and develops consensus recommendations to prevent similar deaths in the,unexpected child deaths and develops consensus recommendations to prevent similar deaths in the,unexpected child deaths and develops consensus recommendations to prevent similar deaths in the,unexpected child deaths and develops consensus recommendations to prevent similar deaths in the,unexpected child deaths and develops consensus recommendations to prevent similar deaths in the,unexpected child deaths and develops consensus recommendations to prevent similar deaths in the,unexpected child deaths and develops consensus recommendations to prevent similar deaths in the,unexpected child deaths and develops consensus recommendations to prevent similar deaths in the,unexpected child deaths and develops consensus recommendations to prevent similar deaths in the,unexpected child deaths and develops consensus recommendations to prevent similar deaths in the
