future.,"It is a multidisciplinary Team with representatives from pediatrics, child psychiatry, law","It is a multidisciplinary Team with representatives from pediatrics, child psychiatry, law","It is a multidisciplinary Team with representatives from pediatrics, child psychiatry, law","It is a multidisciplinary Team with representatives from pediatrics, child psychiatry, law","It is a multidisciplinary Team with representatives from pediatrics, child psychiatry, law","It is a multidisciplinary Team with representatives from pediatrics, child psychiatry, law","It is a multidisciplinary Team with representatives from pediatrics, child psychiatry, law","It is a multidisciplinary Team with representatives from pediatrics, child psychiatry, law","It is a multidisciplinary Team with representatives from pediatrics, child psychiatry, law","It is a multidisciplinary Team with representatives from pediatrics, child psychiatry, law","It is a multidisciplinary Team with representatives from pediatrics, child psychiatry, law","It is a multidisciplinary Team with representatives from pediatrics, child psychiatry, law","It is a multidisciplinary Team with representatives from pediatrics, child psychiatry, law","It is a multidisciplinary Team with representatives from pediatrics, child psychiatry, law","It is a multidisciplinary Team with representatives from pediatrics, child psychiatry, law","It is a multidisciplinary Team with representatives from pediatrics, child psychiatry, law","It is a multidisciplinary Team with representatives from pediatrics, child psychiatry, law"
"enforcement,","enforcement,",social,"services,","services,",forensic,forensic,forensic,"pathology,","pathology,","pathology,",commonwealth’s,commonwealth’s,commonwealth’s,"attorneys,",local,fire,and
"emergency medical services providers, the Virginia SIDS alliance, and state agencies.","emergency medical services providers, the Virginia SIDS alliance, and state agencies.","emergency medical services providers, the Virginia SIDS alliance, and state agencies.","emergency medical services providers, the Virginia SIDS alliance, and state agencies.","emergency medical services providers, the Virginia SIDS alliance, and state agencies.","emergency medical services providers, the Virginia SIDS alliance, and state agencies.","emergency medical services providers, the Virginia SIDS alliance, and state agencies.","emergency medical services providers, the Virginia SIDS alliance, and state agencies.","emergency medical services providers, the Virginia SIDS alliance, and state agencies.","emergency medical services providers, the Virginia SIDS alliance, and state agencies.","emergency medical services providers, the Virginia SIDS alliance, and state agencies.","emergency medical services providers, the Virginia SIDS alliance, and state agencies.","emergency medical services providers, the Virginia SIDS alliance, and state agencies.","emergency medical services providers, the Virginia SIDS alliance, and state agencies.","emergency medical services providers, the Virginia SIDS alliance, and state agencies.","emergency medical services providers, the Virginia SIDS alliance, and state agencies.",Published,Published
reports are available at www.vdh.state.va.us/medexam/Fatalreview.asp.,reports are available at www.vdh.state.va.us/medexam/Fatalreview.asp.,reports are available at www.vdh.state.va.us/medexam/Fatalreview.asp.,reports are available at www.vdh.state.va.us/medexam/Fatalreview.asp.,reports are available at www.vdh.state.va.us/medexam/Fatalreview.asp.,reports are available at www.vdh.state.va.us/medexam/Fatalreview.asp.,reports are available at www.vdh.state.va.us/medexam/Fatalreview.asp.,reports are available at www.vdh.state.va.us/medexam/Fatalreview.asp.,reports are available at www.vdh.state.va.us/medexam/Fatalreview.asp.,reports are available at www.vdh.state.va.us/medexam/Fatalreview.asp.,reports are available at www.vdh.state.va.us/medexam/Fatalreview.asp.,reports are available at www.vdh.state.va.us/medexam/Fatalreview.asp.,reports are available at www.vdh.state.va.us/medexam/Fatalreview.asp.,reports are available at www.vdh.state.va.us/medexam/Fatalreview.asp.,,,,
,,,,,,,,,,"Virginia Department of Health, Office of the Chief Medical Examiner  November 2004","Virginia Department of Health, Office of the Chief Medical Examiner  November 2004","Virginia Department of Health, Office of the Chief Medical Examiner  November 2004","Virginia Department of Health, Office of the Chief Medical Examiner  November 2004","Virginia Department of Health, Office of the Chief Medical Examiner  November 2004","Virginia Department of Health, Office of the Chief Medical Examiner  November 2004","Virginia Department of Health, Office of the Chief Medical Examiner  November 2004","Virginia Department of Health, Office of the Chief Medical Examiner  November 2004"
,,,,,,,,,,,,,,,,Page 3,Page 3
