Name: “Table 1 of 1 on page 7 of 87”,Name: “Table 1 of 1 on page 7 of 87”,Name: “Table 1 of 1 on page 7 of 87”,Name: “Table 1 of 1 on page 7 of 87”,Name: “Table 1 of 1 on page 7 of 87”,Name: “Table 1 of 1 on page 7 of 87”,Name: “Table 1 of 1 on page 7 of 87”,Name: “Table 1 of 1 on page 7 of 87”,Name: “Table 1 of 1 on page 7 of 87”,Name: “Table 1 of 1 on page 7 of 87”,Name: “Table 1 of 1 on page 7 of 87”,Name: “Table 1 of 1 on page 7 of 87”,Name: “Table 1 of 1 on page 7 of 87”,Name: “Table 1 of 1 on page 7 of 87”,Name: “Table 1 of 1 on page 7 of 87”,Name: “Table 1 of 1 on page 7 of 87”,Name: “Table 1 of 1 on page 7 of 87”
Table: 7,Table: 7,Table: 7,Table: 7,Table: 7,Table: 7,Table: 7,Table: 7,Table: 7,Table: 7,Table: 7,Table: 7,Table: 7,Table: 7,Table: 7,Table: 7,Table: 7
,,,,,,,,,,,,,,,,
SECTION 1: OVERVIEW – OFFICE OF THE CHIEF MEDICAL EXAMINER,SECTION 1: OVERVIEW – OFFICE OF THE CHIEF MEDICAL EXAMINER,SECTION 1: OVERVIEW – OFFICE OF THE CHIEF MEDICAL EXAMINER,SECTION 1: OVERVIEW – OFFICE OF THE CHIEF MEDICAL EXAMINER,SECTION 1: OVERVIEW – OFFICE OF THE CHIEF MEDICAL EXAMINER,SECTION 1: OVERVIEW – OFFICE OF THE CHIEF MEDICAL EXAMINER,SECTION 1: OVERVIEW – OFFICE OF THE CHIEF MEDICAL EXAMINER,SECTION 1: OVERVIEW – OFFICE OF THE CHIEF MEDICAL EXAMINER,SECTION 1: OVERVIEW – OFFICE OF THE CHIEF MEDICAL EXAMINER,SECTION 1: OVERVIEW – OFFICE OF THE CHIEF MEDICAL EXAMINER,SECTION 1: OVERVIEW – OFFICE OF THE CHIEF MEDICAL EXAMINER,SECTION 1: OVERVIEW – OFFICE OF THE CHIEF MEDICAL EXAMINER,SECTION 1: OVERVIEW – OFFICE OF THE CHIEF MEDICAL EXAMINER,SECTION 1: OVERVIEW – OFFICE OF THE CHIEF MEDICAL EXAMINER,SECTION 1: OVERVIEW – OFFICE OF THE CHIEF MEDICAL EXAMINER,SECTION 1: OVERVIEW – OFFICE OF THE CHIEF MEDICAL EXAMINER,SECTION 1: OVERVIEW – OFFICE OF THE CHIEF MEDICAL EXAMINER
"In 1946, Virginia became one of the first states to institute a statewide medical examiner system. In","In 1946, Virginia became one of the first states to institute a statewide medical examiner system. In","In 1946, Virginia became one of the first states to institute a statewide medical examiner system. In","In 1946, Virginia became one of the first states to institute a statewide medical examiner system. In","In 1946, Virginia became one of the first states to institute a statewide medical examiner system. In","In 1946, Virginia became one of the first states to institute a statewide medical examiner system. In","In 1946, Virginia became one of the first states to institute a statewide medical examiner system. In","In 1946, Virginia became one of the first states to institute a statewide medical examiner system. In","In 1946, Virginia became one of the first states to institute a statewide medical examiner system. In","In 1946, Virginia became one of the first states to institute a statewide medical examiner system. In","In 1946, Virginia became one of the first states to institute a statewide medical examiner system. In","In 1946, Virginia became one of the first states to institute a statewide medical examiner system. In","In 1946, Virginia became one of the first states to institute a statewide medical examiner system. In","In 1946, Virginia became one of the first states to institute a statewide medical examiner system. In","In 1946, Virginia became one of the first states to institute a statewide medical examiner system. In","In 1946, Virginia became one of the first states to institute a statewide medical examiner system. In","In 1946, Virginia became one of the first states to institute a statewide medical examiner system. In"
that,"year,",the,General,Assembly,of,Virginia,abolished,abolished,the,Office,of,Coroner’s,Physician,Physician,and,and
"appointed a Chief Medical Examiner. Four years later, in 1950, the OCME became a division within","appointed a Chief Medical Examiner. Four years later, in 1950, the OCME became a division within","appointed a Chief Medical Examiner. Four years later, in 1950, the OCME became a division within","appointed a Chief Medical Examiner. Four years later, in 1950, the OCME became a division within","appointed a Chief Medical Examiner. Four years later, in 1950, the OCME became a division within","appointed a Chief Medical Examiner. Four years later, in 1950, the OCME became a division within","appointed a Chief Medical Examiner. Four years later, in 1950, the OCME became a division within","appointed a Chief Medical Examiner. Four years later, in 1950, the OCME became a division within","appointed a Chief Medical Examiner. Four years later, in 1950, the OCME became a division within","appointed a Chief Medical Examiner. Four years later, in 1950, the OCME became a division within","appointed a Chief Medical Examiner. Four years later, in 1950, the OCME became a division within","appointed a Chief Medical Examiner. Four years later, in 1950, the OCME became a division within","appointed a Chief Medical Examiner. Four years later, in 1950, the OCME became a division within","appointed a Chief Medical Examiner. Four years later, in 1950, the OCME became a division within","appointed a Chief Medical Examiner. Four years later, in 1950, the OCME became a division within","appointed a Chief Medical Examiner. Four years later, in 1950, the OCME became a division within","appointed a Chief Medical Examiner. Four years later, in 1950, the OCME became a division within"
the Virginia Department of Health.,the Virginia Department of Health.,the Virginia Department of Health.,the Virginia Department of Health.,the Virginia Department of Health.,,,,,,,,,,,,
"Pursuant to § 32.1-283 of the Code of Virginia, all of the following deaths are investigated by the OCME:","Pursuant to § 32.1-283 of the Code of Virginia, all of the following deaths are investigated by the OCME:","Pursuant to § 32.1-283 of the Code of Virginia, all of the following deaths are investigated by the OCME:","Pursuant to § 32.1-283 of the Code of Virginia, all of the following deaths are investigated by the OCME:","Pursuant to § 32.1-283 of the Code of Virginia, all of the following deaths are investigated by the OCME:","Pursuant to § 32.1-283 of the Code of Virginia, all of the following deaths are investigated by the OCME:","Pursuant to § 32.1-283 of the Code of Virginia, all of the following deaths are investigated by the OCME:","Pursuant to § 32.1-283 of the Code of Virginia, all of the following deaths are investigated by the OCME:","Pursuant to § 32.1-283 of the Code of Virginia, all of the following deaths are investigated by the OCME:","Pursuant to § 32.1-283 of the Code of Virginia, all of the following deaths are investigated by the OCME:","Pursuant to § 32.1-283 of the Code of Virginia, all of the following deaths are investigated by the OCME:","Pursuant to § 32.1-283 of the Code of Virginia, all of the following deaths are investigated by the OCME:","Pursuant to § 32.1-283 of the Code of Virginia, all of the following deaths are investigated by the OCME:","Pursuant to § 32.1-283 of the Code of Virginia, all of the following deaths are investigated by the OCME:","Pursuant to § 32.1-283 of the Code of Virginia, all of the following deaths are investigated by the OCME:","Pursuant to § 32.1-283 of the Code of Virginia, all of the following deaths are investigated by the OCME:","Pursuant to § 32.1-283 of the Code of Virginia, all of the following deaths are investigated by the OCME:"
•,"any death from trauma, injury, violence, or poisoning attributable to accident, suicide or","any death from trauma, injury, violence, or poisoning attributable to accident, suicide or","any death from trauma, injury, violence, or poisoning attributable to accident, suicide or","any death from trauma, injury, violence, or poisoning attributable to accident, suicide or","any death from trauma, injury, violence, or poisoning attributable to accident, suicide or","any death from trauma, injury, violence, or poisoning attributable to accident, suicide or","any death from trauma, injury, violence, or poisoning attributable to accident, suicide or","any death from trauma, injury, violence, or poisoning attributable to accident, suicide or","any death from trauma, injury, violence, or poisoning attributable to accident, suicide or","any death from trauma, injury, violence, or poisoning attributable to accident, suicide or","any death from trauma, injury, violence, or poisoning attributable to accident, suicide or","any death from trauma, injury, violence, or poisoning attributable to accident, suicide or","any death from trauma, injury, violence, or poisoning attributable to accident, suicide or","any death from trauma, injury, violence, or poisoning attributable to accident, suicide or",,
,homicide;,homicide;,,,,,,,,,,,,,,
•,sudden deaths to persons in apparent good health or deaths unattended by a physician;,sudden deaths to persons in apparent good health or deaths unattended by a physician;,sudden deaths to persons in apparent good health or deaths unattended by a physician;,sudden deaths to persons in apparent good health or deaths unattended by a physician;,sudden deaths to persons in apparent good health or deaths unattended by a physician;,sudden deaths to persons in apparent good health or deaths unattended by a physician;,sudden deaths to persons in apparent good health or deaths unattended by a physician;,sudden deaths to persons in apparent good health or deaths unattended by a physician;,sudden deaths to persons in apparent good health or deaths unattended by a physician;,sudden deaths to persons in apparent good health or deaths unattended by a physician;,sudden deaths to persons in apparent good health or deaths unattended by a physician;,sudden deaths to persons in apparent good health or deaths unattended by a physician;,sudden deaths to persons in apparent good health or deaths unattended by a physician;,sudden deaths to persons in apparent good health or deaths unattended by a physician;,,
•,"deaths of persons in jail, prison, or another correctional institution, or in police custody","deaths of persons in jail, prison, or another correctional institution, or in police custody","deaths of persons in jail, prison, or another correctional institution, or in police custody","deaths of persons in jail, prison, or another correctional institution, or in police custody","deaths of persons in jail, prison, or another correctional institution, or in police custody","deaths of persons in jail, prison, or another correctional institution, or in police custody","deaths of persons in jail, prison, or another correctional institution, or in police custody","deaths of persons in jail, prison, or another correctional institution, or in police custody","deaths of persons in jail, prison, or another correctional institution, or in police custody","deaths of persons in jail, prison, or another correctional institution, or in police custody","deaths of persons in jail, prison, or another correctional institution, or in police custody","deaths of persons in jail, prison, or another correctional institution, or in police custody","deaths of persons in jail, prison, or another correctional institution, or in police custody","deaths of persons in jail, prison, or another correctional institution, or in police custody",,
,(this includes deaths from legal intervention);,(this includes deaths from legal intervention);,(this includes deaths from legal intervention);,(this includes deaths from legal intervention);,(this includes deaths from legal intervention);,(this includes deaths from legal intervention);,(this includes deaths from legal intervention);,(this includes deaths from legal intervention);,,,,,,,,
•,deaths of patients/residents of state mental health or mental retardation facilities;,deaths of patients/residents of state mental health or mental retardation facilities;,deaths of patients/residents of state mental health or mental retardation facilities;,deaths of patients/residents of state mental health or mental retardation facilities;,deaths of patients/residents of state mental health or mental retardation facilities;,deaths of patients/residents of state mental health or mental retardation facilities;,deaths of patients/residents of state mental health or mental retardation facilities;,deaths of patients/residents of state mental health or mental retardation facilities;,deaths of patients/residents of state mental health or mental retardation facilities;,deaths of patients/residents of state mental health or mental retardation facilities;,deaths of patients/residents of state mental health or mental retardation facilities;,deaths of patients/residents of state mental health or mental retardation facilities;,deaths of patients/residents of state mental health or mental retardation facilities;,,,
•,the sudden death of any infant less than eighteen months of age whose death might be,the sudden death of any infant less than eighteen months of age whose death might be,the sudden death of any infant less than eighteen months of age whose death might be,the sudden death of any infant less than eighteen months of age whose death might be,the sudden death of any infant less than eighteen months of age whose death might be,the sudden death of any infant less than eighteen months of age whose death might be,the sudden death of any infant less than eighteen months of age whose death might be,the sudden death of any infant less than eighteen months of age whose death might be,the sudden death of any infant less than eighteen months of age whose death might be,the sudden death of any infant less than eighteen months of age whose death might be,the sudden death of any infant less than eighteen months of age whose death might be,the sudden death of any infant less than eighteen months of age whose death might be,the sudden death of any infant less than eighteen months of age whose death might be,the sudden death of any infant less than eighteen months of age whose death might be,,
,attributable to Sudden Infant Death Syndrome; and,attributable to Sudden Infant Death Syndrome; and,attributable to Sudden Infant Death Syndrome; and,attributable to Sudden Infant Death Syndrome; and,attributable to Sudden Infant Death Syndrome; and,attributable to Sudden Infant Death Syndrome; and,attributable to Sudden Infant Death Syndrome; and,attributable to Sudden Infant Death Syndrome; and,,,,,,,,
•,"any other suspicious, unusual, or unnatural death.","any other suspicious, unusual, or unnatural death.","any other suspicious, unusual, or unnatural death.","any other suspicious, unusual, or unnatural death.","any other suspicious, unusual, or unnatural death.","any other suspicious, unusual, or unnatural death.","any other suspicious, unusual, or unnatural death.","any other suspicious, unusual, or unnatural death.",,,,,,,,
"In Virginia, medical examiners conduct a medicolegal death investigation, serving as the principal","In Virginia, medical examiners conduct a medicolegal death investigation, serving as the principal","In Virginia, medical examiners conduct a medicolegal death investigation, serving as the principal","In Virginia, medical examiners conduct a medicolegal death investigation, serving as the principal","In Virginia, medical examiners conduct a medicolegal death investigation, serving as the principal","In Virginia, medical examiners conduct a medicolegal death investigation, serving as the principal","In Virginia, medical examiners conduct a medicolegal death investigation, serving as the principal","In Virginia, medical examiners conduct a medicolegal death investigation, serving as the principal","In Virginia, medical examiners conduct a medicolegal death investigation, serving as the principal","In Virginia, medical examiners conduct a medicolegal death investigation, serving as the principal","In Virginia, medical examiners conduct a medicolegal death investigation, serving as the principal","In Virginia, medical examiners conduct a medicolegal death investigation, serving as the principal","In Virginia, medical examiners conduct a medicolegal death investigation, serving as the principal","In Virginia, medical examiners conduct a medicolegal death investigation, serving as the principal","In Virginia, medical examiners conduct a medicolegal death investigation, serving as the principal","In Virginia, medical examiners conduct a medicolegal death investigation, serving as the principal","In Virginia, medical examiners conduct a medicolegal death investigation, serving as the principal"
case investigator in their locality for deaths falling within their jurisdiction and statutory authority.,case investigator in their locality for deaths falling within their jurisdiction and statutory authority.,case investigator in their locality for deaths falling within their jurisdiction and statutory authority.,case investigator in their locality for deaths falling within their jurisdiction and statutory authority.,case investigator in their locality for deaths falling within their jurisdiction and statutory authority.,case investigator in their locality for deaths falling within their jurisdiction and statutory authority.,case investigator in their locality for deaths falling within their jurisdiction and statutory authority.,case investigator in their locality for deaths falling within their jurisdiction and statutory authority.,case investigator in their locality for deaths falling within their jurisdiction and statutory authority.,case investigator in their locality for deaths falling within their jurisdiction and statutory authority.,case investigator in their locality for deaths falling within their jurisdiction and statutory authority.,case investigator in their locality for deaths falling within their jurisdiction and statutory authority.,case investigator in their locality for deaths falling within their jurisdiction and statutory authority.,case investigator in their locality for deaths falling within their jurisdiction and statutory authority.,case investigator in their locality for deaths falling within their jurisdiction and statutory authority.,case investigator in their locality for deaths falling within their jurisdiction and statutory authority.,case investigator in their locality for deaths falling within their jurisdiction and statutory authority.
The,OCME,currently,supports,more,more,than,253,local,medical,"examiners,","examiners,",who,receive,the,initial,initial
notification of death and determine if the death should come under the jurisdiction of the medical,notification of death and determine if the death should come under the jurisdiction of the medical,notification of death and determine if the death should come under the jurisdiction of the medical,notification of death and determine if the death should come under the jurisdiction of the medical,notification of death and determine if the death should come under the jurisdiction of the medical,notification of death and determine if the death should come under the jurisdiction of the medical,notification of death and determine if the death should come under the jurisdiction of the medical,notification of death and determine if the death should come under the jurisdiction of the medical,notification of death and determine if the death should come under the jurisdiction of the medical,notification of death and determine if the death should come under the jurisdiction of the medical,notification of death and determine if the death should come under the jurisdiction of the medical,notification of death and determine if the death should come under the jurisdiction of the medical,notification of death and determine if the death should come under the jurisdiction of the medical,notification of death and determine if the death should come under the jurisdiction of the medical,notification of death and determine if the death should come under the jurisdiction of the medical,notification of death and determine if the death should come under the jurisdiction of the medical,notification of death and determine if the death should come under the jurisdiction of the medical
examiner.,examiner.,Local,medical,examiners,may,examine,examine,the,body,and,sign,the,certificate,of,death,on
"medical examiner cases or, using professionally established guidelines, refer certain classes of cases","medical examiner cases or, using professionally established guidelines, refer certain classes of cases","medical examiner cases or, using professionally established guidelines, refer certain classes of cases","medical examiner cases or, using professionally established guidelines, refer certain classes of cases","medical examiner cases or, using professionally established guidelines, refer certain classes of cases","medical examiner cases or, using professionally established guidelines, refer certain classes of cases","medical examiner cases or, using professionally established guidelines, refer certain classes of cases","medical examiner cases or, using professionally established guidelines, refer certain classes of cases","medical examiner cases or, using professionally established guidelines, refer certain classes of cases","medical examiner cases or, using professionally established guidelines, refer certain classes of cases","medical examiner cases or, using professionally established guidelines, refer certain classes of cases","medical examiner cases or, using professionally established guidelines, refer certain classes of cases","medical examiner cases or, using professionally established guidelines, refer certain classes of cases","medical examiner cases or, using professionally established guidelines, refer certain classes of cases","medical examiner cases or, using professionally established guidelines, refer certain classes of cases","medical examiner cases or, using professionally established guidelines, refer certain classes of cases","medical examiner cases or, using professionally established guidelines, refer certain classes of cases"
for more intensive death investigation and medicolegal autopsy.,for more intensive death investigation and medicolegal autopsy.,for more intensive death investigation and medicolegal autopsy.,for more intensive death investigation and medicolegal autopsy.,for more intensive death investigation and medicolegal autopsy.,for more intensive death investigation and medicolegal autopsy.,for more intensive death investigation and medicolegal autopsy.,for more intensive death investigation and medicolegal autopsy.,for more intensive death investigation and medicolegal autopsy.,for more intensive death investigation and medicolegal autopsy.,,,,,,,
"When an autopsy is required, it is conducted in one of four district offices: Northern, Tidewater,","When an autopsy is required, it is conducted in one of four district offices: Northern, Tidewater,","When an autopsy is required, it is conducted in one of four district offices: Northern, Tidewater,","When an autopsy is required, it is conducted in one of four district offices: Northern, Tidewater,","When an autopsy is required, it is conducted in one of four district offices: Northern, Tidewater,","When an autopsy is required, it is conducted in one of four district offices: Northern, Tidewater,","When an autopsy is required, it is conducted in one of four district offices: Northern, Tidewater,","When an autopsy is required, it is conducted in one of four district offices: Northern, Tidewater,","When an autopsy is required, it is conducted in one of four district offices: Northern, Tidewater,","When an autopsy is required, it is conducted in one of four district offices: Northern, Tidewater,","When an autopsy is required, it is conducted in one of four district offices: Northern, Tidewater,","When an autopsy is required, it is conducted in one of four district offices: Northern, Tidewater,","When an autopsy is required, it is conducted in one of four district offices: Northern, Tidewater,","When an autopsy is required, it is conducted in one of four district offices: Northern, Tidewater,","When an autopsy is required, it is conducted in one of four district offices: Northern, Tidewater,","When an autopsy is required, it is conducted in one of four district offices: Northern, Tidewater,","When an autopsy is required, it is conducted in one of four district offices: Northern, Tidewater,"
Central,or,Western.,Each,district,is,staffed,staffed,by,board,certified,forensic,forensic,"pathologists,","pathologists,",death,death
