Name: “Table 1 of 1 on page 75 of 92”,Name: “Table 1 of 1 on page 75 of 92”,Name: “Table 1 of 1 on page 75 of 92”,Name: “Table 1 of 1 on page 75 of 92”,Name: “Table 1 of 1 on page 75 of 92”,Name: “Table 1 of 1 on page 75 of 92”,Name: “Table 1 of 1 on page 75 of 92”,Name: “Table 1 of 1 on page 75 of 92”,Name: “Table 1 of 1 on page 75 of 92”,Name: “Table 1 of 1 on page 75 of 92”,Name: “Table 1 of 1 on page 75 of 92”,Name: “Table 1 of 1 on page 75 of 92”,Name: “Table 1 of 1 on page 75 of 92”,Name: “Table 1 of 1 on page 75 of 92”,Name: “Table 1 of 1 on page 75 of 92”,Name: “Table 1 of 1 on page 75 of 92”,Name: “Table 1 of 1 on page 75 of 92”,Name: “Table 1 of 1 on page 75 of 92”,Name: “Table 1 of 1 on page 75 of 92”,Name: “Table 1 of 1 on page 75 of 92”,Name: “Table 1 of 1 on page 75 of 92”,Name: “Table 1 of 1 on page 75 of 92”
Table: 73,Table: 73,Table: 73,Table: 73,Table: 73,Table: 73,Table: 73,Table: 73,Table: 73,Table: 73,Table: 73,Table: 73,Table: 73,Table: 73,Table: 73,Table: 73,Table: 73,Table: 73,Table: 73,Table: 73,Table: 73,Table: 73
,,,,,,,,,,,,,,,,,,,,,
,,,,,,,,,,,,,,,,,Recommendations of the Commission,Recommendations of the Commission,Recommendations of the Commission,,75
An offender who scores eight points or less on Section A is then scored on Section B,An offender who scores eight points or less on Section A is then scored on Section B,An offender who scores eight points or less on Section A is then scored on Section B,An offender who scores eight points or less on Section A is then scored on Section B,An offender who scores eight points or less on Section A is then scored on Section B,An offender who scores eight points or less on Section A is then scored on Section B,An offender who scores eight points or less on Section A is then scored on Section B,An offender who scores eight points or less on Section A is then scored on Section B,An offender who scores eight points or less on Section A is then scored on Section B,An offender who scores eight points or less on Section A is then scored on Section B,An offender who scores eight points or less on Section A is then scored on Section B,An offender who scores eight points or less on Section A is then scored on Section B,An offender who scores eight points or less on Section A is then scored on Section B,An offender who scores eight points or less on Section A is then scored on Section B,An offender who scores eight points or less on Section A is then scored on Section B,,,,,,,
"of the guidelines, which will determine if he will be recommended for probation without","of the guidelines, which will determine if he will be recommended for probation without","of the guidelines, which will determine if he will be recommended for probation without","of the guidelines, which will determine if he will be recommended for probation without","of the guidelines, which will determine if he will be recommended for probation without","of the guidelines, which will determine if he will be recommended for probation without","of the guidelines, which will determine if he will be recommended for probation without","of the guidelines, which will determine if he will be recommended for probation without","of the guidelines, which will determine if he will be recommended for probation without","of the guidelines, which will determine if he will be recommended for probation without","of the guidelines, which will determine if he will be recommended for probation without","of the guidelines, which will determine if he will be recommended for probation without","of the guidelines, which will determine if he will be recommended for probation without","of the guidelines, which will determine if he will be recommended for probation without","of the guidelines, which will determine if he will be recommended for probation without",,,,,,,
an active term of incarceration or a jail term of up to six months.,an active term of incarceration or a jail term of up to six months.,an active term of incarceration or a jail term of up to six months.,an active term of incarceration or a jail term of up to six months.,an active term of incarceration or a jail term of up to six months.,an active term of incarceration or a jail term of up to six months.,an active term of incarceration or a jail term of up to six months.,an active term of incarceration or a jail term of up to six months.,an active term of incarceration or a jail term of up to six months.,an active term of incarceration or a jail term of up to six months.,an active term of incarceration or a jail term of up to six months.,On Section B of the,On Section B of the,On Section B of the,On Section B of the,,,,,,,
"proposed guidelines (Figure 47), offenders convicted of Registry violations will be","proposed guidelines (Figure 47), offenders convicted of Registry violations will be","proposed guidelines (Figure 47), offenders convicted of Registry violations will be","proposed guidelines (Figure 47), offenders convicted of Registry violations will be","proposed guidelines (Figure 47), offenders convicted of Registry violations will be","proposed guidelines (Figure 47), offenders convicted of Registry violations will be","proposed guidelines (Figure 47), offenders convicted of Registry violations will be","proposed guidelines (Figure 47), offenders convicted of Registry violations will be","proposed guidelines (Figure 47), offenders convicted of Registry violations will be","proposed guidelines (Figure 47), offenders convicted of Registry violations will be","proposed guidelines (Figure 47), offenders convicted of Registry violations will be","proposed guidelines (Figure 47), offenders convicted of Registry violations will be","proposed guidelines (Figure 47), offenders convicted of Registry violations will be","proposed guidelines (Figure 47), offenders convicted of Registry violations will be","proposed guidelines (Figure 47), offenders convicted of Registry violations will be",,,,,,,
assigned points for the Primary Offense factor based on the specific Registry violation,assigned points for the Primary Offense factor based on the specific Registry violation,assigned points for the Primary Offense factor based on the specific Registry violation,assigned points for the Primary Offense factor based on the specific Registry violation,assigned points for the Primary Offense factor based on the specific Registry violation,assigned points for the Primary Offense factor based on the specific Registry violation,assigned points for the Primary Offense factor based on the specific Registry violation,assigned points for the Primary Offense factor based on the specific Registry violation,assigned points for the Primary Offense factor based on the specific Registry violation,assigned points for the Primary Offense factor based on the specific Registry violation,assigned points for the Primary Offense factor based on the specific Registry violation,assigned points for the Primary Offense factor based on the specific Registry violation,assigned points for the Primary Offense factor based on the specific Registry violation,assigned points for the Primary Offense factor based on the specific Registry violation,assigned points for the Primary Offense factor based on the specific Registry violation,,,,,,,
for which they were convicted.,for which they were convicted.,for which they were convicted.,for which they were convicted.,for which they were convicted.,for which they were convicted.,An offender not defined as sexually violent per,An offender not defined as sexually violent per,An offender not defined as sexually violent per,An offender not defined as sexually violent per,An offender not defined as sexually violent per,An offender not defined as sexually violent per,An offender not defined as sexually violent per,An offender not defined as sexually violent per,An offender not defined as sexually violent per,,,,,,,
§ 9.1-902 who is convicted of a second or subsequent Registry violation will receive,§ 9.1-902 who is convicted of a second or subsequent Registry violation will receive,§ 9.1-902 who is convicted of a second or subsequent Registry violation will receive,§ 9.1-902 who is convicted of a second or subsequent Registry violation will receive,§ 9.1-902 who is convicted of a second or subsequent Registry violation will receive,§ 9.1-902 who is convicted of a second or subsequent Registry violation will receive,§ 9.1-902 who is convicted of a second or subsequent Registry violation will receive,§ 9.1-902 who is convicted of a second or subsequent Registry violation will receive,§ 9.1-902 who is convicted of a second or subsequent Registry violation will receive,§ 9.1-902 who is convicted of a second or subsequent Registry violation will receive,§ 9.1-902 who is convicted of a second or subsequent Registry violation will receive,§ 9.1-902 who is convicted of a second or subsequent Registry violation will receive,§ 9.1-902 who is convicted of a second or subsequent Registry violation will receive,§ 9.1-902 who is convicted of a second or subsequent Registry violation will receive,§ 9.1-902 who is convicted of a second or subsequent Registry violation will receive,,,,,,,
seven points.,seven points.,"However, an offender defined as sexually violent per § 9.1-902 who is","However, an offender defined as sexually violent per § 9.1-902 who is","However, an offender defined as sexually violent per § 9.1-902 who is","However, an offender defined as sexually violent per § 9.1-902 who is","However, an offender defined as sexually violent per § 9.1-902 who is","However, an offender defined as sexually violent per § 9.1-902 who is","However, an offender defined as sexually violent per § 9.1-902 who is","However, an offender defined as sexually violent per § 9.1-902 who is","However, an offender defined as sexually violent per § 9.1-902 who is","However, an offender defined as sexually violent per § 9.1-902 who is","However, an offender defined as sexually violent per § 9.1-902 who is","However, an offender defined as sexually violent per § 9.1-902 who is","However, an offender defined as sexually violent per § 9.1-902 who is",,,,,,,
convicted of a Registry violation for the first time will receive eight points. A sexually,convicted of a Registry violation for the first time will receive eight points. A sexually,convicted of a Registry violation for the first time will receive eight points. A sexually,convicted of a Registry violation for the first time will receive eight points. A sexually,convicted of a Registry violation for the first time will receive eight points. A sexually,convicted of a Registry violation for the first time will receive eight points. A sexually,convicted of a Registry violation for the first time will receive eight points. A sexually,convicted of a Registry violation for the first time will receive eight points. A sexually,convicted of a Registry violation for the first time will receive eight points. A sexually,convicted of a Registry violation for the first time will receive eight points. A sexually,convicted of a Registry violation for the first time will receive eight points. A sexually,convicted of a Registry violation for the first time will receive eight points. A sexually,convicted of a Registry violation for the first time will receive eight points. A sexually,convicted of a Registry violation for the first time will receive eight points. A sexually,convicted of a Registry violation for the first time will receive eight points. A sexually,,,,,,,
violent offender convicted of a second or subsequent Registry violation will receive,violent offender convicted of a second or subsequent Registry violation will receive,violent offender convicted of a second or subsequent Registry violation will receive,violent offender convicted of a second or subsequent Registry violation will receive,violent offender convicted of a second or subsequent Registry violation will receive,violent offender convicted of a second or subsequent Registry violation will receive,violent offender convicted of a second or subsequent Registry violation will receive,violent offender convicted of a second or subsequent Registry violation will receive,violent offender convicted of a second or subsequent Registry violation will receive,violent offender convicted of a second or subsequent Registry violation will receive,violent offender convicted of a second or subsequent Registry violation will receive,violent offender convicted of a second or subsequent Registry violation will receive,violent offender convicted of a second or subsequent Registry violation will receive,violent offender convicted of a second or subsequent Registry violation will receive,violent offender convicted of a second or subsequent Registry violation will receive,,,,,,,
nine points.,nine points.,Because Registry violators will always be given a point on Section B for,Because Registry violators will always be given a point on Section B for,Because Registry violators will always be given a point on Section B for,Because Registry violators will always be given a point on Section B for,Because Registry violators will always be given a point on Section B for,Because Registry violators will always be given a point on Section B for,Because Registry violators will always be given a point on Section B for,Because Registry violators will always be given a point on Section B for,Because Registry violators will always be given a point on Section B for,Because Registry violators will always be given a point on Section B for,Because Registry violators will always be given a point on Section B for,Because Registry violators will always be given a point on Section B for,Because Registry violators will always be given a point on Section B for,,,,,,,
"being legally restrained, sexually violent offenders convicted of a second or subsequent","being legally restrained, sexually violent offenders convicted of a second or subsequent","being legally restrained, sexually violent offenders convicted of a second or subsequent","being legally restrained, sexually violent offenders convicted of a second or subsequent","being legally restrained, sexually violent offenders convicted of a second or subsequent","being legally restrained, sexually violent offenders convicted of a second or subsequent","being legally restrained, sexually violent offenders convicted of a second or subsequent","being legally restrained, sexually violent offenders convicted of a second or subsequent","being legally restrained, sexually violent offenders convicted of a second or subsequent","being legally restrained, sexually violent offenders convicted of a second or subsequent","being legally restrained, sexually violent offenders convicted of a second or subsequent","being legally restrained, sexually violent offenders convicted of a second or subsequent","being legally restrained, sexually violent offenders convicted of a second or subsequent","being legally restrained, sexually violent offenders convicted of a second or subsequent","being legally restrained, sexually violent offenders convicted of a second or subsequent",,,,,,,
Registry violation will accumulate enough points such that they will always be,Registry violation will accumulate enough points such that they will always be,Registry violation will accumulate enough points such that they will always be,Registry violation will accumulate enough points such that they will always be,Registry violation will accumulate enough points such that they will always be,Registry violation will accumulate enough points such that they will always be,Registry violation will accumulate enough points such that they will always be,Registry violation will accumulate enough points such that they will always be,Registry violation will accumulate enough points such that they will always be,Registry violation will accumulate enough points such that they will always be,Registry violation will accumulate enough points such that they will always be,Registry violation will accumulate enough points such that they will always be,Registry violation will accumulate enough points such that they will always be,Registry violation will accumulate enough points such that they will always be,Registry violation will accumulate enough points such that they will always be,,,,,,,
"recommended for a jail term of up to six months, regardless of any other points scored","recommended for a jail term of up to six months, regardless of any other points scored","recommended for a jail term of up to six months, regardless of any other points scored","recommended for a jail term of up to six months, regardless of any other points scored","recommended for a jail term of up to six months, regardless of any other points scored","recommended for a jail term of up to six months, regardless of any other points scored","recommended for a jail term of up to six months, regardless of any other points scored","recommended for a jail term of up to six months, regardless of any other points scored","recommended for a jail term of up to six months, regardless of any other points scored","recommended for a jail term of up to six months, regardless of any other points scored","recommended for a jail term of up to six months, regardless of any other points scored","recommended for a jail term of up to six months, regardless of any other points scored","recommended for a jail term of up to six months, regardless of any other points scored","recommended for a jail term of up to six months, regardless of any other points scored","recommended for a jail term of up to six months, regardless of any other points scored",,,,,,,
on the worksheet.,on the worksheet.,on the worksheet.,on the worksheet.,"The remaining factors on Section B, with the exception of the last","The remaining factors on Section B, with the exception of the last","The remaining factors on Section B, with the exception of the last","The remaining factors on Section B, with the exception of the last","The remaining factors on Section B, with the exception of the last","The remaining factors on Section B, with the exception of the last","The remaining factors on Section B, with the exception of the last","The remaining factors on Section B, with the exception of the last","The remaining factors on Section B, with the exception of the last","The remaining factors on Section B, with the exception of the last","The remaining factors on Section B, with the exception of the last",,,,,,,
"factor, will be scored as they currently appear on the Worksheet.","factor, will be scored as they currently appear on the Worksheet.","factor, will be scored as they currently appear on the Worksheet.","factor, will be scored as they currently appear on the Worksheet.","factor, will be scored as they currently appear on the Worksheet.","factor, will be scored as they currently appear on the Worksheet.","factor, will be scored as they currently appear on the Worksheet.","factor, will be scored as they currently appear on the Worksheet.","factor, will be scored as they currently appear on the Worksheet.","factor, will be scored as they currently appear on the Worksheet.","factor, will be scored as they currently appear on the Worksheet.",The last factor on,The last factor on,The last factor on,The last factor on,,,,,,,
"Section B, which is currently scored only if the primary offense is felony vandalism","Section B, which is currently scored only if the primary offense is felony vandalism","Section B, which is currently scored only if the primary offense is felony vandalism","Section B, which is currently scored only if the primary offense is felony vandalism","Section B, which is currently scored only if the primary offense is felony vandalism","Section B, which is currently scored only if the primary offense is felony vandalism","Section B, which is currently scored only if the primary offense is felony vandalism","Section B, which is currently scored only if the primary offense is felony vandalism","Section B, which is currently scored only if the primary offense is felony vandalism","Section B, which is currently scored only if the primary offense is felony vandalism","Section B, which is currently scored only if the primary offense is felony vandalism","Section B, which is currently scored only if the primary offense is felony vandalism","Section B, which is currently scored only if the primary offense is felony vandalism","Section B, which is currently scored only if the primary offense is felony vandalism","Section B, which is currently scored only if the primary offense is felony vandalism",,,,,,,
"with damage to property of $1,000 or more, will be expanded so that Registry violators","with damage to property of $1,000 or more, will be expanded so that Registry violators","with damage to property of $1,000 or more, will be expanded so that Registry violators","with damage to property of $1,000 or more, will be expanded so that Registry violators","with damage to property of $1,000 or more, will be expanded so that Registry violators","with damage to property of $1,000 or more, will be expanded so that Registry violators","with damage to property of $1,000 or more, will be expanded so that Registry violators","with damage to property of $1,000 or more, will be expanded so that Registry violators","with damage to property of $1,000 or more, will be expanded so that Registry violators","with damage to property of $1,000 or more, will be expanded so that Registry violators","with damage to property of $1,000 or more, will be expanded so that Registry violators","with damage to property of $1,000 or more, will be expanded so that Registry violators","with damage to property of $1,000 or more, will be expanded so that Registry violators","with damage to property of $1,000 or more, will be expanded so that Registry violators","with damage to property of $1,000 or more, will be expanded so that Registry violators",,,,,,,
will also be scored on this factor.,will also be scored on this factor.,will also be scored on this factor.,will also be scored on this factor.,will also be scored on this factor.,will also be scored on this factor.,"Here, Registry violators who have a prior adult","Here, Registry violators who have a prior adult","Here, Registry violators who have a prior adult","Here, Registry violators who have a prior adult","Here, Registry violators who have a prior adult","Here, Registry violators who have a prior adult","Here, Registry violators who have a prior adult","Here, Registry violators who have a prior adult","Here, Registry violators who have a prior adult",,,,,,,
incarceration or juvenile commitment will receive one point.,incarceration or juvenile commitment will receive one point.,incarceration or juvenile commitment will receive one point.,incarceration or juvenile commitment will receive one point.,incarceration or juvenile commitment will receive one point.,incarceration or juvenile commitment will receive one point.,incarceration or juvenile commitment will receive one point.,incarceration or juvenile commitment will receive one point.,incarceration or juvenile commitment will receive one point.,incarceration or juvenile commitment will receive one point.,incarceration or juvenile commitment will receive one point.,,,,,,,,,,,
Figure 47,Figure 47,,,,,,,,,,,,,,,,,,,,
Proposed,Proposed,Changes,Changes,to,Drug/Other,Section,B,Worksheet,,,,,,,,,,,,,
,Primary,Offense,Offense,Offense,,,,,,,,,,,,,,,,,
,A.,Burn unoccupied dwelling/church,Burn unoccupied dwelling/church,Burn unoccupied dwelling/church,Burn unoccupied dwelling/church,Burn unoccupied dwelling/church,(1 count) ......................................................................................................................... 6,(1 count) ......................................................................................................................... 6,(1 count) ......................................................................................................................... 6,(1 count) ......................................................................................................................... 6,(1 count) ......................................................................................................................... 6,(1 count) ......................................................................................................................... 6,(1 count) ......................................................................................................................... 6,(1 count) ......................................................................................................................... 6,(1 count) ......................................................................................................................... 6,(1 count) ......................................................................................................................... 6,(1 count) ......................................................................................................................... 6,(1 count) ......................................................................................................................... 6,,,
