Name: “Table 1 of 1 on page 178 of 179”,Name: “Table 1 of 1 on page 178 of 179”,Name: “Table 1 of 1 on page 178 of 179”,Name: “Table 1 of 1 on page 178 of 179”,Name: “Table 1 of 1 on page 178 of 179”,Name: “Table 1 of 1 on page 178 of 179”,Name: “Table 1 of 1 on page 178 of 179”,Name: “Table 1 of 1 on page 178 of 179”,Name: “Table 1 of 1 on page 178 of 179”,Name: “Table 1 of 1 on page 178 of 179”,Name: “Table 1 of 1 on page 178 of 179”
Table: 178,Table: 178,Table: 178,Table: 178,Table: 178,Table: 178,Table: 178,Table: 178,Table: 178,Table: 178,Table: 178
,,,,,,,,,,
M EDICAL EXAMINER DISTRICTS,M EDICAL EXAMINER DISTRICTS,M EDICAL EXAMINER DISTRICTS,M EDICAL EXAMINER DISTRICTS,M EDICAL EXAMINER DISTRICTS,,,,,,
"CENTRAL Counties of Albemarle, Amelia, Brunswick, Buckingham, Caroline, Charles City, Charlotte,","CENTRAL Counties of Albemarle, Amelia, Brunswick, Buckingham, Caroline, Charles City, Charlotte,","CENTRAL Counties of Albemarle, Amelia, Brunswick, Buckingham, Caroline, Charles City, Charlotte,","CENTRAL Counties of Albemarle, Amelia, Brunswick, Buckingham, Caroline, Charles City, Charlotte,","CENTRAL Counties of Albemarle, Amelia, Brunswick, Buckingham, Caroline, Charles City, Charlotte,","CENTRAL Counties of Albemarle, Amelia, Brunswick, Buckingham, Caroline, Charles City, Charlotte,","CENTRAL Counties of Albemarle, Amelia, Brunswick, Buckingham, Caroline, Charles City, Charlotte,","CENTRAL Counties of Albemarle, Amelia, Brunswick, Buckingham, Caroline, Charles City, Charlotte,","CENTRAL Counties of Albemarle, Amelia, Brunswick, Buckingham, Caroline, Charles City, Charlotte,","CENTRAL Counties of Albemarle, Amelia, Brunswick, Buckingham, Caroline, Charles City, Charlotte,","CENTRAL Counties of Albemarle, Amelia, Brunswick, Buckingham, Caroline, Charles City, Charlotte,"
"Chesterfield,","Cumberland,","Dinwiddie,","Dinwiddie,","Essex,","Fluvanna,","Gloucester,","Goochland,","Greene,","Greensville,","Greensville,"
"Halifax, Hanover, Henrico, James City, King and Queen, King George, King William, Lancaster, Louisa,","Halifax, Hanover, Henrico, James City, King and Queen, King George, King William, Lancaster, Louisa,","Halifax, Hanover, Henrico, James City, King and Queen, King George, King William, Lancaster, Louisa,","Halifax, Hanover, Henrico, James City, King and Queen, King George, King William, Lancaster, Louisa,","Halifax, Hanover, Henrico, James City, King and Queen, King George, King William, Lancaster, Louisa,","Halifax, Hanover, Henrico, James City, King and Queen, King George, King William, Lancaster, Louisa,","Halifax, Hanover, Henrico, James City, King and Queen, King George, King William, Lancaster, Louisa,","Halifax, Hanover, Henrico, James City, King and Queen, King George, King William, Lancaster, Louisa,","Halifax, Hanover, Henrico, James City, King and Queen, King George, King William, Lancaster, Louisa,","Halifax, Hanover, Henrico, James City, King and Queen, King George, King William, Lancaster, Louisa,","Halifax, Hanover, Henrico, James City, King and Queen, King George, King William, Lancaster, Louisa,"
"Lunenburg, Mathews, Mecklenburg, Middlesex, Nelson, New Kent, Northumberland, Nottoway, Powhatan,","Lunenburg, Mathews, Mecklenburg, Middlesex, Nelson, New Kent, Northumberland, Nottoway, Powhatan,","Lunenburg, Mathews, Mecklenburg, Middlesex, Nelson, New Kent, Northumberland, Nottoway, Powhatan,","Lunenburg, Mathews, Mecklenburg, Middlesex, Nelson, New Kent, Northumberland, Nottoway, Powhatan,","Lunenburg, Mathews, Mecklenburg, Middlesex, Nelson, New Kent, Northumberland, Nottoway, Powhatan,","Lunenburg, Mathews, Mecklenburg, Middlesex, Nelson, New Kent, Northumberland, Nottoway, Powhatan,","Lunenburg, Mathews, Mecklenburg, Middlesex, Nelson, New Kent, Northumberland, Nottoway, Powhatan,","Lunenburg, Mathews, Mecklenburg, Middlesex, Nelson, New Kent, Northumberland, Nottoway, Powhatan,","Lunenburg, Mathews, Mecklenburg, Middlesex, Nelson, New Kent, Northumberland, Nottoway, Powhatan,","Lunenburg, Mathews, Mecklenburg, Middlesex, Nelson, New Kent, Northumberland, Nottoway, Powhatan,","Lunenburg, Mathews, Mecklenburg, Middlesex, Nelson, New Kent, Northumberland, Nottoway, Powhatan,"
"Prince Edward, Prince George, Spotsylvania, Stafford, Surry, Sussex, Richmond, and Westmoreland. Cities","Prince Edward, Prince George, Spotsylvania, Stafford, Surry, Sussex, Richmond, and Westmoreland. Cities","Prince Edward, Prince George, Spotsylvania, Stafford, Surry, Sussex, Richmond, and Westmoreland. Cities","Prince Edward, Prince George, Spotsylvania, Stafford, Surry, Sussex, Richmond, and Westmoreland. Cities","Prince Edward, Prince George, Spotsylvania, Stafford, Surry, Sussex, Richmond, and Westmoreland. Cities","Prince Edward, Prince George, Spotsylvania, Stafford, Surry, Sussex, Richmond, and Westmoreland. Cities","Prince Edward, Prince George, Spotsylvania, Stafford, Surry, Sussex, Richmond, and Westmoreland. Cities","Prince Edward, Prince George, Spotsylvania, Stafford, Surry, Sussex, Richmond, and Westmoreland. Cities","Prince Edward, Prince George, Spotsylvania, Stafford, Surry, Sussex, Richmond, and Westmoreland. Cities","Prince Edward, Prince George, Spotsylvania, Stafford, Surry, Sussex, Richmond, and Westmoreland. Cities","Prince Edward, Prince George, Spotsylvania, Stafford, Surry, Sussex, Richmond, and Westmoreland. Cities"
of,"Charlottesville,",Colonial,"Heights,","Emporia,","Fredericksburg,","Hopewell,","Petersburg,","Richmond,","Richmond,",and
Williamsburg.,,,,,,,,,,
"NORTHERN Counties of Arlington, Clarke, Culpeper, Fairfax, Fauquier, Frederick, Loudoun, Madison,","NORTHERN Counties of Arlington, Clarke, Culpeper, Fairfax, Fauquier, Frederick, Loudoun, Madison,","NORTHERN Counties of Arlington, Clarke, Culpeper, Fairfax, Fauquier, Frederick, Loudoun, Madison,","NORTHERN Counties of Arlington, Clarke, Culpeper, Fairfax, Fauquier, Frederick, Loudoun, Madison,","NORTHERN Counties of Arlington, Clarke, Culpeper, Fairfax, Fauquier, Frederick, Loudoun, Madison,","NORTHERN Counties of Arlington, Clarke, Culpeper, Fairfax, Fauquier, Frederick, Loudoun, Madison,","NORTHERN Counties of Arlington, Clarke, Culpeper, Fairfax, Fauquier, Frederick, Loudoun, Madison,","NORTHERN Counties of Arlington, Clarke, Culpeper, Fairfax, Fauquier, Frederick, Loudoun, Madison,","NORTHERN Counties of Arlington, Clarke, Culpeper, Fairfax, Fauquier, Frederick, Loudoun, Madison,","NORTHERN Counties of Arlington, Clarke, Culpeper, Fairfax, Fauquier, Frederick, Loudoun, Madison,","NORTHERN Counties of Arlington, Clarke, Culpeper, Fairfax, Fauquier, Frederick, Loudoun, Madison,"
"Orange, Page, Prince William, Rappahannock, Shenandoah, and Warren. Cities of Alexandria, Fairfax, Falls","Orange, Page, Prince William, Rappahannock, Shenandoah, and Warren. Cities of Alexandria, Fairfax, Falls","Orange, Page, Prince William, Rappahannock, Shenandoah, and Warren. Cities of Alexandria, Fairfax, Falls","Orange, Page, Prince William, Rappahannock, Shenandoah, and Warren. Cities of Alexandria, Fairfax, Falls","Orange, Page, Prince William, Rappahannock, Shenandoah, and Warren. Cities of Alexandria, Fairfax, Falls","Orange, Page, Prince William, Rappahannock, Shenandoah, and Warren. Cities of Alexandria, Fairfax, Falls","Orange, Page, Prince William, Rappahannock, Shenandoah, and Warren. Cities of Alexandria, Fairfax, Falls","Orange, Page, Prince William, Rappahannock, Shenandoah, and Warren. Cities of Alexandria, Fairfax, Falls","Orange, Page, Prince William, Rappahannock, Shenandoah, and Warren. Cities of Alexandria, Fairfax, Falls","Orange, Page, Prince William, Rappahannock, Shenandoah, and Warren. Cities of Alexandria, Fairfax, Falls","Orange, Page, Prince William, Rappahannock, Shenandoah, and Warren. Cities of Alexandria, Fairfax, Falls"
"Church, Manassas, Manassas Park, and Winchester.","Church, Manassas, Manassas Park, and Winchester.","Church, Manassas, Manassas Park, and Winchester.","Church, Manassas, Manassas Park, and Winchester.","Church, Manassas, Manassas Park, and Winchester.",,,,,,
"TIDEWATER Counties of Accomack, Isle of Wight, Northampton, Southampton, and York. Cities of","TIDEWATER Counties of Accomack, Isle of Wight, Northampton, Southampton, and York. Cities of","TIDEWATER Counties of Accomack, Isle of Wight, Northampton, Southampton, and York. Cities of","TIDEWATER Counties of Accomack, Isle of Wight, Northampton, Southampton, and York. Cities of","TIDEWATER Counties of Accomack, Isle of Wight, Northampton, Southampton, and York. Cities of","TIDEWATER Counties of Accomack, Isle of Wight, Northampton, Southampton, and York. Cities of","TIDEWATER Counties of Accomack, Isle of Wight, Northampton, Southampton, and York. Cities of","TIDEWATER Counties of Accomack, Isle of Wight, Northampton, Southampton, and York. Cities of","TIDEWATER Counties of Accomack, Isle of Wight, Northampton, Southampton, and York. Cities of","TIDEWATER Counties of Accomack, Isle of Wight, Northampton, Southampton, and York. Cities of","TIDEWATER Counties of Accomack, Isle of Wight, Northampton, Southampton, and York. Cities of"
"Chesapeake, Franklin, Hampton, Newport News, Norfolk, Poquoson, Portsmouth, Suffolk, and Virginia","Chesapeake, Franklin, Hampton, Newport News, Norfolk, Poquoson, Portsmouth, Suffolk, and Virginia","Chesapeake, Franklin, Hampton, Newport News, Norfolk, Poquoson, Portsmouth, Suffolk, and Virginia","Chesapeake, Franklin, Hampton, Newport News, Norfolk, Poquoson, Portsmouth, Suffolk, and Virginia","Chesapeake, Franklin, Hampton, Newport News, Norfolk, Poquoson, Portsmouth, Suffolk, and Virginia","Chesapeake, Franklin, Hampton, Newport News, Norfolk, Poquoson, Portsmouth, Suffolk, and Virginia","Chesapeake, Franklin, Hampton, Newport News, Norfolk, Poquoson, Portsmouth, Suffolk, and Virginia","Chesapeake, Franklin, Hampton, Newport News, Norfolk, Poquoson, Portsmouth, Suffolk, and Virginia","Chesapeake, Franklin, Hampton, Newport News, Norfolk, Poquoson, Portsmouth, Suffolk, and Virginia","Chesapeake, Franklin, Hampton, Newport News, Norfolk, Poquoson, Portsmouth, Suffolk, and Virginia","Chesapeake, Franklin, Hampton, Newport News, Norfolk, Poquoson, Portsmouth, Suffolk, and Virginia"
Beach.,,,,,,,,,,
"WESTERN Counties of Alleghany, Amherst, Appomattox, Augusta, Bath, Bedford, Bland, Botetourt,","WESTERN Counties of Alleghany, Amherst, Appomattox, Augusta, Bath, Bedford, Bland, Botetourt,","WESTERN Counties of Alleghany, Amherst, Appomattox, Augusta, Bath, Bedford, Bland, Botetourt,","WESTERN Counties of Alleghany, Amherst, Appomattox, Augusta, Bath, Bedford, Bland, Botetourt,","WESTERN Counties of Alleghany, Amherst, Appomattox, Augusta, Bath, Bedford, Bland, Botetourt,","WESTERN Counties of Alleghany, Amherst, Appomattox, Augusta, Bath, Bedford, Bland, Botetourt,","WESTERN Counties of Alleghany, Amherst, Appomattox, Augusta, Bath, Bedford, Bland, Botetourt,","WESTERN Counties of Alleghany, Amherst, Appomattox, Augusta, Bath, Bedford, Bland, Botetourt,","WESTERN Counties of Alleghany, Amherst, Appomattox, Augusta, Bath, Bedford, Bland, Botetourt,","WESTERN Counties of Alleghany, Amherst, Appomattox, Augusta, Bath, Bedford, Bland, Botetourt,","WESTERN Counties of Alleghany, Amherst, Appomattox, Augusta, Bath, Bedford, Bland, Botetourt,"
"Buchanan, Campbell, Carroll, Craig, Dickenson, Floyd, Franklin, Giles, Grayson, Henry, Highland, Lee,","Buchanan, Campbell, Carroll, Craig, Dickenson, Floyd, Franklin, Giles, Grayson, Henry, Highland, Lee,","Buchanan, Campbell, Carroll, Craig, Dickenson, Floyd, Franklin, Giles, Grayson, Henry, Highland, Lee,","Buchanan, Campbell, Carroll, Craig, Dickenson, Floyd, Franklin, Giles, Grayson, Henry, Highland, Lee,","Buchanan, Campbell, Carroll, Craig, Dickenson, Floyd, Franklin, Giles, Grayson, Henry, Highland, Lee,","Buchanan, Campbell, Carroll, Craig, Dickenson, Floyd, Franklin, Giles, Grayson, Henry, Highland, Lee,","Buchanan, Campbell, Carroll, Craig, Dickenson, Floyd, Franklin, Giles, Grayson, Henry, Highland, Lee,","Buchanan, Campbell, Carroll, Craig, Dickenson, Floyd, Franklin, Giles, Grayson, Henry, Highland, Lee,","Buchanan, Campbell, Carroll, Craig, Dickenson, Floyd, Franklin, Giles, Grayson, Henry, Highland, Lee,","Buchanan, Campbell, Carroll, Craig, Dickenson, Floyd, Franklin, Giles, Grayson, Henry, Highland, Lee,","Buchanan, Campbell, Carroll, Craig, Dickenson, Floyd, Franklin, Giles, Grayson, Henry, Highland, Lee,"
"Montgomery, Patrick, Pittsylvania, Pulaski, Roanoke, Rockbridge, Rockingham, Russell, Scott, Smyth,","Montgomery, Patrick, Pittsylvania, Pulaski, Roanoke, Rockbridge, Rockingham, Russell, Scott, Smyth,","Montgomery, Patrick, Pittsylvania, Pulaski, Roanoke, Rockbridge, Rockingham, Russell, Scott, Smyth,","Montgomery, Patrick, Pittsylvania, Pulaski, Roanoke, Rockbridge, Rockingham, Russell, Scott, Smyth,","Montgomery, Patrick, Pittsylvania, Pulaski, Roanoke, Rockbridge, Rockingham, Russell, Scott, Smyth,","Montgomery, Patrick, Pittsylvania, Pulaski, Roanoke, Rockbridge, Rockingham, Russell, Scott, Smyth,","Montgomery, Patrick, Pittsylvania, Pulaski, Roanoke, Rockbridge, Rockingham, Russell, Scott, Smyth,","Montgomery, Patrick, Pittsylvania, Pulaski, Roanoke, Rockbridge, Rockingham, Russell, Scott, Smyth,","Montgomery, Patrick, Pittsylvania, Pulaski, Roanoke, Rockbridge, Rockingham, Russell, Scott, Smyth,","Montgomery, Patrick, Pittsylvania, Pulaski, Roanoke, Rockbridge, Rockingham, Russell, Scott, Smyth,","Montgomery, Patrick, Pittsylvania, Pulaski, Roanoke, Rockbridge, Rockingham, Russell, Scott, Smyth,"
"Tazewell, Washington, Wise, and Wythe. Cities of Bedford, Bristol, Buena Vista, Covington, Danville, Galax,","Tazewell, Washington, Wise, and Wythe. Cities of Bedford, Bristol, Buena Vista, Covington, Danville, Galax,","Tazewell, Washington, Wise, and Wythe. Cities of Bedford, Bristol, Buena Vista, Covington, Danville, Galax,","Tazewell, Washington, Wise, and Wythe. Cities of Bedford, Bristol, Buena Vista, Covington, Danville, Galax,","Tazewell, Washington, Wise, and Wythe. Cities of Bedford, Bristol, Buena Vista, Covington, Danville, Galax,","Tazewell, Washington, Wise, and Wythe. Cities of Bedford, Bristol, Buena Vista, Covington, Danville, Galax,","Tazewell, Washington, Wise, and Wythe. Cities of Bedford, Bristol, Buena Vista, Covington, Danville, Galax,","Tazewell, Washington, Wise, and Wythe. Cities of Bedford, Bristol, Buena Vista, Covington, Danville, Galax,","Tazewell, Washington, Wise, and Wythe. Cities of Bedford, Bristol, Buena Vista, Covington, Danville, Galax,","Tazewell, Washington, Wise, and Wythe. Cities of Bedford, Bristol, Buena Vista, Covington, Danville, Galax,","Tazewell, Washington, Wise, and Wythe. Cities of Bedford, Bristol, Buena Vista, Covington, Danville, Galax,"
"Harrisonburg,","Lexington,","Lynchburg,","Lynchburg,","Martinsville,","Norton,","Radford,","Roanoke,","Salem,","Staunton,",and
Waynesboro.,,,,,,,,,,
