Name: “Table 1 of 1 on page 14 of 179”,Name: “Table 1 of 1 on page 14 of 179”,Name: “Table 1 of 1 on page 14 of 179”,Name: “Table 1 of 1 on page 14 of 179”,Name: “Table 1 of 1 on page 14 of 179”,Name: “Table 1 of 1 on page 14 of 179”,Name: “Table 1 of 1 on page 14 of 179”,Name: “Table 1 of 1 on page 14 of 179”,Name: “Table 1 of 1 on page 14 of 179”,Name: “Table 1 of 1 on page 14 of 179”,Name: “Table 1 of 1 on page 14 of 179”,Name: “Table 1 of 1 on page 14 of 179”,Name: “Table 1 of 1 on page 14 of 179”,Name: “Table 1 of 1 on page 14 of 179”,Name: “Table 1 of 1 on page 14 of 179”
Table: 14,Table: 14,Table: 14,Table: 14,Table: 14,Table: 14,Table: 14,Table: 14,Table: 14,Table: 14,Table: 14,Table: 14,Table: 14,Table: 14,Table: 14
,,,,,,,,,,,,,,
,,,,,,,,,,,,,,P a g e | 12
,• Racial disparities continued to exist: Black Virginians were at significantly greater risk than White,• Racial disparities continued to exist: Black Virginians were at significantly greater risk than White,• Racial disparities continued to exist: Black Virginians were at significantly greater risk than White,• Racial disparities continued to exist: Black Virginians were at significantly greater risk than White,• Racial disparities continued to exist: Black Virginians were at significantly greater risk than White,• Racial disparities continued to exist: Black Virginians were at significantly greater risk than White,• Racial disparities continued to exist: Black Virginians were at significantly greater risk than White,• Racial disparities continued to exist: Black Virginians were at significantly greater risk than White,• Racial disparities continued to exist: Black Virginians were at significantly greater risk than White,• Racial disparities continued to exist: Black Virginians were at significantly greater risk than White,• Racial disparities continued to exist: Black Virginians were at significantly greater risk than White,• Racial disparities continued to exist: Black Virginians were at significantly greater risk than White,• Racial disparities continued to exist: Black Virginians were at significantly greater risk than White,• Racial disparities continued to exist: Black Virginians were at significantly greater risk than White
,Virginians,Virginians,,,,,,,,,,,,
,• Infants were our most vulnerable citizens,• Infants were our most vulnerable citizens,• Infants were our most vulnerable citizens,• Infants were our most vulnerable citizens,• Infants were our most vulnerable citizens,• Infants were our most vulnerable citizens,,,,,,,,
,• Most victims were killed with a firearm and while in a residence,• Most victims were killed with a firearm and while in a residence,• Most victims were killed with a firearm and while in a residence,• Most victims were killed with a firearm and while in a residence,• Most victims were killed with a firearm and while in a residence,• Most victims were killed with a firearm and while in a residence,• Most victims were killed with a firearm and while in a residence,• Most victims were killed with a firearm and while in a residence,• Most victims were killed with a firearm and while in a residence,• Most victims were killed with a firearm and while in a residence,,,,
,"• Risk factors associated with intimate partner violence, such as prior acts of violence and periods of","• Risk factors associated with intimate partner violence, such as prior acts of violence and periods of","• Risk factors associated with intimate partner violence, such as prior acts of violence and periods of","• Risk factors associated with intimate partner violence, such as prior acts of violence and periods of","• Risk factors associated with intimate partner violence, such as prior acts of violence and periods of","• Risk factors associated with intimate partner violence, such as prior acts of violence and periods of","• Risk factors associated with intimate partner violence, such as prior acts of violence and periods of","• Risk factors associated with intimate partner violence, such as prior acts of violence and periods of","• Risk factors associated with intimate partner violence, such as prior acts of violence and periods of","• Risk factors associated with intimate partner violence, such as prior acts of violence and periods of","• Risk factors associated with intimate partner violence, such as prior acts of violence and periods of","• Risk factors associated with intimate partner violence, such as prior acts of violence and periods of","• Risk factors associated with intimate partner violence, such as prior acts of violence and periods of","• Risk factors associated with intimate partner violence, such as prior acts of violence and periods of"
,"separation or divorce, are also associated with intimate partner homicide","separation or divorce, are also associated with intimate partner homicide","separation or divorce, are also associated with intimate partner homicide","separation or divorce, are also associated with intimate partner homicide","separation or divorce, are also associated with intimate partner homicide","separation or divorce, are also associated with intimate partner homicide","separation or divorce, are also associated with intimate partner homicide","separation or divorce, are also associated with intimate partner homicide","separation or divorce, are also associated with intimate partner homicide","separation or divorce, are also associated with intimate partner homicide",,,,
Published reports from this project are available at,Published reports from this project are available at,Published reports from this project are available at,Published reports from this project are available at,Published reports from this project are available at,Published reports from this project are available at,Published reports from this project are available at,,,,,,,,
http://www.vdh.virginia.gov/medExam/familyintimatepartnerviolencehomicidesurveillance.htm.,http://www.vdh.virginia.gov/medExam/familyintimatepartnerviolencehomicidesurveillance.htm.,http://www.vdh.virginia.gov/medExam/familyintimatepartnerviolencehomicidesurveillance.htm.,http://www.vdh.virginia.gov/medExam/familyintimatepartnerviolencehomicidesurveillance.htm.,http://www.vdh.virginia.gov/medExam/familyintimatepartnerviolencehomicidesurveillance.htm.,http://www.vdh.virginia.gov/medExam/familyintimatepartnerviolencehomicidesurveillance.htm.,http://www.vdh.virginia.gov/medExam/familyintimatepartnerviolencehomicidesurveillance.htm.,http://www.vdh.virginia.gov/medExam/familyintimatepartnerviolencehomicidesurveillance.htm.,http://www.vdh.virginia.gov/medExam/familyintimatepartnerviolencehomicidesurveillance.htm.,http://www.vdh.virginia.gov/medExam/familyintimatepartnerviolencehomicidesurveillance.htm.,http://www.vdh.virginia.gov/medExam/familyintimatepartnerviolencehomicidesurveillance.htm.,http://www.vdh.virginia.gov/medExam/familyintimatepartnerviolencehomicidesurveillance.htm.,http://www.vdh.virginia.gov/medExam/familyintimatepartnerviolencehomicidesurveillance.htm.,http://www.vdh.virginia.gov/medExam/familyintimatepartnerviolencehomicidesurveillance.htm.,
The Virginia Violent Death Reporting System (VVDRS) was implemented in 2003 as part of the National,The Virginia Violent Death Reporting System (VVDRS) was implemented in 2003 as part of the National,The Virginia Violent Death Reporting System (VVDRS) was implemented in 2003 as part of the National,The Virginia Violent Death Reporting System (VVDRS) was implemented in 2003 as part of the National,The Virginia Violent Death Reporting System (VVDRS) was implemented in 2003 as part of the National,The Virginia Violent Death Reporting System (VVDRS) was implemented in 2003 as part of the National,The Virginia Violent Death Reporting System (VVDRS) was implemented in 2003 as part of the National,The Virginia Violent Death Reporting System (VVDRS) was implemented in 2003 as part of the National,The Virginia Violent Death Reporting System (VVDRS) was implemented in 2003 as part of the National,The Virginia Violent Death Reporting System (VVDRS) was implemented in 2003 as part of the National,The Virginia Violent Death Reporting System (VVDRS) was implemented in 2003 as part of the National,The Virginia Violent Death Reporting System (VVDRS) was implemented in 2003 as part of the National,The Virginia Violent Death Reporting System (VVDRS) was implemented in 2003 as part of the National,The Virginia Violent Death Reporting System (VVDRS) was implemented in 2003 as part of the National,The Virginia Violent Death Reporting System (VVDRS) was implemented in 2003 as part of the National
"Violent Death Report System (NVDRS). Virginia was among the first six states, and the first state-wide medical","Violent Death Report System (NVDRS). Virginia was among the first six states, and the first state-wide medical","Violent Death Report System (NVDRS). Virginia was among the first six states, and the first state-wide medical","Violent Death Report System (NVDRS). Virginia was among the first six states, and the first state-wide medical","Violent Death Report System (NVDRS). Virginia was among the first six states, and the first state-wide medical","Violent Death Report System (NVDRS). Virginia was among the first six states, and the first state-wide medical","Violent Death Report System (NVDRS). Virginia was among the first six states, and the first state-wide medical","Violent Death Report System (NVDRS). Virginia was among the first six states, and the first state-wide medical","Violent Death Report System (NVDRS). Virginia was among the first six states, and the first state-wide medical","Violent Death Report System (NVDRS). Virginia was among the first six states, and the first state-wide medical","Violent Death Report System (NVDRS). Virginia was among the first six states, and the first state-wide medical","Violent Death Report System (NVDRS). Virginia was among the first six states, and the first state-wide medical","Violent Death Report System (NVDRS). Virginia was among the first six states, and the first state-wide medical","Violent Death Report System (NVDRS). Virginia was among the first six states, and the first state-wide medical","Violent Death Report System (NVDRS). Virginia was among the first six states, and the first state-wide medical"
"examiner system, to be funded for this project.","examiner system, to be funded for this project.","examiner system, to be funded for this project.","examiner system, to be funded for this project.","examiner system, to be funded for this project.","examiner system, to be funded for this project.","examiner system, to be funded for this project.",,,,,,,,
The,VVDRS,collects,information,about,about,deaths,due,to,violence,"(suicide,","homicide,","homicide,",legal,"intervention,"
"unintentional firearm discharge, deaths of an undetermined manner, and deaths due to terrorism) and","unintentional firearm discharge, deaths of an undetermined manner, and deaths due to terrorism) and","unintentional firearm discharge, deaths of an undetermined manner, and deaths due to terrorism) and","unintentional firearm discharge, deaths of an undetermined manner, and deaths due to terrorism) and","unintentional firearm discharge, deaths of an undetermined manner, and deaths due to terrorism) and","unintentional firearm discharge, deaths of an undetermined manner, and deaths due to terrorism) and","unintentional firearm discharge, deaths of an undetermined manner, and deaths due to terrorism) and","unintentional firearm discharge, deaths of an undetermined manner, and deaths due to terrorism) and","unintentional firearm discharge, deaths of an undetermined manner, and deaths due to terrorism) and","unintentional firearm discharge, deaths of an undetermined manner, and deaths due to terrorism) and","unintentional firearm discharge, deaths of an undetermined manner, and deaths due to terrorism) and","unintentional firearm discharge, deaths of an undetermined manner, and deaths due to terrorism) and","unintentional firearm discharge, deaths of an undetermined manner, and deaths due to terrorism) and","unintentional firearm discharge, deaths of an undetermined manner, and deaths due to terrorism) and","unintentional firearm discharge, deaths of an undetermined manner, and deaths due to terrorism) and"
"correlates victim information with the circumstances surrounding the death. Data from several sources,","correlates victim information with the circumstances surrounding the death. Data from several sources,","correlates victim information with the circumstances surrounding the death. Data from several sources,","correlates victim information with the circumstances surrounding the death. Data from several sources,","correlates victim information with the circumstances surrounding the death. Data from several sources,","correlates victim information with the circumstances surrounding the death. Data from several sources,","correlates victim information with the circumstances surrounding the death. Data from several sources,","correlates victim information with the circumstances surrounding the death. Data from several sources,","correlates victim information with the circumstances surrounding the death. Data from several sources,","correlates victim information with the circumstances surrounding the death. Data from several sources,","correlates victim information with the circumstances surrounding the death. Data from several sources,","correlates victim information with the circumstances surrounding the death. Data from several sources,","correlates victim information with the circumstances surrounding the death. Data from several sources,","correlates victim information with the circumstances surrounding the death. Data from several sources,","correlates victim information with the circumstances surrounding the death. Data from several sources,"
"among them forensic pathology, forensic science, law enforcement, vital records, and health statistics, are","among them forensic pathology, forensic science, law enforcement, vital records, and health statistics, are","among them forensic pathology, forensic science, law enforcement, vital records, and health statistics, are","among them forensic pathology, forensic science, law enforcement, vital records, and health statistics, are","among them forensic pathology, forensic science, law enforcement, vital records, and health statistics, are","among them forensic pathology, forensic science, law enforcement, vital records, and health statistics, are","among them forensic pathology, forensic science, law enforcement, vital records, and health statistics, are","among them forensic pathology, forensic science, law enforcement, vital records, and health statistics, are","among them forensic pathology, forensic science, law enforcement, vital records, and health statistics, are","among them forensic pathology, forensic science, law enforcement, vital records, and health statistics, are","among them forensic pathology, forensic science, law enforcement, vital records, and health statistics, are","among them forensic pathology, forensic science, law enforcement, vital records, and health statistics, are","among them forensic pathology, forensic science, law enforcement, vital records, and health statistics, are","among them forensic pathology, forensic science, law enforcement, vital records, and health statistics, are","among them forensic pathology, forensic science, law enforcement, vital records, and health statistics, are"
linked to provide a comprehensive picture of violent death within the Commonwealth of Virginia.,linked to provide a comprehensive picture of violent death within the Commonwealth of Virginia.,linked to provide a comprehensive picture of violent death within the Commonwealth of Virginia.,linked to provide a comprehensive picture of violent death within the Commonwealth of Virginia.,linked to provide a comprehensive picture of violent death within the Commonwealth of Virginia.,linked to provide a comprehensive picture of violent death within the Commonwealth of Virginia.,linked to provide a comprehensive picture of violent death within the Commonwealth of Virginia.,linked to provide a comprehensive picture of violent death within the Commonwealth of Virginia.,linked to provide a comprehensive picture of violent death within the Commonwealth of Virginia.,linked to provide a comprehensive picture of violent death within the Commonwealth of Virginia.,linked to provide a comprehensive picture of violent death within the Commonwealth of Virginia.,linked to provide a comprehensive picture of violent death within the Commonwealth of Virginia.,linked to provide a comprehensive picture of violent death within the Commonwealth of Virginia.,linked to provide a comprehensive picture of violent death within the Commonwealth of Virginia.,linked to provide a comprehensive picture of violent death within the Commonwealth of Virginia.
"Data from the VVDRS have illustrated an increased suicide risk for older adults, especially males; the types of","Data from the VVDRS have illustrated an increased suicide risk for older adults, especially males; the types of","Data from the VVDRS have illustrated an increased suicide risk for older adults, especially males; the types of","Data from the VVDRS have illustrated an increased suicide risk for older adults, especially males; the types of","Data from the VVDRS have illustrated an increased suicide risk for older adults, especially males; the types of","Data from the VVDRS have illustrated an increased suicide risk for older adults, especially males; the types of","Data from the VVDRS have illustrated an increased suicide risk for older adults, especially males; the types of","Data from the VVDRS have illustrated an increased suicide risk for older adults, especially males; the types of","Data from the VVDRS have illustrated an increased suicide risk for older adults, especially males; the types of","Data from the VVDRS have illustrated an increased suicide risk for older adults, especially males; the types of","Data from the VVDRS have illustrated an increased suicide risk for older adults, especially males; the types of","Data from the VVDRS have illustrated an increased suicide risk for older adults, especially males; the types of","Data from the VVDRS have illustrated an increased suicide risk for older adults, especially males; the types of","Data from the VVDRS have illustrated an increased suicide risk for older adults, especially males; the types of","Data from the VVDRS have illustrated an increased suicide risk for older adults, especially males; the types of"
poisons used in suicides; the prevalence of mental health problems and subsequent treatment among persons,poisons used in suicides; the prevalence of mental health problems and subsequent treatment among persons,poisons used in suicides; the prevalence of mental health problems and subsequent treatment among persons,poisons used in suicides; the prevalence of mental health problems and subsequent treatment among persons,poisons used in suicides; the prevalence of mental health problems and subsequent treatment among persons,poisons used in suicides; the prevalence of mental health problems and subsequent treatment among persons,poisons used in suicides; the prevalence of mental health problems and subsequent treatment among persons,poisons used in suicides; the prevalence of mental health problems and subsequent treatment among persons,poisons used in suicides; the prevalence of mental health problems and subsequent treatment among persons,poisons used in suicides; the prevalence of mental health problems and subsequent treatment among persons,poisons used in suicides; the prevalence of mental health problems and subsequent treatment among persons,poisons used in suicides; the prevalence of mental health problems and subsequent treatment among persons,poisons used in suicides; the prevalence of mental health problems and subsequent treatment among persons,poisons used in suicides; the prevalence of mental health problems and subsequent treatment among persons,poisons used in suicides; the prevalence of mental health problems and subsequent treatment among persons
"who commit suicide; the warning signs that precede many suicides, such as disclosing intent to harm oneself","who commit suicide; the warning signs that precede many suicides, such as disclosing intent to harm oneself","who commit suicide; the warning signs that precede many suicides, such as disclosing intent to harm oneself","who commit suicide; the warning signs that precede many suicides, such as disclosing intent to harm oneself","who commit suicide; the warning signs that precede many suicides, such as disclosing intent to harm oneself","who commit suicide; the warning signs that precede many suicides, such as disclosing intent to harm oneself","who commit suicide; the warning signs that precede many suicides, such as disclosing intent to harm oneself","who commit suicide; the warning signs that precede many suicides, such as disclosing intent to harm oneself","who commit suicide; the warning signs that precede many suicides, such as disclosing intent to harm oneself","who commit suicide; the warning signs that precede many suicides, such as disclosing intent to harm oneself","who commit suicide; the warning signs that precede many suicides, such as disclosing intent to harm oneself","who commit suicide; the warning signs that precede many suicides, such as disclosing intent to harm oneself","who commit suicide; the warning signs that precede many suicides, such as disclosing intent to harm oneself","who commit suicide; the warning signs that precede many suicides, such as disclosing intent to harm oneself","who commit suicide; the warning signs that precede many suicides, such as disclosing intent to harm oneself"
or,having,prior,suicide,attempts;,and,an,association,between,between,homicides,with,no,clear,precipitating
circumstances and cocaine usage.,circumstances and cocaine usage.,circumstances and cocaine usage.,circumstances and cocaine usage.,,,,,,,,,,,
The VVDRS is funded by the Centers for Disease Control and Prevention (CDC). Published reports are available,The VVDRS is funded by the Centers for Disease Control and Prevention (CDC). Published reports are available,The VVDRS is funded by the Centers for Disease Control and Prevention (CDC). Published reports are available,The VVDRS is funded by the Centers for Disease Control and Prevention (CDC). Published reports are available,The VVDRS is funded by the Centers for Disease Control and Prevention (CDC). Published reports are available,The VVDRS is funded by the Centers for Disease Control and Prevention (CDC). Published reports are available,The VVDRS is funded by the Centers for Disease Control and Prevention (CDC). Published reports are available,The VVDRS is funded by the Centers for Disease Control and Prevention (CDC). Published reports are available,The VVDRS is funded by the Centers for Disease Control and Prevention (CDC). Published reports are available,The VVDRS is funded by the Centers for Disease Control and Prevention (CDC). Published reports are available,The VVDRS is funded by the Centers for Disease Control and Prevention (CDC). Published reports are available,The VVDRS is funded by the Centers for Disease Control and Prevention (CDC). Published reports are available,The VVDRS is funded by the Centers for Disease Control and Prevention (CDC). Published reports are available,The VVDRS is funded by the Centers for Disease Control and Prevention (CDC). Published reports are available,The VVDRS is funded by the Centers for Disease Control and Prevention (CDC). Published reports are available
at http://www.vdh.virginia.gov/medExam/NVDRS.html/.,at http://www.vdh.virginia.gov/medExam/NVDRS.html/.,at http://www.vdh.virginia.gov/medExam/NVDRS.html/.,at http://www.vdh.virginia.gov/medExam/NVDRS.html/.,at http://www.vdh.virginia.gov/medExam/NVDRS.html/.,at http://www.vdh.virginia.gov/medExam/NVDRS.html/.,at http://www.vdh.virginia.gov/medExam/NVDRS.html/.,at http://www.vdh.virginia.gov/medExam/NVDRS.html/.,,,,,,,
The State Child Fatality Review Team was established in 1995 by the Virginia General Assembly and the,The State Child Fatality Review Team was established in 1995 by the Virginia General Assembly and the,The State Child Fatality Review Team was established in 1995 by the Virginia General Assembly and the,The State Child Fatality Review Team was established in 1995 by the Virginia General Assembly and the,The State Child Fatality Review Team was established in 1995 by the Virginia General Assembly and the,The State Child Fatality Review Team was established in 1995 by the Virginia General Assembly and the,The State Child Fatality Review Team was established in 1995 by the Virginia General Assembly and the,The State Child Fatality Review Team was established in 1995 by the Virginia General Assembly and the,The State Child Fatality Review Team was established in 1995 by the Virginia General Assembly and the,The State Child Fatality Review Team was established in 1995 by the Virginia General Assembly and the,The State Child Fatality Review Team was established in 1995 by the Virginia General Assembly and the,The State Child Fatality Review Team was established in 1995 by the Virginia General Assembly and the,The State Child Fatality Review Team was established in 1995 by the Virginia General Assembly and the,The State Child Fatality Review Team was established in 1995 by the Virginia General Assembly and the,The State Child Fatality Review Team was established in 1995 by the Virginia General Assembly and the
