Name: “Table 1 of 1 on page 34 of 98”,Name: “Table 1 of 1 on page 34 of 98”,Name: “Table 1 of 1 on page 34 of 98”,Name: “Table 1 of 1 on page 34 of 98”,Name: “Table 1 of 1 on page 34 of 98”,Name: “Table 1 of 1 on page 34 of 98”,Name: “Table 1 of 1 on page 34 of 98”,Name: “Table 1 of 1 on page 34 of 98”,Name: “Table 1 of 1 on page 34 of 98”,Name: “Table 1 of 1 on page 34 of 98”,Name: “Table 1 of 1 on page 34 of 98”,Name: “Table 1 of 1 on page 34 of 98”,Name: “Table 1 of 1 on page 34 of 98”,Name: “Table 1 of 1 on page 34 of 98”,Name: “Table 1 of 1 on page 34 of 98”,Name: “Table 1 of 1 on page 34 of 98”,Name: “Table 1 of 1 on page 34 of 98”,Name: “Table 1 of 1 on page 34 of 98”,Name: “Table 1 of 1 on page 34 of 98”,Name: “Table 1 of 1 on page 34 of 98”,Name: “Table 1 of 1 on page 34 of 98”,Name: “Table 1 of 1 on page 34 of 98”
Table: 32,Table: 32,Table: 32,Table: 32,Table: 32,Table: 32,Table: 32,Table: 32,Table: 32,Table: 32,Table: 32,Table: 32,Table: 32,Table: 32,Table: 32,Table: 32,Table: 32,Table: 32,Table: 32,Table: 32,Table: 32,Table: 32
,,,,,,,,,,,,,,,,,,,,,
,,,,26,~,2011 Annual Report,2011 Annual Report,2011 Annual Report,2011 Annual Report,,,,,,,,,,,,
,,,,"Among the early cases subjected to the new truth-in-sentencing provisions, implemented","Among the early cases subjected to the new truth-in-sentencing provisions, implemented","Among the early cases subjected to the new truth-in-sentencing provisions, implemented","Among the early cases subjected to the new truth-in-sentencing provisions, implemented","Among the early cases subjected to the new truth-in-sentencing provisions, implemented","Among the early cases subjected to the new truth-in-sentencing provisions, implemented","Among the early cases subjected to the new truth-in-sentencing provisions, implemented","Among the early cases subjected to the new truth-in-sentencing provisions, implemented","Among the early cases subjected to the new truth-in-sentencing provisions, implemented","Among the early cases subjected to the new truth-in-sentencing provisions, implemented","Among the early cases subjected to the new truth-in-sentencing provisions, implemented","Among the early cases subjected to the new truth-in-sentencing provisions, implemented","Among the early cases subjected to the new truth-in-sentencing provisions, implemented","Among the early cases subjected to the new truth-in-sentencing provisions, implemented","Among the early cases subjected to the new truth-in-sentencing provisions, implemented","Among the early cases subjected to the new truth-in-sentencing provisions, implemented","Among the early cases subjected to the new truth-in-sentencing provisions, implemented","Among the early cases subjected to the new truth-in-sentencing provisions, implemented"
,,,,"during the last six months of FY1995, jury adjudications sank to just over 1%. During","during the last six months of FY1995, jury adjudications sank to just over 1%. During","during the last six months of FY1995, jury adjudications sank to just over 1%. During","during the last six months of FY1995, jury adjudications sank to just over 1%. During","during the last six months of FY1995, jury adjudications sank to just over 1%. During","during the last six months of FY1995, jury adjudications sank to just over 1%. During","during the last six months of FY1995, jury adjudications sank to just over 1%. During","during the last six months of FY1995, jury adjudications sank to just over 1%. During","during the last six months of FY1995, jury adjudications sank to just over 1%. During","during the last six months of FY1995, jury adjudications sank to just over 1%. During","during the last six months of FY1995, jury adjudications sank to just over 1%. During","during the last six months of FY1995, jury adjudications sank to just over 1%. During","during the last six months of FY1995, jury adjudications sank to just over 1%. During","during the last six months of FY1995, jury adjudications sank to just over 1%. During","during the last six months of FY1995, jury adjudications sank to just over 1%. During","during the last six months of FY1995, jury adjudications sank to just over 1%. During","during the last six months of FY1995, jury adjudications sank to just over 1%. During","during the last six months of FY1995, jury adjudications sank to just over 1%. During"
,,,,"the first complete fiscal year of truth-in-sentencing (FY1996), just over 2% of the cases","the first complete fiscal year of truth-in-sentencing (FY1996), just over 2% of the cases","the first complete fiscal year of truth-in-sentencing (FY1996), just over 2% of the cases","the first complete fiscal year of truth-in-sentencing (FY1996), just over 2% of the cases","the first complete fiscal year of truth-in-sentencing (FY1996), just over 2% of the cases","the first complete fiscal year of truth-in-sentencing (FY1996), just over 2% of the cases","the first complete fiscal year of truth-in-sentencing (FY1996), just over 2% of the cases","the first complete fiscal year of truth-in-sentencing (FY1996), just over 2% of the cases","the first complete fiscal year of truth-in-sentencing (FY1996), just over 2% of the cases","the first complete fiscal year of truth-in-sentencing (FY1996), just over 2% of the cases","the first complete fiscal year of truth-in-sentencing (FY1996), just over 2% of the cases","the first complete fiscal year of truth-in-sentencing (FY1996), just over 2% of the cases","the first complete fiscal year of truth-in-sentencing (FY1996), just over 2% of the cases","the first complete fiscal year of truth-in-sentencing (FY1996), just over 2% of the cases","the first complete fiscal year of truth-in-sentencing (FY1996), just over 2% of the cases","the first complete fiscal year of truth-in-sentencing (FY1996), just over 2% of the cases","the first complete fiscal year of truth-in-sentencing (FY1996), just over 2% of the cases","the first complete fiscal year of truth-in-sentencing (FY1996), just over 2% of the cases"
,,,,"were resolved by jury trials, which was half the rate of the last year before the abolition of","were resolved by jury trials, which was half the rate of the last year before the abolition of","were resolved by jury trials, which was half the rate of the last year before the abolition of","were resolved by jury trials, which was half the rate of the last year before the abolition of","were resolved by jury trials, which was half the rate of the last year before the abolition of","were resolved by jury trials, which was half the rate of the last year before the abolition of","were resolved by jury trials, which was half the rate of the last year before the abolition of","were resolved by jury trials, which was half the rate of the last year before the abolition of","were resolved by jury trials, which was half the rate of the last year before the abolition of","were resolved by jury trials, which was half the rate of the last year before the abolition of","were resolved by jury trials, which was half the rate of the last year before the abolition of","were resolved by jury trials, which was half the rate of the last year before the abolition of","were resolved by jury trials, which was half the rate of the last year before the abolition of","were resolved by jury trials, which was half the rate of the last year before the abolition of","were resolved by jury trials, which was half the rate of the last year before the abolition of","were resolved by jury trials, which was half the rate of the last year before the abolition of","were resolved by jury trials, which was half the rate of the last year before the abolition of","were resolved by jury trials, which was half the rate of the last year before the abolition of"
,,,,"parole. Seemingly, the introduction of truth-in-sentencing, as well as the introduction of","parole. Seemingly, the introduction of truth-in-sentencing, as well as the introduction of","parole. Seemingly, the introduction of truth-in-sentencing, as well as the introduction of","parole. Seemingly, the introduction of truth-in-sentencing, as well as the introduction of","parole. Seemingly, the introduction of truth-in-sentencing, as well as the introduction of","parole. Seemingly, the introduction of truth-in-sentencing, as well as the introduction of","parole. Seemingly, the introduction of truth-in-sentencing, as well as the introduction of","parole. Seemingly, the introduction of truth-in-sentencing, as well as the introduction of","parole. Seemingly, the introduction of truth-in-sentencing, as well as the introduction of","parole. Seemingly, the introduction of truth-in-sentencing, as well as the introduction of","parole. Seemingly, the introduction of truth-in-sentencing, as well as the introduction of","parole. Seemingly, the introduction of truth-in-sentencing, as well as the introduction of","parole. Seemingly, the introduction of truth-in-sentencing, as well as the introduction of","parole. Seemingly, the introduction of truth-in-sentencing, as well as the introduction of","parole. Seemingly, the introduction of truth-in-sentencing, as well as the introduction of","parole. Seemingly, the introduction of truth-in-sentencing, as well as the introduction of","parole. Seemingly, the introduction of truth-in-sentencing, as well as the introduction of","parole. Seemingly, the introduction of truth-in-sentencing, as well as the introduction of"
,,,,"a bifurcated jury trial system, appears to have contributed to the reduction in jury trials.","a bifurcated jury trial system, appears to have contributed to the reduction in jury trials.","a bifurcated jury trial system, appears to have contributed to the reduction in jury trials.","a bifurcated jury trial system, appears to have contributed to the reduction in jury trials.","a bifurcated jury trial system, appears to have contributed to the reduction in jury trials.","a bifurcated jury trial system, appears to have contributed to the reduction in jury trials.","a bifurcated jury trial system, appears to have contributed to the reduction in jury trials.","a bifurcated jury trial system, appears to have contributed to the reduction in jury trials.","a bifurcated jury trial system, appears to have contributed to the reduction in jury trials.","a bifurcated jury trial system, appears to have contributed to the reduction in jury trials.","a bifurcated jury trial system, appears to have contributed to the reduction in jury trials.","a bifurcated jury trial system, appears to have contributed to the reduction in jury trials.","a bifurcated jury trial system, appears to have contributed to the reduction in jury trials.","a bifurcated jury trial system, appears to have contributed to the reduction in jury trials.","a bifurcated jury trial system, appears to have contributed to the reduction in jury trials.","a bifurcated jury trial system, appears to have contributed to the reduction in jury trials.","a bifurcated jury trial system, appears to have contributed to the reduction in jury trials.","a bifurcated jury trial system, appears to have contributed to the reduction in jury trials."
,,,,"Since FY2000, the percentage of jury convictions has remained less than 2%.","Since FY2000, the percentage of jury convictions has remained less than 2%.","Since FY2000, the percentage of jury convictions has remained less than 2%.","Since FY2000, the percentage of jury convictions has remained less than 2%.","Since FY2000, the percentage of jury convictions has remained less than 2%.","Since FY2000, the percentage of jury convictions has remained less than 2%.","Since FY2000, the percentage of jury convictions has remained less than 2%.","Since FY2000, the percentage of jury convictions has remained less than 2%.","Since FY2000, the percentage of jury convictions has remained less than 2%.","Since FY2000, the percentage of jury convictions has remained less than 2%.","Since FY2000, the percentage of jury convictions has remained less than 2%.","Since FY2000, the percentage of jury convictions has remained less than 2%.","Since FY2000, the percentage of jury convictions has remained less than 2%.","Since FY2000, the percentage of jury convictions has remained less than 2%.","Since FY2000, the percentage of jury convictions has remained less than 2%.","Since FY2000, the percentage of jury convictions has remained less than 2%.","Since FY2000, the percentage of jury convictions has remained less than 2%.",
,,,,"Inspecting jury data by offense type reveals very divergent patterns for person, property,","Inspecting jury data by offense type reveals very divergent patterns for person, property,","Inspecting jury data by offense type reveals very divergent patterns for person, property,","Inspecting jury data by offense type reveals very divergent patterns for person, property,","Inspecting jury data by offense type reveals very divergent patterns for person, property,","Inspecting jury data by offense type reveals very divergent patterns for person, property,","Inspecting jury data by offense type reveals very divergent patterns for person, property,","Inspecting jury data by offense type reveals very divergent patterns for person, property,","Inspecting jury data by offense type reveals very divergent patterns for person, property,","Inspecting jury data by offense type reveals very divergent patterns for person, property,","Inspecting jury data by offense type reveals very divergent patterns for person, property,","Inspecting jury data by offense type reveals very divergent patterns for person, property,","Inspecting jury data by offense type reveals very divergent patterns for person, property,","Inspecting jury data by offense type reveals very divergent patterns for person, property,","Inspecting jury data by offense type reveals very divergent patterns for person, property,","Inspecting jury data by offense type reveals very divergent patterns for person, property,","Inspecting jury data by offense type reveals very divergent patterns for person, property,","Inspecting jury data by offense type reveals very divergent patterns for person, property,"
,,,,"and drug crimes. Under the parole system, jury cases comprised 11% to 16% of felony","and drug crimes. Under the parole system, jury cases comprised 11% to 16% of felony","and drug crimes. Under the parole system, jury cases comprised 11% to 16% of felony","and drug crimes. Under the parole system, jury cases comprised 11% to 16% of felony","and drug crimes. Under the parole system, jury cases comprised 11% to 16% of felony","and drug crimes. Under the parole system, jury cases comprised 11% to 16% of felony","and drug crimes. Under the parole system, jury cases comprised 11% to 16% of felony","and drug crimes. Under the parole system, jury cases comprised 11% to 16% of felony","and drug crimes. Under the parole system, jury cases comprised 11% to 16% of felony","and drug crimes. Under the parole system, jury cases comprised 11% to 16% of felony","and drug crimes. Under the parole system, jury cases comprised 11% to 16% of felony","and drug crimes. Under the parole system, jury cases comprised 11% to 16% of felony","and drug crimes. Under the parole system, jury cases comprised 11% to 16% of felony","and drug crimes. Under the parole system, jury cases comprised 11% to 16% of felony","and drug crimes. Under the parole system, jury cases comprised 11% to 16% of felony","and drug crimes. Under the parole system, jury cases comprised 11% to 16% of felony","and drug crimes. Under the parole system, jury cases comprised 11% to 16% of felony","and drug crimes. Under the parole system, jury cases comprised 11% to 16% of felony"
,,,,convictions for person crimes. This rate was typically three to four times the rate of jury,convictions for person crimes. This rate was typically three to four times the rate of jury,convictions for person crimes. This rate was typically three to four times the rate of jury,convictions for person crimes. This rate was typically three to four times the rate of jury,convictions for person crimes. This rate was typically three to four times the rate of jury,convictions for person crimes. This rate was typically three to four times the rate of jury,convictions for person crimes. This rate was typically three to four times the rate of jury,convictions for person crimes. This rate was typically three to four times the rate of jury,convictions for person crimes. This rate was typically three to four times the rate of jury,convictions for person crimes. This rate was typically three to four times the rate of jury,convictions for person crimes. This rate was typically three to four times the rate of jury,convictions for person crimes. This rate was typically three to four times the rate of jury,convictions for person crimes. This rate was typically three to four times the rate of jury,convictions for person crimes. This rate was typically three to four times the rate of jury,convictions for person crimes. This rate was typically three to four times the rate of jury,convictions for person crimes. This rate was typically three to four times the rate of jury,convictions for person crimes. This rate was typically three to four times the rate of jury,convictions for person crimes. This rate was typically three to four times the rate of jury
,,,,"trials for property and drug crimes (Figure 15). However, with the implementation of","trials for property and drug crimes (Figure 15). However, with the implementation of","trials for property and drug crimes (Figure 15). However, with the implementation of","trials for property and drug crimes (Figure 15). However, with the implementation of","trials for property and drug crimes (Figure 15). However, with the implementation of","trials for property and drug crimes (Figure 15). However, with the implementation of","trials for property and drug crimes (Figure 15). However, with the implementation of","trials for property and drug crimes (Figure 15). However, with the implementation of","trials for property and drug crimes (Figure 15). However, with the implementation of","trials for property and drug crimes (Figure 15). However, with the implementation of","trials for property and drug crimes (Figure 15). However, with the implementation of","trials for property and drug crimes (Figure 15). However, with the implementation of","trials for property and drug crimes (Figure 15). However, with the implementation of","trials for property and drug crimes (Figure 15). However, with the implementation of","trials for property and drug crimes (Figure 15). However, with the implementation of","trials for property and drug crimes (Figure 15). However, with the implementation of","trials for property and drug crimes (Figure 15). However, with the implementation of","trials for property and drug crimes (Figure 15). However, with the implementation of"
,,,,"bifurcated trials and truth-in-sentencing provisions, the percent of convictions decided by","bifurcated trials and truth-in-sentencing provisions, the percent of convictions decided by","bifurcated trials and truth-in-sentencing provisions, the percent of convictions decided by","bifurcated trials and truth-in-sentencing provisions, the percent of convictions decided by","bifurcated trials and truth-in-sentencing provisions, the percent of convictions decided by","bifurcated trials and truth-in-sentencing provisions, the percent of convictions decided by","bifurcated trials and truth-in-sentencing provisions, the percent of convictions decided by","bifurcated trials and truth-in-sentencing provisions, the percent of convictions decided by","bifurcated trials and truth-in-sentencing provisions, the percent of convictions decided by","bifurcated trials and truth-in-sentencing provisions, the percent of convictions decided by","bifurcated trials and truth-in-sentencing provisions, the percent of convictions decided by","bifurcated trials and truth-in-sentencing provisions, the percent of convictions decided by","bifurcated trials and truth-in-sentencing provisions, the percent of convictions decided by","bifurcated trials and truth-in-sentencing provisions, the percent of convictions decided by","bifurcated trials and truth-in-sentencing provisions, the percent of convictions decided by","bifurcated trials and truth-in-sentencing provisions, the percent of convictions decided by","bifurcated trials and truth-in-sentencing provisions, the percent of convictions decided by","bifurcated trials and truth-in-sentencing provisions, the percent of convictions decided by"
,,,,"juries dropped dramatically for all crime types. Since FY2007, the rate of jury convictions","juries dropped dramatically for all crime types. Since FY2007, the rate of jury convictions","juries dropped dramatically for all crime types. Since FY2007, the rate of jury convictions","juries dropped dramatically for all crime types. Since FY2007, the rate of jury convictions","juries dropped dramatically for all crime types. Since FY2007, the rate of jury convictions","juries dropped dramatically for all crime types. Since FY2007, the rate of jury convictions","juries dropped dramatically for all crime types. Since FY2007, the rate of jury convictions","juries dropped dramatically for all crime types. Since FY2007, the rate of jury convictions","juries dropped dramatically for all crime types. Since FY2007, the rate of jury convictions","juries dropped dramatically for all crime types. Since FY2007, the rate of jury convictions","juries dropped dramatically for all crime types. Since FY2007, the rate of jury convictions","juries dropped dramatically for all crime types. Since FY2007, the rate of jury convictions","juries dropped dramatically for all crime types. Since FY2007, the rate of jury convictions","juries dropped dramatically for all crime types. Since FY2007, the rate of jury convictions","juries dropped dramatically for all crime types. Since FY2007, the rate of jury convictions","juries dropped dramatically for all crime types. Since FY2007, the rate of jury convictions","juries dropped dramatically for all crime types. Since FY2007, the rate of jury convictions","juries dropped dramatically for all crime types. Since FY2007, the rate of jury convictions"
,,,,"for person crimes has been between 5% and 6%, the lowest rates since truth-in-","for person crimes has been between 5% and 6%, the lowest rates since truth-in-","for person crimes has been between 5% and 6%, the lowest rates since truth-in-","for person crimes has been between 5% and 6%, the lowest rates since truth-in-","for person crimes has been between 5% and 6%, the lowest rates since truth-in-","for person crimes has been between 5% and 6%, the lowest rates since truth-in-","for person crimes has been between 5% and 6%, the lowest rates since truth-in-","for person crimes has been between 5% and 6%, the lowest rates since truth-in-","for person crimes has been between 5% and 6%, the lowest rates since truth-in-","for person crimes has been between 5% and 6%, the lowest rates since truth-in-","for person crimes has been between 5% and 6%, the lowest rates since truth-in-","for person crimes has been between 5% and 6%, the lowest rates since truth-in-","for person crimes has been between 5% and 6%, the lowest rates since truth-in-","for person crimes has been between 5% and 6%, the lowest rates since truth-in-","for person crimes has been between 5% and 6%, the lowest rates since truth-in-","for person crimes has been between 5% and 6%, the lowest rates since truth-in-","for person crimes has been between 5% and 6%, the lowest rates since truth-in-","for person crimes has been between 5% and 6%, the lowest rates since truth-in-"
,,,,sentencing was enacted. The percent of felony convictions resulting from jury trials for,sentencing was enacted. The percent of felony convictions resulting from jury trials for,sentencing was enacted. The percent of felony convictions resulting from jury trials for,sentencing was enacted. The percent of felony convictions resulting from jury trials for,sentencing was enacted. The percent of felony convictions resulting from jury trials for,sentencing was enacted. The percent of felony convictions resulting from jury trials for,sentencing was enacted. The percent of felony convictions resulting from jury trials for,sentencing was enacted. The percent of felony convictions resulting from jury trials for,sentencing was enacted. The percent of felony convictions resulting from jury trials for,sentencing was enacted. The percent of felony convictions resulting from jury trials for,sentencing was enacted. The percent of felony convictions resulting from jury trials for,sentencing was enacted. The percent of felony convictions resulting from jury trials for,sentencing was enacted. The percent of felony convictions resulting from jury trials for,sentencing was enacted. The percent of felony convictions resulting from jury trials for,sentencing was enacted. The percent of felony convictions resulting from jury trials for,sentencing was enacted. The percent of felony convictions resulting from jury trials for,sentencing was enacted. The percent of felony convictions resulting from jury trials for,sentencing was enacted. The percent of felony convictions resulting from jury trials for
