Name: “Table 1 of 1 on page 23 of 200”,Name: “Table 1 of 1 on page 23 of 200”,Name: “Table 1 of 1 on page 23 of 200”,Name: “Table 1 of 1 on page 23 of 200”,Name: “Table 1 of 1 on page 23 of 200”,Name: “Table 1 of 1 on page 23 of 200”,Name: “Table 1 of 1 on page 23 of 200”,Name: “Table 1 of 1 on page 23 of 200”,Name: “Table 1 of 1 on page 23 of 200”,Name: “Table 1 of 1 on page 23 of 200”,Name: “Table 1 of 1 on page 23 of 200”,Name: “Table 1 of 1 on page 23 of 200”,Name: “Table 1 of 1 on page 23 of 200”
Table: 23,Table: 23,Table: 23,Table: 23,Table: 23,Table: 23,Table: 23,Table: 23,Table: 23,Table: 23,Table: 23,Table: 23,Table: 23
,,,,,,,,,,,,
,,,,,,,,,,P a g e | 21,P a g e | 21,P a g e | 21
partnership between the Office of Family Health Services and the OCME. The OCME provides coordination for,partnership between the Office of Family Health Services and the OCME. The OCME provides coordination for,partnership between the Office of Family Health Services and the OCME. The OCME provides coordination for,partnership between the Office of Family Health Services and the OCME. The OCME provides coordination for,partnership between the Office of Family Health Services and the OCME. The OCME provides coordination for,partnership between the Office of Family Health Services and the OCME. The OCME provides coordination for,partnership between the Office of Family Health Services and the OCME. The OCME provides coordination for,partnership between the Office of Family Health Services and the OCME. The OCME provides coordination for,partnership between the Office of Family Health Services and the OCME. The OCME provides coordination for,partnership between the Office of Family Health Services and the OCME. The OCME provides coordination for,partnership between the Office of Family Health Services and the OCME. The OCME provides coordination for,partnership between the Office of Family Health Services and the OCME. The OCME provides coordination for,partnership between the Office of Family Health Services and the OCME. The OCME provides coordination for
the Team.,Virginia’s Team is often asked to provide resources to other states considering undertaking,Virginia’s Team is often asked to provide resources to other states considering undertaking,Virginia’s Team is often asked to provide resources to other states considering undertaking,Virginia’s Team is often asked to provide resources to other states considering undertaking,Virginia’s Team is often asked to provide resources to other states considering undertaking,Virginia’s Team is often asked to provide resources to other states considering undertaking,Virginia’s Team is often asked to provide resources to other states considering undertaking,Virginia’s Team is often asked to provide resources to other states considering undertaking,Virginia’s Team is often asked to provide resources to other states considering undertaking,Virginia’s Team is often asked to provide resources to other states considering undertaking,Virginia’s Team is often asked to provide resources to other states considering undertaking,Virginia’s Team is often asked to provide resources to other states considering undertaking
maternal mortality reviews.,maternal mortality reviews.,maternal mortality reviews.,maternal mortality reviews.,,,,,,,,,
"The Maternal Mortality Review Team reviews all cases of pregnancy-associated death, regardless of the cause","The Maternal Mortality Review Team reviews all cases of pregnancy-associated death, regardless of the cause","The Maternal Mortality Review Team reviews all cases of pregnancy-associated death, regardless of the cause","The Maternal Mortality Review Team reviews all cases of pregnancy-associated death, regardless of the cause","The Maternal Mortality Review Team reviews all cases of pregnancy-associated death, regardless of the cause","The Maternal Mortality Review Team reviews all cases of pregnancy-associated death, regardless of the cause","The Maternal Mortality Review Team reviews all cases of pregnancy-associated death, regardless of the cause","The Maternal Mortality Review Team reviews all cases of pregnancy-associated death, regardless of the cause","The Maternal Mortality Review Team reviews all cases of pregnancy-associated death, regardless of the cause","The Maternal Mortality Review Team reviews all cases of pregnancy-associated death, regardless of the cause","The Maternal Mortality Review Team reviews all cases of pregnancy-associated death, regardless of the cause","The Maternal Mortality Review Team reviews all cases of pregnancy-associated death, regardless of the cause","The Maternal Mortality Review Team reviews all cases of pregnancy-associated death, regardless of the cause"
"or manner of death or outcome of the pregnancy. Systematic, retrospective review of these deaths is","or manner of death or outcome of the pregnancy. Systematic, retrospective review of these deaths is","or manner of death or outcome of the pregnancy. Systematic, retrospective review of these deaths is","or manner of death or outcome of the pregnancy. Systematic, retrospective review of these deaths is","or manner of death or outcome of the pregnancy. Systematic, retrospective review of these deaths is","or manner of death or outcome of the pregnancy. Systematic, retrospective review of these deaths is","or manner of death or outcome of the pregnancy. Systematic, retrospective review of these deaths is","or manner of death or outcome of the pregnancy. Systematic, retrospective review of these deaths is","or manner of death or outcome of the pregnancy. Systematic, retrospective review of these deaths is","or manner of death or outcome of the pregnancy. Systematic, retrospective review of these deaths is","or manner of death or outcome of the pregnancy. Systematic, retrospective review of these deaths is","or manner of death or outcome of the pregnancy. Systematic, retrospective review of these deaths is","or manner of death or outcome of the pregnancy. Systematic, retrospective review of these deaths is"
undertaken,for,the,purpose,of,understanding,the,circumstances,surrounding,the,death,so,that
recommendations and interventions can be made to prevent future deaths.,recommendations and interventions can be made to prevent future deaths.,recommendations and interventions can be made to prevent future deaths.,recommendations and interventions can be made to prevent future deaths.,recommendations and interventions can be made to prevent future deaths.,recommendations and interventions can be made to prevent future deaths.,recommendations and interventions can be made to prevent future deaths.,recommendations and interventions can be made to prevent future deaths.,,,,,
The Team is multidisciplinary and includes representatives from the Medical Society of Virginia; Virginia,The Team is multidisciplinary and includes representatives from the Medical Society of Virginia; Virginia,The Team is multidisciplinary and includes representatives from the Medical Society of Virginia; Virginia,The Team is multidisciplinary and includes representatives from the Medical Society of Virginia; Virginia,The Team is multidisciplinary and includes representatives from the Medical Society of Virginia; Virginia,The Team is multidisciplinary and includes representatives from the Medical Society of Virginia; Virginia,The Team is multidisciplinary and includes representatives from the Medical Society of Virginia; Virginia,The Team is multidisciplinary and includes representatives from the Medical Society of Virginia; Virginia,The Team is multidisciplinary and includes representatives from the Medical Society of Virginia; Virginia,The Team is multidisciplinary and includes representatives from the Medical Society of Virginia; Virginia,The Team is multidisciplinary and includes representatives from the Medical Society of Virginia; Virginia,The Team is multidisciplinary and includes representatives from the Medical Society of Virginia; Virginia,
Section of the American College of Obstetricians and Gynecologists; Virginia Chapter of the American College,Section of the American College of Obstetricians and Gynecologists; Virginia Chapter of the American College,Section of the American College of Obstetricians and Gynecologists; Virginia Chapter of the American College,Section of the American College of Obstetricians and Gynecologists; Virginia Chapter of the American College,Section of the American College of Obstetricians and Gynecologists; Virginia Chapter of the American College,Section of the American College of Obstetricians and Gynecologists; Virginia Chapter of the American College,Section of the American College of Obstetricians and Gynecologists; Virginia Chapter of the American College,Section of the American College of Obstetricians and Gynecologists; Virginia Chapter of the American College,Section of the American College of Obstetricians and Gynecologists; Virginia Chapter of the American College,Section of the American College of Obstetricians and Gynecologists; Virginia Chapter of the American College,Section of the American College of Obstetricians and Gynecologists; Virginia Chapter of the American College,Section of the American College of Obstetricians and Gynecologists; Virginia Chapter of the American College,Section of the American College of Obstetricians and Gynecologists; Virginia Chapter of the American College
"of Nurse Midwives; Association of Women’s Health, Obstetrics and Neonatal Nurses; Virginia Chapter of the","of Nurse Midwives; Association of Women’s Health, Obstetrics and Neonatal Nurses; Virginia Chapter of the","of Nurse Midwives; Association of Women’s Health, Obstetrics and Neonatal Nurses; Virginia Chapter of the","of Nurse Midwives; Association of Women’s Health, Obstetrics and Neonatal Nurses; Virginia Chapter of the","of Nurse Midwives; Association of Women’s Health, Obstetrics and Neonatal Nurses; Virginia Chapter of the","of Nurse Midwives; Association of Women’s Health, Obstetrics and Neonatal Nurses; Virginia Chapter of the","of Nurse Midwives; Association of Women’s Health, Obstetrics and Neonatal Nurses; Virginia Chapter of the","of Nurse Midwives; Association of Women’s Health, Obstetrics and Neonatal Nurses; Virginia Chapter of the","of Nurse Midwives; Association of Women’s Health, Obstetrics and Neonatal Nurses; Virginia Chapter of the","of Nurse Midwives; Association of Women’s Health, Obstetrics and Neonatal Nurses; Virginia Chapter of the","of Nurse Midwives; Association of Women’s Health, Obstetrics and Neonatal Nurses; Virginia Chapter of the","of Nurse Midwives; Association of Women’s Health, Obstetrics and Neonatal Nurses; Virginia Chapter of the","of Nurse Midwives; Association of Women’s Health, Obstetrics and Neonatal Nurses; Virginia Chapter of the"
National Association of Social Workers; Virginia Hospital and Healthcare Association; Virginia Sexual and,National Association of Social Workers; Virginia Hospital and Healthcare Association; Virginia Sexual and,National Association of Social Workers; Virginia Hospital and Healthcare Association; Virginia Sexual and,National Association of Social Workers; Virginia Hospital and Healthcare Association; Virginia Sexual and,National Association of Social Workers; Virginia Hospital and Healthcare Association; Virginia Sexual and,National Association of Social Workers; Virginia Hospital and Healthcare Association; Virginia Sexual and,National Association of Social Workers; Virginia Hospital and Healthcare Association; Virginia Sexual and,National Association of Social Workers; Virginia Hospital and Healthcare Association; Virginia Sexual and,National Association of Social Workers; Virginia Hospital and Healthcare Association; Virginia Sexual and,National Association of Social Workers; Virginia Hospital and Healthcare Association; Virginia Sexual and,National Association of Social Workers; Virginia Hospital and Healthcare Association; Virginia Sexual and,National Association of Social Workers; Virginia Hospital and Healthcare Association; Virginia Sexual and,
Domestic Violence Action Alliance; Virginia Dietetic Association; local health departments; and state planning,Domestic Violence Action Alliance; Virginia Dietetic Association; local health departments; and state planning,Domestic Violence Action Alliance; Virginia Dietetic Association; local health departments; and state planning,Domestic Violence Action Alliance; Virginia Dietetic Association; local health departments; and state planning,Domestic Violence Action Alliance; Virginia Dietetic Association; local health departments; and state planning,Domestic Violence Action Alliance; Virginia Dietetic Association; local health departments; and state planning,Domestic Violence Action Alliance; Virginia Dietetic Association; local health departments; and state planning,Domestic Violence Action Alliance; Virginia Dietetic Association; local health departments; and state planning,Domestic Violence Action Alliance; Virginia Dietetic Association; local health departments; and state planning,Domestic Violence Action Alliance; Virginia Dietetic Association; local health departments; and state planning,Domestic Violence Action Alliance; Virginia Dietetic Association; local health departments; and state planning,Domestic Violence Action Alliance; Virginia Dietetic Association; local health departments; and state planning,Domestic Violence Action Alliance; Virginia Dietetic Association; local health departments; and state planning
"agencies. Maternal mortality review is supported by the Virginia Department of Health, Office of Family Health","agencies. Maternal mortality review is supported by the Virginia Department of Health, Office of Family Health","agencies. Maternal mortality review is supported by the Virginia Department of Health, Office of Family Health","agencies. Maternal mortality review is supported by the Virginia Department of Health, Office of Family Health","agencies. Maternal mortality review is supported by the Virginia Department of Health, Office of Family Health","agencies. Maternal mortality review is supported by the Virginia Department of Health, Office of Family Health","agencies. Maternal mortality review is supported by the Virginia Department of Health, Office of Family Health","agencies. Maternal mortality review is supported by the Virginia Department of Health, Office of Family Health","agencies. Maternal mortality review is supported by the Virginia Department of Health, Office of Family Health","agencies. Maternal mortality review is supported by the Virginia Department of Health, Office of Family Health","agencies. Maternal mortality review is supported by the Virginia Department of Health, Office of Family Health","agencies. Maternal mortality review is supported by the Virginia Department of Health, Office of Family Health","agencies. Maternal mortality review is supported by the Virginia Department of Health, Office of Family Health"
"Services with Title V funds from the U.S. Department of Health and Human Services, Maternal and Child","Services with Title V funds from the U.S. Department of Health and Human Services, Maternal and Child","Services with Title V funds from the U.S. Department of Health and Human Services, Maternal and Child","Services with Title V funds from the U.S. Department of Health and Human Services, Maternal and Child","Services with Title V funds from the U.S. Department of Health and Human Services, Maternal and Child","Services with Title V funds from the U.S. Department of Health and Human Services, Maternal and Child","Services with Title V funds from the U.S. Department of Health and Human Services, Maternal and Child","Services with Title V funds from the U.S. Department of Health and Human Services, Maternal and Child","Services with Title V funds from the U.S. Department of Health and Human Services, Maternal and Child","Services with Title V funds from the U.S. Department of Health and Human Services, Maternal and Child","Services with Title V funds from the U.S. Department of Health and Human Services, Maternal and Child","Services with Title V funds from the U.S. Department of Health and Human Services, Maternal and Child",
Health Bureau. Published reports are available at:,Health Bureau. Published reports are available at:,Health Bureau. Published reports are available at:,Health Bureau. Published reports are available at:,Health Bureau. Published reports are available at:,Health Bureau. Published reports are available at:,,,,,,,
http://www.vdh.virginia.gov/medexam/maternalmortality.htm. These reports include:,http://www.vdh.virginia.gov/medexam/maternalmortality.htm. These reports include:,http://www.vdh.virginia.gov/medexam/maternalmortality.htm. These reports include:,http://www.vdh.virginia.gov/medexam/maternalmortality.htm. These reports include:,http://www.vdh.virginia.gov/medexam/maternalmortality.htm. These reports include:,http://www.vdh.virginia.gov/medexam/maternalmortality.htm. These reports include:,http://www.vdh.virginia.gov/medexam/maternalmortality.htm. These reports include:,http://www.vdh.virginia.gov/medexam/maternalmortality.htm. These reports include:,http://www.vdh.virginia.gov/medexam/maternalmortality.htm. These reports include:,,,,
,"Pregnancy-Associated Deaths from Heart Disorders and Related Conditions in Virginia, 1999-2004,","Pregnancy-Associated Deaths from Heart Disorders and Related Conditions in Virginia, 1999-2004,","Pregnancy-Associated Deaths from Heart Disorders and Related Conditions in Virginia, 1999-2004,","Pregnancy-Associated Deaths from Heart Disorders and Related Conditions in Virginia, 1999-2004,","Pregnancy-Associated Deaths from Heart Disorders and Related Conditions in Virginia, 1999-2004,","Pregnancy-Associated Deaths from Heart Disorders and Related Conditions in Virginia, 1999-2004,","Pregnancy-Associated Deaths from Heart Disorders and Related Conditions in Virginia, 1999-2004,","Pregnancy-Associated Deaths from Heart Disorders and Related Conditions in Virginia, 1999-2004,","Pregnancy-Associated Deaths from Heart Disorders and Related Conditions in Virginia, 1999-2004,","Pregnancy-Associated Deaths from Heart Disorders and Related Conditions in Virginia, 1999-2004,","Pregnancy-Associated Deaths from Heart Disorders and Related Conditions in Virginia, 1999-2004,","Pregnancy-Associated Deaths from Heart Disorders and Related Conditions in Virginia, 1999-2004,"
,"Published: July, 2012;","Published: July, 2012;","Published: July, 2012;",,,,,,,,,
,"Pregnancy Related Deaths in Virginia, 1999-2003, Published November 2010;","Pregnancy Related Deaths in Virginia, 1999-2003, Published November 2010;","Pregnancy Related Deaths in Virginia, 1999-2003, Published November 2010;","Pregnancy Related Deaths in Virginia, 1999-2003, Published November 2010;","Pregnancy Related Deaths in Virginia, 1999-2003, Published November 2010;","Pregnancy Related Deaths in Virginia, 1999-2003, Published November 2010;","Pregnancy Related Deaths in Virginia, 1999-2003, Published November 2010;",,,,,
,"Obesity and Maternal Death in Virginia, 1999-2002, Published March, 2009; and","Obesity and Maternal Death in Virginia, 1999-2002, Published March, 2009; and","Obesity and Maternal Death in Virginia, 1999-2002, Published March, 2009; and","Obesity and Maternal Death in Virginia, 1999-2002, Published March, 2009; and","Obesity and Maternal Death in Virginia, 1999-2002, Published March, 2009; and","Obesity and Maternal Death in Virginia, 1999-2002, Published March, 2009; and","Obesity and Maternal Death in Virginia, 1999-2002, Published March, 2009; and","Obesity and Maternal Death in Virginia, 1999-2002, Published March, 2009; and",,,,
,"Pregnancy-Associated Maternal Death in Virginia, 1999-2001, Published October, 2007.","Pregnancy-Associated Maternal Death in Virginia, 1999-2001, Published October, 2007.","Pregnancy-Associated Maternal Death in Virginia, 1999-2001, Published October, 2007.","Pregnancy-Associated Maternal Death in Virginia, 1999-2001, Published October, 2007.","Pregnancy-Associated Maternal Death in Virginia, 1999-2001, Published October, 2007.","Pregnancy-Associated Maternal Death in Virginia, 1999-2001, Published October, 2007.","Pregnancy-Associated Maternal Death in Virginia, 1999-2001, Published October, 2007.","Pregnancy-Associated Maternal Death in Virginia, 1999-2001, Published October, 2007.","Pregnancy-Associated Maternal Death in Virginia, 1999-2001, Published October, 2007.","Pregnancy-Associated Maternal Death in Virginia, 1999-2001, Published October, 2007.",,
Training and Education,Training and Education,Training and Education,Training and Education,,,,,,,,,
Forensic Pathology Training Programs,Forensic Pathology Training Programs,Forensic Pathology Training Programs,Forensic Pathology Training Programs,Forensic Pathology Training Programs,Forensic Pathology Training Programs,,,,,,,
Website — http://www.vdh.state.va.us/medExam/training.htm,Website — http://www.vdh.state.va.us/medExam/training.htm,Website — http://www.vdh.state.va.us/medExam/training.htm,Website — http://www.vdh.state.va.us/medExam/training.htm,Website — http://www.vdh.state.va.us/medExam/training.htm,Website — http://www.vdh.state.va.us/medExam/training.htm,Website — http://www.vdh.state.va.us/medExam/training.htm,Website — http://www.vdh.state.va.us/medExam/training.htm,,,,,
"The Virginia Commonwealth University School of Medicine (VCU), in conjunction with the OCME, offers an","The Virginia Commonwealth University School of Medicine (VCU), in conjunction with the OCME, offers an","The Virginia Commonwealth University School of Medicine (VCU), in conjunction with the OCME, offers an","The Virginia Commonwealth University School of Medicine (VCU), in conjunction with the OCME, offers an","The Virginia Commonwealth University School of Medicine (VCU), in conjunction with the OCME, offers an","The Virginia Commonwealth University School of Medicine (VCU), in conjunction with the OCME, offers an","The Virginia Commonwealth University School of Medicine (VCU), in conjunction with the OCME, offers an","The Virginia Commonwealth University School of Medicine (VCU), in conjunction with the OCME, offers an","The Virginia Commonwealth University School of Medicine (VCU), in conjunction with the OCME, offers an","The Virginia Commonwealth University School of Medicine (VCU), in conjunction with the OCME, offers an","The Virginia Commonwealth University School of Medicine (VCU), in conjunction with the OCME, offers an","The Virginia Commonwealth University School of Medicine (VCU), in conjunction with the OCME, offers an","The Virginia Commonwealth University School of Medicine (VCU), in conjunction with the OCME, offers an"
Accreditation Council for Graduate Medical Education (ACGME) accredited fellowship in the subspecialty of,Accreditation Council for Graduate Medical Education (ACGME) accredited fellowship in the subspecialty of,Accreditation Council for Graduate Medical Education (ACGME) accredited fellowship in the subspecialty of,Accreditation Council for Graduate Medical Education (ACGME) accredited fellowship in the subspecialty of,Accreditation Council for Graduate Medical Education (ACGME) accredited fellowship in the subspecialty of,Accreditation Council for Graduate Medical Education (ACGME) accredited fellowship in the subspecialty of,Accreditation Council for Graduate Medical Education (ACGME) accredited fellowship in the subspecialty of,Accreditation Council for Graduate Medical Education (ACGME) accredited fellowship in the subspecialty of,Accreditation Council for Graduate Medical Education (ACGME) accredited fellowship in the subspecialty of,Accreditation Council for Graduate Medical Education (ACGME) accredited fellowship in the subspecialty of,Accreditation Council for Graduate Medical Education (ACGME) accredited fellowship in the subspecialty of,Accreditation Council for Graduate Medical Education (ACGME) accredited fellowship in the subspecialty of,Accreditation Council for Graduate Medical Education (ACGME) accredited fellowship in the subspecialty of
Virginia Department of Health,Virginia Department of Health,Virginia Department of Health,,,Office of the Chief Medical Examiner,Office of the Chief Medical Examiner,Office of the Chief Medical Examiner,,,,April 2014,April 2014
