"fingerprints, and toxicology on the caretaker. A scene","fingerprints, and toxicology on the caretaker. A scene","fingerprints, and toxicology on the caretaker. A scene","fingerprints, and toxicology on the caretaker. A scene","fingerprints, and toxicology on the caretaker. A scene","fingerprints, and toxicology on the caretaker. A scene","fingerprints, and toxicology on the caretaker. A scene","fingerprints, and toxicology on the caretaker. A scene","fingerprints, and toxicology on the caretaker. A scene",a child. Three cases resulted in convictions and one,a child. Three cases resulted in convictions and one,a child. Three cases resulted in convictions and one,a child. Three cases resulted in convictions and one,a child. Three cases resulted in convictions and one,a child. Three cases resulted in convictions and one,a child. Three cases resulted in convictions and one,a child. Three cases resulted in convictions and one,a child. Three cases resulted in convictions and one,a child. Three cases resulted in convictions and one
reconstruction was rare but included assessing the,reconstruction was rare but included assessing the,reconstruction was rare but included assessing the,reconstruction was rare but included assessing the,reconstruction was rare but included assessing the,reconstruction was rare but included assessing the,reconstruction was rare but included assessing the,reconstruction was rare but included assessing the,reconstruction was rare but included assessing the,case was dismissed.,case was dismissed.,case was dismissed.,While these incidents reflected,While these incidents reflected,While these incidents reflected,While these incidents reflected,While these incidents reflected,While these incidents reflected,While these incidents reflected
"temperature of the vehicle under similar conditions,","temperature of the vehicle under similar conditions,","temperature of the vehicle under similar conditions,","temperature of the vehicle under similar conditions,","temperature of the vehicle under similar conditions,","temperature of the vehicle under similar conditions,","temperature of the vehicle under similar conditions,","temperature of the vehicle under similar conditions,","temperature of the vehicle under similar conditions,","the tragedy of child death, lack of criminal intent or","the tragedy of child death, lack of criminal intent or","the tragedy of child death, lack of criminal intent or","the tragedy of child death, lack of criminal intent or","the tragedy of child death, lack of criminal intent or","the tragedy of child death, lack of criminal intent or","the tragedy of child death, lack of criminal intent or","the tragedy of child death, lack of criminal intent or","the tragedy of child death, lack of criminal intent or","the tragedy of child death, lack of criminal intent or"
"creating and verifying time lines, and driving the","creating and verifying time lines, and driving the","creating and verifying time lines, and driving the","creating and verifying time lines, and driving the","creating and verifying time lines, and driving the","creating and verifying time lines, and driving the","creating and verifying time lines, and driving the","creating and verifying time lines, and driving the","creating and verifying time lines, and driving the",action on the part of the caretaker usually resulted in,action on the part of the caretaker usually resulted in,action on the part of the caretaker usually resulted in,action on the part of the caretaker usually resulted in,action on the part of the caretaker usually resulted in,action on the part of the caretaker usually resulted in,action on the part of the caretaker usually resulted in,action on the part of the caretaker usually resulted in,action on the part of the caretaker usually resulted in,action on the part of the caretaker usually resulted in
caretaker’s route.,caretaker’s route.,caretaker’s route.,,,,,,,no criminal charges.,no criminal charges.,no criminal charges.,,,,,,,
The,depth,of,investigation,investigation,was,dependent,dependent,upon,,,,,,,,,,
the circumstances of the event. Law enforcement,the circumstances of the event. Law enforcement,the circumstances of the event. Law enforcement,the circumstances of the event. Law enforcement,the circumstances of the event. Law enforcement,the circumstances of the event. Law enforcement,the circumstances of the event. Law enforcement,the circumstances of the event. Law enforcement,the circumstances of the event. Law enforcement,,,,,,,,,,
investigations,investigations,investigations,were,more,thorough,thorough,for,incidents,,,,,,,,,,
"with a higher index of suspicion, where a caretaker","with a higher index of suspicion, where a caretaker","with a higher index of suspicion, where a caretaker","with a higher index of suspicion, where a caretaker","with a higher index of suspicion, where a caretaker","with a higher index of suspicion, where a caretaker","with a higher index of suspicion, where a caretaker","with a higher index of suspicion, where a caretaker","with a higher index of suspicion, where a caretaker",,,,,,,,,,
forgot to take the child to a sitter and where neighbors,forgot to take the child to a sitter and where neighbors,forgot to take the child to a sitter and where neighbors,forgot to take the child to a sitter and where neighbors,forgot to take the child to a sitter and where neighbors,forgot to take the child to a sitter and where neighbors,forgot to take the child to a sitter and where neighbors,forgot to take the child to a sitter and where neighbors,forgot to take the child to a sitter and where neighbors,,,,,,,,,,
reported that the parent had left the child unattended,reported that the parent had left the child unattended,reported that the parent had left the child unattended,reported that the parent had left the child unattended,reported that the parent had left the child unattended,reported that the parent had left the child unattended,reported that the parent had left the child unattended,reported that the parent had left the child unattended,reported that the parent had left the child unattended,,,,,,,,,,
in a vehicle on previous occasions.,in a vehicle on previous occasions.,in a vehicle on previous occasions.,in a vehicle on previous occasions.,in a vehicle on previous occasions.,in a vehicle on previous occasions.,They were least,They were least,They were least,,,,,,,,,,
thorough for the incidents where children climbed,thorough for the incidents where children climbed,thorough for the incidents where children climbed,thorough for the incidents where children climbed,thorough for the incidents where children climbed,thorough for the incidents where children climbed,thorough for the incidents where children climbed,thorough for the incidents where children climbed,thorough for the incidents where children climbed,,,,,,,,,,
into the vehicle of their own volition and where the,into the vehicle of their own volition and where the,into the vehicle of their own volition and where the,into the vehicle of their own volition and where the,into the vehicle of their own volition and where the,into the vehicle of their own volition and where the,into the vehicle of their own volition and where the,into the vehicle of their own volition and where the,into the vehicle of their own volition and where the,,,,,,,,,,
caretaker experienced a medical emergency.,caretaker experienced a medical emergency.,caretaker experienced a medical emergency.,caretaker experienced a medical emergency.,caretaker experienced a medical emergency.,caretaker experienced a medical emergency.,caretaker experienced a medical emergency.,caretaker experienced a medical emergency.,,,,,,,,,,,
"At the same time, Team members noted the lack of","At the same time, Team members noted the lack of","At the same time, Team members noted the lack of","At the same time, Team members noted the lack of","At the same time, Team members noted the lack of","At the same time, Team members noted the lack of","At the same time, Team members noted the lack of","At the same time, Team members noted the lack of","At the same time, Team members noted the lack of",,,,,,,,,,
collaboration between law enforcement officers and,collaboration between law enforcement officers and,collaboration between law enforcement officers and,collaboration between law enforcement officers and,collaboration between law enforcement officers and,collaboration between law enforcement officers and,collaboration between law enforcement officers and,collaboration between law enforcement officers and,collaboration between law enforcement officers and,,,,,,,,,,
child protective services (CPS) case workers. Of the,child protective services (CPS) case workers. Of the,child protective services (CPS) case workers. Of the,child protective services (CPS) case workers. Of the,child protective services (CPS) case workers. Of the,child protective services (CPS) case workers. Of the,child protective services (CPS) case workers. Of the,child protective services (CPS) case workers. Of the,child protective services (CPS) case workers. Of the,,,,,,,,,,
Virginia State Child Fatality Review Team - June 2009,Virginia State Child Fatality Review Team - June 2009,Virginia State Child Fatality Review Team - June 2009,Virginia State Child Fatality Review Team - June 2009,Virginia State Child Fatality Review Team - June 2009,Virginia State Child Fatality Review Team - June 2009,Virginia State Child Fatality Review Team - June 2009,Virginia State Child Fatality Review Team - June 2009,Virginia State Child Fatality Review Team - June 2009,Virginia State Child Fatality Review Team - June 2009,,,,,,,,,7
