Name: “Table 1 of 1 on page 16 of 22”,Name: “Table 1 of 1 on page 16 of 22”,Name: “Table 1 of 1 on page 16 of 22”,Name: “Table 1 of 1 on page 16 of 22”,Name: “Table 1 of 1 on page 16 of 22”,Name: “Table 1 of 1 on page 16 of 22”,Name: “Table 1 of 1 on page 16 of 22”,Name: “Table 1 of 1 on page 16 of 22”,Name: “Table 1 of 1 on page 16 of 22”
Table: 16,Table: 16,Table: 16,Table: 16,Table: 16,Table: 16,Table: 16,Table: 16,Table: 16
,,,,,,,,
APPENDIX A: Virginia State Child Fatality Review Team Statute,APPENDIX A: Virginia State Child Fatality Review Team Statute,APPENDIX A: Virginia State Child Fatality Review Team Statute,APPENDIX A: Virginia State Child Fatality Review Team Statute,APPENDIX A: Virginia State Child Fatality Review Team Statute,APPENDIX A: Virginia State Child Fatality Review Team Statute,APPENDIX A: Virginia State Child Fatality Review Team Statute,APPENDIX A: Virginia State Child Fatality Review Team Statute,APPENDIX A: Virginia State Child Fatality Review Team Statute
§ 32.1-283.1. State Child Fatality Review Team established;,§ 32.1-283.1. State Child Fatality Review Team established;,§ 32.1-283.1. State Child Fatality Review Team established;,§ 32.1-283.1. State Child Fatality Review Team established;,§ 32.1-283.1. State Child Fatality Review Team established;,§ 32.1-283.1. State Child Fatality Review Team established;,§ 32.1-283.1. State Child Fatality Review Team established;,§ 32.1-283.1. State Child Fatality Review Team established;,for inspection and copying by the Chief Medical Examiner
membership;,membership;,access,to,and,maintenance,of,records;,pursuant to procedures which shall be developed by
confidentiality; etc.,confidentiality; etc.,confidentiality; etc.,,,,,,the Chief Medical Examiner and the Commonwealth’s
A. There is hereby created the State Child Fatality Review,A. There is hereby created the State Child Fatality Review,A. There is hereby created the State Child Fatality Review,A. There is hereby created the State Child Fatality Review,A. There is hereby created the State Child Fatality Review,A. There is hereby created the State Child Fatality Review,A. There is hereby created the State Child Fatality Review,A. There is hereby created the State Child Fatality Review,Attorneys’ Services Council established by § 2.2-2617. Any
"Team, hereinafter referred to as the “Team,” which shall","Team, hereinafter referred to as the “Team,” which shall","Team, hereinafter referred to as the “Team,” which shall","Team, hereinafter referred to as the “Team,” which shall","Team, hereinafter referred to as the “Team,” which shall","Team, hereinafter referred to as the “Team,” which shall","Team, hereinafter referred to as the “Team,” which shall","Team, hereinafter referred to as the “Team,” which shall",presentence report prepared pursuant to § 19.2-299 for any
develop and implement procedures to ensure that child,develop and implement procedures to ensure that child,develop and implement procedures to ensure that child,develop and implement procedures to ensure that child,develop and implement procedures to ensure that child,develop and implement procedures to ensure that child,develop and implement procedures to ensure that child,develop and implement procedures to ensure that child,person convicted of a crime that led to the death of the child
deaths occurring in Virginia are analyzed in a systematic,deaths occurring in Virginia are analyzed in a systematic,deaths occurring in Virginia are analyzed in a systematic,deaths occurring in Virginia are analyzed in a systematic,deaths occurring in Virginia are analyzed in a systematic,deaths occurring in Virginia are analyzed in a systematic,deaths occurring in Virginia are analyzed in a systematic,deaths occurring in Virginia are analyzed in a systematic,shall be made available for inspection and copying by the
way. The Team shall review (i) violent and unnatural child,way. The Team shall review (i) violent and unnatural child,way. The Team shall review (i) violent and unnatural child,way. The Team shall review (i) violent and unnatural child,way. The Team shall review (i) violent and unnatural child,way. The Team shall review (i) violent and unnatural child,way. The Team shall review (i) violent and unnatural child,way. The Team shall review (i) violent and unnatural child,Chief Medical Examiner pursuant to procedures which
"deaths, (ii) sudden child deaths occurring within the first 18","deaths, (ii) sudden child deaths occurring within the first 18","deaths, (ii) sudden child deaths occurring within the first 18","deaths, (ii) sudden child deaths occurring within the first 18","deaths, (ii) sudden child deaths occurring within the first 18","deaths, (ii) sudden child deaths occurring within the first 18","deaths, (ii) sudden child deaths occurring within the first 18","deaths, (ii) sudden child deaths occurring within the first 18",shall be developed by the Chief Medical Examiner. In
"months of life, and (iii) those fatalities for which the cause","months of life, and (iii) those fatalities for which the cause","months of life, and (iii) those fatalities for which the cause","months of life, and (iii) those fatalities for which the cause","months of life, and (iii) those fatalities for which the cause","months of life, and (iii) those fatalities for which the cause","months of life, and (iii) those fatalities for which the cause","months of life, and (iii) those fatalities for which the cause","addition, the Chief Medical Examiner may inspect and copy"
or manner of death was not determined with reasonable,or manner of death was not determined with reasonable,or manner of death was not determined with reasonable,or manner of death was not determined with reasonable,or manner of death was not determined with reasonable,or manner of death was not determined with reasonable,or manner of death was not determined with reasonable,or manner of death was not determined with reasonable,"from any Virginia health care provider, on behalf of the"
medical certainty. No child death review shall be initiated,medical certainty. No child death review shall be initiated,medical certainty. No child death review shall be initiated,medical certainty. No child death review shall be initiated,medical certainty. No child death review shall be initiated,medical certainty. No child death review shall be initiated,medical certainty. No child death review shall be initiated,medical certainty. No child death review shall be initiated,"Team, (i) without obtaining consent, the health and mental"
by the Team until conclusion of any law-enforcement,by the Team until conclusion of any law-enforcement,by the Team until conclusion of any law-enforcement,by the Team until conclusion of any law-enforcement,by the Team until conclusion of any law-enforcement,by the Team until conclusion of any law-enforcement,by the Team until conclusion of any law-enforcement,by the Team until conclusion of any law-enforcement,health records of the child and those perinatal medical
investigation or criminal prosecution. The Team shall (i),investigation or criminal prosecution. The Team shall (i),investigation or criminal prosecution. The Team shall (i),investigation or criminal prosecution. The Team shall (i),investigation or criminal prosecution. The Team shall (i),investigation or criminal prosecution. The Team shall (i),investigation or criminal prosecution. The Team shall (i),investigation or criminal prosecution. The Team shall (i),records of the child’s mother that related to such child and
develop and revise as necessary operating procedures for,develop and revise as necessary operating procedures for,develop and revise as necessary operating procedures for,develop and revise as necessary operating procedures for,develop and revise as necessary operating procedures for,develop and revise as necessary operating procedures for,develop and revise as necessary operating procedures for,develop and revise as necessary operating procedures for,(ii) upon obtaining consent from each adult regarding his
"the review of child deaths, including identification of cases","the review of child deaths, including identification of cases","the review of child deaths, including identification of cases","the review of child deaths, including identification of cases","the review of child deaths, including identification of cases","the review of child deaths, including identification of cases","the review of child deaths, including identification of cases","the review of child deaths, including identification of cases","personal records, or from a parent regarding the records"
to be reviewed and procedures for coordination among,to be reviewed and procedures for coordination among,to be reviewed and procedures for coordination among,to be reviewed and procedures for coordination among,to be reviewed and procedures for coordination among,to be reviewed and procedures for coordination among,to be reviewed and procedures for coordination among,to be reviewed and procedures for coordination among,"of a minor child, the health and mental health records of"
"the agencies and professionals involved, (ii) improve the","the agencies and professionals involved, (ii) improve the","the agencies and professionals involved, (ii) improve the","the agencies and professionals involved, (ii) improve the","the agencies and professionals involved, (ii) improve the","the agencies and professionals involved, (ii) improve the","the agencies and professionals involved, (ii) improve the","the agencies and professionals involved, (ii) improve the",the child’s family. All such information and records shall
"identification, data collection, and record keeping of the","identification, data collection, and record keeping of the","identification, data collection, and record keeping of the","identification, data collection, and record keeping of the","identification, data collection, and record keeping of the","identification, data collection, and record keeping of the","identification, data collection, and record keeping of the","identification, data collection, and record keeping of the",be confidential and shall be excluded from the Virginia
"causes of child death, (iii) recommend components for","causes of child death, (iii) recommend components for","causes of child death, (iii) recommend components for","causes of child death, (iii) recommend components for","causes of child death, (iii) recommend components for","causes of child death, (iii) recommend components for","causes of child death, (iii) recommend components for","causes of child death, (iii) recommend components for",Freedom of Information Act (§ 2.2-3700 et seq.) pursuant
prevention,prevention,and,education,"programs,",(iv),recommend,recommend,to subdivision 9 of § 2.2-3705.5. Upon the conclusion of the
"training to improve the investigation of child deaths, and","training to improve the investigation of child deaths, and","training to improve the investigation of child deaths, and","training to improve the investigation of child deaths, and","training to improve the investigation of child deaths, and","training to improve the investigation of child deaths, and","training to improve the investigation of child deaths, and","training to improve the investigation of child deaths, and","child death review, all information and records concerning"
"(v) provide technical assistance, upon request, to any local","(v) provide technical assistance, upon request, to any local","(v) provide technical assistance, upon request, to any local","(v) provide technical assistance, upon request, to any local","(v) provide technical assistance, upon request, to any local","(v) provide technical assistance, upon request, to any local","(v) provide technical assistance, upon request, to any local","(v) provide technical assistance, upon request, to any local",the child and the child’s family shall be shredded or
child fatality teams that may be established. The operating,child fatality teams that may be established. The operating,child fatality teams that may be established. The operating,child fatality teams that may be established. The operating,child fatality teams that may be established. The operating,child fatality teams that may be established. The operating,child fatality teams that may be established. The operating,child fatality teams that may be established. The operating,otherwise destroyed by the Chief Medical Examiner in order
procedures for the review of child deaths shall be exempt,procedures for the review of child deaths shall be exempt,procedures for the review of child deaths shall be exempt,procedures for the review of child deaths shall be exempt,procedures for the review of child deaths shall be exempt,procedures for the review of child deaths shall be exempt,procedures for the review of child deaths shall be exempt,procedures for the review of child deaths shall be exempt,to ensure confidentiality. Such information or records shall
from the Administrative Process Act (§ 2.2-4000 et seq.),from the Administrative Process Act (§ 2.2-4000 et seq.),from the Administrative Process Act (§ 2.2-4000 et seq.),from the Administrative Process Act (§ 2.2-4000 et seq.),from the Administrative Process Act (§ 2.2-4000 et seq.),from the Administrative Process Act (§ 2.2-4000 et seq.),from the Administrative Process Act (§ 2.2-4000 et seq.),from the Administrative Process Act (§ 2.2-4000 et seq.),not be subject to subpoena or discovery or be admissible
pursuant to subdivision 17 of subsection B of § 2.2-4002.,pursuant to subdivision 17 of subsection B of § 2.2-4002.,pursuant to subdivision 17 of subsection B of § 2.2-4002.,pursuant to subdivision 17 of subsection B of § 2.2-4002.,pursuant to subdivision 17 of subsection B of § 2.2-4002.,pursuant to subdivision 17 of subsection B of § 2.2-4002.,pursuant to subdivision 17 of subsection B of § 2.2-4002.,pursuant to subdivision 17 of subsection B of § 2.2-4002.,in any criminal or civil proceeding. If available from other
,,,,,,,,"sources, however, such information and records shall not"
B. The 16-member Team shall be chaired by the Chief Medical,B. The 16-member Team shall be chaired by the Chief Medical,B. The 16-member Team shall be chaired by the Chief Medical,B. The 16-member Team shall be chaired by the Chief Medical,B. The 16-member Team shall be chaired by the Chief Medical,B. The 16-member Team shall be chaired by the Chief Medical,B. The 16-member Team shall be chaired by the Chief Medical,B. The 16-member Team shall be chaired by the Chief Medical,"be immune from subpoena, discovery or introduction into"
Examiner and shall be composed of the following persons,Examiner and shall be composed of the following persons,Examiner and shall be composed of the following persons,Examiner and shall be composed of the following persons,Examiner and shall be composed of the following persons,Examiner and shall be composed of the following persons,Examiner and shall be composed of the following persons,Examiner and shall be composed of the following persons,evidence when obtained through such other sources solely
or their designees: the Commissioner of the Department of,or their designees: the Commissioner of the Department of,or their designees: the Commissioner of the Department of,or their designees: the Commissioner of the Department of,or their designees: the Commissioner of the Department of,or their designees: the Commissioner of the Department of,or their designees: the Commissioner of the Department of,or their designees: the Commissioner of the Department of,because the information and records were presented to the
"Mental Health, Mental Retardation and Substance Abuse","Mental Health, Mental Retardation and Substance Abuse","Mental Health, Mental Retardation and Substance Abuse","Mental Health, Mental Retardation and Substance Abuse","Mental Health, Mental Retardation and Substance Abuse","Mental Health, Mental Retardation and Substance Abuse","Mental Health, Mental Retardation and Substance Abuse","Mental Health, Mental Retardation and Substance Abuse","Team during a child death review. Further, the findings of"
Services; the Director of Child Protective Services within,Services; the Director of Child Protective Services within,Services; the Director of Child Protective Services within,Services; the Director of Child Protective Services within,Services; the Director of Child Protective Services within,Services; the Director of Child Protective Services within,Services; the Director of Child Protective Services within,Services; the Director of Child Protective Services within,the Team may be disclosed or published in statistical or other
the Department of Social Services; the Superintendent of,the Department of Social Services; the Superintendent of,the Department of Social Services; the Superintendent of,the Department of Social Services; the Superintendent of,the Department of Social Services; the Superintendent of,the Department of Social Services; the Superintendent of,the Department of Social Services; the Superintendent of,the Department of Social Services; the Superintendent of,form which shall not identify individuals. The portions of
Public Instruction; the State Registrar of Vital Records; and,Public Instruction; the State Registrar of Vital Records; and,Public Instruction; the State Registrar of Vital Records; and,Public Instruction; the State Registrar of Vital Records; and,Public Instruction; the State Registrar of Vital Records; and,Public Instruction; the State Registrar of Vital Records; and,Public Instruction; the State Registrar of Vital Records; and,Public Instruction; the State Registrar of Vital Records; and,meetings in which individual child death cases are discussed
the Director of the Department of Criminal Justice Services.,the Director of the Department of Criminal Justice Services.,the Director of the Department of Criminal Justice Services.,the Director of the Department of Criminal Justice Services.,the Director of the Department of Criminal Justice Services.,the Director of the Department of Criminal Justice Services.,the Director of the Department of Criminal Justice Services.,the Director of the Department of Criminal Justice Services.,by the Team shall be closed pursuant to subdivision A 21
"In addition, one representative from each of the following","In addition, one representative from each of the following","In addition, one representative from each of the following","In addition, one representative from each of the following","In addition, one representative from each of the following","In addition, one representative from each of the following","In addition, one representative from each of the following","In addition, one representative from each of the following","of § 2.2-3711. In addition to the requirements of § 2.2-3712,"
entities shall be appointed by the Governor to serve for a,entities shall be appointed by the Governor to serve for a,entities shall be appointed by the Governor to serve for a,entities shall be appointed by the Governor to serve for a,entities shall be appointed by the Governor to serve for a,entities shall be appointed by the Governor to serve for a,entities shall be appointed by the Governor to serve for a,entities shall be appointed by the Governor to serve for a,"all team members, persons attending closed team meetings,"
"term of three years: local law-enforcement agencies, local","term of three years: local law-enforcement agencies, local","term of three years: local law-enforcement agencies, local","term of three years: local law-enforcement agencies, local","term of three years: local law-enforcement agencies, local","term of three years: local law-enforcement agencies, local","term of three years: local law-enforcement agencies, local","term of three years: local law-enforcement agencies, local",and persons presenting information and records on specific
"fire departments, local departments of social services,","fire departments, local departments of social services,","fire departments, local departments of social services,","fire departments, local departments of social services,","fire departments, local departments of social services,","fire departments, local departments of social services,","fire departments, local departments of social services,","fire departments, local departments of social services,",child deaths to the Team during closed meetings shall
"the Medical Society of Virginia, the Virginia College of","the Medical Society of Virginia, the Virginia College of","the Medical Society of Virginia, the Virginia College of","the Medical Society of Virginia, the Virginia College of","the Medical Society of Virginia, the Virginia College of","the Medical Society of Virginia, the Virginia College of","the Medical Society of Virginia, the Virginia College of","the Medical Society of Virginia, the Virginia College of",execute a sworn statement to honor the confidentiality of the
Emergency,Emergency,"Physicians,",the,Virginia,Pediatric,Pediatric,"Society,","information, records, discussions, and opinions disclosed"
"Virginia Sudden Infant Death Syndrome Alliance, local","Virginia Sudden Infant Death Syndrome Alliance, local","Virginia Sudden Infant Death Syndrome Alliance, local","Virginia Sudden Infant Death Syndrome Alliance, local","Virginia Sudden Infant Death Syndrome Alliance, local","Virginia Sudden Infant Death Syndrome Alliance, local","Virginia Sudden Infant Death Syndrome Alliance, local","Virginia Sudden Infant Death Syndrome Alliance, local",during any closed meeting to review a specific child death.
"emergency medical services personnel, Commonwealth’s","emergency medical services personnel, Commonwealth’s","emergency medical services personnel, Commonwealth’s","emergency medical services personnel, Commonwealth’s","emergency medical services personnel, Commonwealth’s","emergency medical services personnel, Commonwealth’s","emergency medical services personnel, Commonwealth’s","emergency medical services personnel, Commonwealth’s",Violations of this subsection shall be punishable as a Class
"attorneys, and community services boards.","attorneys, and community services boards.","attorneys, and community services boards.","attorneys, and community services boards.","attorneys, and community services boards.","attorneys, and community services boards.",,,3 misdemeanor.
C. Upon the request of the Chief Medical Examiner in his,C. Upon the request of the Chief Medical Examiner in his,C. Upon the request of the Chief Medical Examiner in his,C. Upon the request of the Chief Medical Examiner in his,C. Upon the request of the Chief Medical Examiner in his,C. Upon the request of the Chief Medical Examiner in his,C. Upon the request of the Chief Medical Examiner in his,C. Upon the request of the Chief Medical Examiner in his,"D. Upon notification of a child death, any state or local"
"capacity as chair of the Team, made after the conclusion","capacity as chair of the Team, made after the conclusion","capacity as chair of the Team, made after the conclusion","capacity as chair of the Team, made after the conclusion","capacity as chair of the Team, made after the conclusion","capacity as chair of the Team, made after the conclusion","capacity as chair of the Team, made after the conclusion","capacity as chair of the Team, made after the conclusion",government agency maintaining records on such child or
of,any,law-enforcement,law-enforcement,investigation,or,"prosecution,","prosecution,",such child’s family which are periodically purged shall
information and records regarding a child whose death is,information and records regarding a child whose death is,information and records regarding a child whose death is,information and records regarding a child whose death is,information and records regarding a child whose death is,information and records regarding a child whose death is,information and records regarding a child whose death is,information and records regarding a child whose death is,retain such records for the longer of 12 months or until such
being reviewed by the Team may be inspected and copied,being reviewed by the Team may be inspected and copied,being reviewed by the Team may be inspected and copied,being reviewed by the Team may be inspected and copied,being reviewed by the Team may be inspected and copied,being reviewed by the Team may be inspected and copied,being reviewed by the Team may be inspected and copied,being reviewed by the Team may be inspected and copied,time as the State Child Fatality Review Team has completed
"by the Chief Medical Examiner or his designee, including,","by the Chief Medical Examiner or his designee, including,","by the Chief Medical Examiner or his designee, including,","by the Chief Medical Examiner or his designee, including,","by the Chief Medical Examiner or his designee, including,","by the Chief Medical Examiner or his designee, including,","by the Chief Medical Examiner or his designee, including,","by the Chief Medical Examiner or his designee, including,",its child death review of the specific case.
"but not limited to, any report of the circumstances of the","but not limited to, any report of the circumstances of the","but not limited to, any report of the circumstances of the","but not limited to, any report of the circumstances of the","but not limited to, any report of the circumstances of the","but not limited to, any report of the circumstances of the","but not limited to, any report of the circumstances of the","but not limited to, any report of the circumstances of the",
