event maintained by any state or local law-enforcement,event maintained by any state or local law-enforcement,event maintained by any state or local law-enforcement,event maintained by any state or local law-enforcement,event maintained by any state or local law-enforcement,event maintained by any state or local law-enforcement,event maintained by any state or local law-enforcement,event maintained by any state or local law-enforcement,E. The Team shall compile annual data which shall be
"agency or medical examiner, and information or records","agency or medical examiner, and information or records","agency or medical examiner, and information or records","agency or medical examiner, and information or records","agency or medical examiner, and information or records","agency or medical examiner, and information or records","agency or medical examiner, and information or records","agency or medical examiner, and information or records",made available to the Governor and the General Assembly
"maintained on such child by any school, social services","maintained on such child by any school, social services","maintained on such child by any school, social services","maintained on such child by any school, social services","maintained on such child by any school, social services","maintained on such child by any school, social services","maintained on such child by any school, social services","maintained on such child by any school, social services",as requested. These statistical data compilations shall not
"agency or court. Information, records or reports maintained","agency or court. Information, records or reports maintained","agency or court. Information, records or reports maintained","agency or court. Information, records or reports maintained","agency or court. Information, records or reports maintained","agency or court. Information, records or reports maintained","agency or court. Information, records or reports maintained","agency or court. Information, records or reports maintained",contain any personally identifying information and shall be
by any Commonwealth’s Attorney shall be made available,by any Commonwealth’s Attorney shall be made available,by any Commonwealth’s Attorney shall be made available,by any Commonwealth’s Attorney shall be made available,by any Commonwealth’s Attorney shall be made available,by any Commonwealth’s Attorney shall be made available,by any Commonwealth’s Attorney shall be made available,by any Commonwealth’s Attorney shall be made available,public records.
10,10,,,,,,Virginia State Child Fatality Review Team - June 2009,Virginia State Child Fatality Review Team - June 2009
