,,,,,,,,,,,the age of 21 to operate any motor vehicle after,the age of 21 to operate any motor vehicle after,the age of 21 to operate any motor vehicle after,the age of 21 to operate any motor vehicle after,the age of 21 to operate any motor vehicle after,the age of 21 to operate any motor vehicle after,the age of 21 to operate any motor vehicle after,the age of 21 to operate any motor vehicle after,the age of 21 to operate any motor vehicle after
"strengthening of laws related to teenage driving,","strengthening of laws related to teenage driving,","strengthening of laws related to teenage driving,","strengthening of laws related to teenage driving,","strengthening of laws related to teenage driving,","strengthening of laws related to teenage driving,","strengthening of laws related to teenage driving,","strengthening of laws related to teenage driving,","strengthening of laws related to teenage driving,","strengthening of laws related to teenage driving,","strengthening of laws related to teenage driving,",,,,,,,,,
,,,,,,,,,,,illegally consuming alcohol. Any such person,illegally consuming alcohol. Any such person,illegally consuming alcohol. Any such person,illegally consuming alcohol. Any such person,illegally consuming alcohol. Any such person,illegally consuming alcohol. Any such person,illegally consuming alcohol. Any such person,illegally consuming alcohol. Any such person,illegally consuming alcohol. Any such person
"impaired driving, operation of ATVs, helmet use,","impaired driving, operation of ATVs, helmet use,","impaired driving, operation of ATVs, helmet use,","impaired driving, operation of ATVs, helmet use,","impaired driving, operation of ATVs, helmet use,","impaired driving, operation of ATVs, helmet use,","impaired driving, operation of ATVs, helmet use,","impaired driving, operation of ATVs, helmet use,","impaired driving, operation of ATVs, helmet use,","impaired driving, operation of ATVs, helmet use,","impaired driving, operation of ATVs, helmet use,",,,,,,,,,
,,,,,,,,,,,with a blood alcohol concentration of 0.02,with a blood alcohol concentration of 0.02,with a blood alcohol concentration of 0.02,with a blood alcohol concentration of 0.02,with a blood alcohol concentration of 0.02,with a blood alcohol concentration of 0.02,with a blood alcohol concentration of 0.02,with a blood alcohol concentration of 0.02,with a blood alcohol concentration of 0.02
occupant protection and speeding.,occupant protection and speeding.,occupant protection and speeding.,occupant protection and speeding.,occupant protection and speeding.,occupant protection and speeding.,occupant protection and speeding.,occupant protection and speeding.,Recommended,Recommended,Recommended,,,,,,,,,
,,,,,,,,,,,percent or more by weight by volume or 0.02,percent or more by weight by volume or 0.02,percent or more by weight by volume or 0.02,percent or more by weight by volume or 0.02,percent or more by weight by volume or 0.02,percent or more by weight by volume or 0.02,percent or more by weight by volume or 0.02,percent or more by weight by volume or 0.02,percent or more by weight by volume or 0.02
additions,additions,to,the,Code,of,Virginia,Virginia,are,indicated,indicated,,,,,,,,,
,,,,,,,,,,,grams or more per 210 liters of breath but less,grams or more per 210 liters of breath but less,grams or more per 210 liters of breath but less,grams or more per 210 liters of breath but less,grams or more per 210 liters of breath but less,grams or more per 210 liters of breath but less,grams or more per 210 liters of breath but less,grams or more per 210 liters of breath but less,grams or more per 210 liters of breath but less
by,italicized,italicized,and,bolded,bolded,text,and,recommended,recommended,recommended,,,,,,,,,
,,,,,,,,,,,than 0.08 by weight by volume or less than 0.08,than 0.08 by weight by volume or less than 0.08,than 0.08 by weight by volume or less than 0.08,than 0.08 by weight by volume or less than 0.08,than 0.08 by weight by volume or less than 0.08,than 0.08 by weight by volume or less than 0.08,than 0.08 by weight by volume or less than 0.08,than 0.08 by weight by volume or less than 0.08,than 0.08 by weight by volume or less than 0.08
subtractions by strike-through and bolded text. New,subtractions by strike-through and bolded text. New,subtractions by strike-through and bolded text. New,subtractions by strike-through and bolded text. New,subtractions by strike-through and bolded text. New,subtractions by strike-through and bolded text. New,subtractions by strike-through and bolded text. New,subtractions by strike-through and bolded text. New,subtractions by strike-through and bolded text. New,subtractions by strike-through and bolded text. New,subtractions by strike-through and bolded text. New,,,,,,,,,
,,,,,,,,,,,grams per 210 liters of breath as indicated by a,grams per 210 liters of breath as indicated by a,grams per 210 liters of breath as indicated by a,grams per 210 liters of breath as indicated by a,grams per 210 liters of breath as indicated by a,grams per 210 liters of breath as indicated by a,grams per 210 liters of breath as indicated by a,grams per 210 liters of breath as indicated by a,grams per 210 liters of breath as indicated by a
recommendations,recommendations,recommendations,recommendations,for,legislative,legislative,changes,changes,are,also,,,,,,,,,
,,,,,,,,,,,chemical test administered as provided in this,chemical test administered as provided in this,chemical test administered as provided in this,chemical test administered as provided in this,chemical test administered as provided in this,chemical test administered as provided in this,chemical test administered as provided in this,chemical test administered as provided in this,chemical test administered as provided in this
bolded in this section.,bolded in this section.,bolded in this section.,bolded in this section.,bolded in this section.,,,,,,,,,,,,,,,
,,,,,,,,,,,article shall be in violation of this section.,article shall be in violation of this section.,article shall be in violation of this section.,article shall be in violation of this section.,article shall be in violation of this section.,article shall be in violation of this section.,article shall be in violation of this section.,article shall be in violation of this section.,article shall be in violation of this section.
1. The Virginia General Assembly should amend,1. The Virginia General Assembly should amend,1. The Virginia General Assembly should amend,1. The Virginia General Assembly should amend,1. The Virginia General Assembly should amend,1. The Virginia General Assembly should amend,1. The Virginia General Assembly should amend,1. The Virginia General Assembly should amend,1. The Virginia General Assembly should amend,1. The Virginia General Assembly should amend,1. The Virginia General Assembly should amend,,,,,,,,,
,,,,,,,,,,,B. A violation of this section is a Class 1,B. A violation of this section is a Class 1,B. A violation of this section is a Class 1,B. A violation of this section is a Class 1,B. A violation of this section is a Class 1,B. A violation of this section is a Class 1,B. A violation of this section is a Class 1,B. A violation of this section is a Class 1,B. A violation of this section is a Class 1
,the definition of involuntary manslaughter as,the definition of involuntary manslaughter as,the definition of involuntary manslaughter as,the definition of involuntary manslaughter as,the definition of involuntary manslaughter as,the definition of involuntary manslaughter as,the definition of involuntary manslaughter as,the definition of involuntary manslaughter as,the definition of involuntary manslaughter as,the definition of involuntary manslaughter as,,,,,,,,,
,,,,,,,,,,,misdemeanor. Punishment shall be (i) forfeiture,misdemeanor. Punishment shall be (i) forfeiture,misdemeanor. Punishment shall be (i) forfeiture,misdemeanor. Punishment shall be (i) forfeiture,misdemeanor. Punishment shall be (i) forfeiture,misdemeanor. Punishment shall be (i) forfeiture,misdemeanor. Punishment shall be (i) forfeiture,misdemeanor. Punishment shall be (i) forfeiture,misdemeanor. Punishment shall be (i) forfeiture
,outlined in § 18.2-36.1 of the Code of Virginia.,outlined in § 18.2-36.1 of the Code of Virginia.,outlined in § 18.2-36.1 of the Code of Virginia.,outlined in § 18.2-36.1 of the Code of Virginia.,outlined in § 18.2-36.1 of the Code of Virginia.,outlined in § 18.2-36.1 of the Code of Virginia.,outlined in § 18.2-36.1 of the Code of Virginia.,outlined in § 18.2-36.1 of the Code of Virginia.,outlined in § 18.2-36.1 of the Code of Virginia.,outlined in § 18.2-36.1 of the Code of Virginia.,,,,,,,,,
,,,,,,,,,,,of such person’s license to operate a motor,of such person’s license to operate a motor,of such person’s license to operate a motor,of such person’s license to operate a motor,of such person’s license to operate a motor,of such person’s license to operate a motor,of such person’s license to operate a motor,of such person’s license to operate a motor,of such person’s license to operate a motor
,Recommended,Recommended,Recommended,changes,changes,are,listed,listed,below:,below:,,,,,,,,,
,,,,,,,,,,,vehicle for a period of one year from the date,vehicle for a period of one year from the date,vehicle for a period of one year from the date,vehicle for a period of one year from the date,vehicle for a period of one year from the date,vehicle for a period of one year from the date,vehicle for a period of one year from the date,vehicle for a period of one year from the date,vehicle for a period of one year from the date
,,,,,,,,,,,of conviction and (ii) a mandatory minimum,of conviction and (ii) a mandatory minimum,of conviction and (ii) a mandatory minimum,of conviction and (ii) a mandatory minimum,of conviction and (ii) a mandatory minimum,of conviction and (ii) a mandatory minimum,of conviction and (ii) a mandatory minimum,of conviction and (ii) a mandatory minimum,of conviction and (ii) a mandatory minimum
,§,18.2-36.1.,18.2-36.1.,Certain,conduct,conduct,punishable,punishable,as,as,,,,,,,,,
,involuntary manslaughter.,involuntary manslaughter.,involuntary manslaughter.,involuntary manslaughter.,involuntary manslaughter.,,,,,,"fine of $500 $1,000 or performance","fine of $500 $1,000 or performance","fine of $500 $1,000 or performance","fine of $500 $1,000 or performance","fine of $500 $1,000 or performance","fine of $500 $1,000 or performance","fine of $500 $1,000 or performance",,
17,,,,,,,,,,Virginia State Child Fatality Review Team - May 2009,Virginia State Child Fatality Review Team - May 2009,Virginia State Child Fatality Review Team - May 2009,Virginia State Child Fatality Review Team - May 2009,Virginia State Child Fatality Review Team - May 2009,Virginia State Child Fatality Review Team - May 2009,Virginia State Child Fatality Review Team - May 2009,Virginia State Child Fatality Review Team - May 2009,Virginia State Child Fatality Review Team - May 2009,Virginia State Child Fatality Review Team - May 2009
