Name: “Table 1 of 1 on page 24 of 36”,Name: “Table 1 of 1 on page 24 of 36”,Name: “Table 1 of 1 on page 24 of 36”,Name: “Table 1 of 1 on page 24 of 36”,Name: “Table 1 of 1 on page 24 of 36”,Name: “Table 1 of 1 on page 24 of 36”,Name: “Table 1 of 1 on page 24 of 36”,Name: “Table 1 of 1 on page 24 of 36”,Name: “Table 1 of 1 on page 24 of 36”,Name: “Table 1 of 1 on page 24 of 36”,Name: “Table 1 of 1 on page 24 of 36”,Name: “Table 1 of 1 on page 24 of 36”,Name: “Table 1 of 1 on page 24 of 36”,Name: “Table 1 of 1 on page 24 of 36”,Name: “Table 1 of 1 on page 24 of 36”,Name: “Table 1 of 1 on page 24 of 36”,Name: “Table 1 of 1 on page 24 of 36”,Name: “Table 1 of 1 on page 24 of 36”,Name: “Table 1 of 1 on page 24 of 36”,Name: “Table 1 of 1 on page 24 of 36”
Table: 24,Table: 24,Table: 24,Table: 24,Table: 24,Table: 24,Table: 24,Table: 24,Table: 24,Table: 24,Table: 24,Table: 24,Table: 24,Table: 24,Table: 24,Table: 24,Table: 24,Table: 24,Table: 24,Table: 24
,,,,,,,,,,,,,,,,,,,
,,SECTION IV: RECOMMENDATIONS,SECTION IV: RECOMMENDATIONS,SECTION IV: RECOMMENDATIONS,SECTION IV: RECOMMENDATIONS,SECTION IV: RECOMMENDATIONS,SECTION IV: RECOMMENDATIONS,SECTION IV: RECOMMENDATIONS,SECTION IV: RECOMMENDATIONS,SECTION IV: RECOMMENDATIONS,SECTION IV: RECOMMENDATIONS,SECTION IV: RECOMMENDATIONS,SECTION IV: RECOMMENDATIONS,SECTION IV: RECOMMENDATIONS,SECTION IV: RECOMMENDATIONS,SECTION IV: RECOMMENDATIONS,SECTION IV: RECOMMENDATIONS,SECTION IV: RECOMMENDATIONS,
RECOMMENDATIONS,RECOMMENDATIONS,RECOMMENDATIONS,RECOMMENDATIONS,RECOMMENDATIONS,,,,,,,"A. Any person who, as a result of driving","A. Any person who, as a result of driving","A. Any person who, as a result of driving","A. Any person who, as a result of driving","A. Any person who, as a result of driving","A. Any person who, as a result of driving","A. Any person who, as a result of driving","A. Any person who, as a result of driving","A. Any person who, as a result of driving"
,,,,,,,,,,,"under the influence in violation of clause (ii),","under the influence in violation of clause (ii),","under the influence in violation of clause (ii),","under the influence in violation of clause (ii),","under the influence in violation of clause (ii),","under the influence in violation of clause (ii),","under the influence in violation of clause (ii),","under the influence in violation of clause (ii),","under the influence in violation of clause (ii),"
This review by the State Child Fatality Review Team,This review by the State Child Fatality Review Team,This review by the State Child Fatality Review Team,This review by the State Child Fatality Review Team,This review by the State Child Fatality Review Team,This review by the State Child Fatality Review Team,This review by the State Child Fatality Review Team,This review by the State Child Fatality Review Team,This review by the State Child Fatality Review Team,This review by the State Child Fatality Review Team,This review by the State Child Fatality Review Team,"(iii), or (iv) of § 18.2-266 or any local ordinance","(iii), or (iv) of § 18.2-266 or any local ordinance","(iii), or (iv) of § 18.2-266 or any local ordinance","(iii), or (iv) of § 18.2-266 or any local ordinance","(iii), or (iv) of § 18.2-266 or any local ordinance","(iii), or (iv) of § 18.2-266 or any local ordinance","(iii), or (iv) of § 18.2-266 or any local ordinance","(iii), or (iv) of § 18.2-266 or any local ordinance","(iii), or (iv) of § 18.2-266 or any local ordinance"
revealed two basic but important findings. First and,revealed two basic but important findings. First and,revealed two basic but important findings. First and,revealed two basic but important findings. First and,revealed two basic but important findings. First and,revealed two basic but important findings. First and,revealed two basic but important findings. First and,revealed two basic but important findings. First and,revealed two basic but important findings. First and,revealed two basic but important findings. First and,revealed two basic but important findings. First and,substantially,substantially,similar,similar,thereto,unintentionally,unintentionally,unintentionally,unintentionally
"foremost, as many as four-fifths of these motor vehicle","foremost, as many as four-fifths of these motor vehicle","foremost, as many as four-fifths of these motor vehicle","foremost, as many as four-fifths of these motor vehicle","foremost, as many as four-fifths of these motor vehicle","foremost, as many as four-fifths of these motor vehicle","foremost, as many as four-fifths of these motor vehicle","foremost, as many as four-fifths of these motor vehicle","foremost, as many as four-fifths of these motor vehicle","foremost, as many as four-fifths of these motor vehicle","foremost, as many as four-fifths of these motor vehicle","causes the death of another person, shall be","causes the death of another person, shall be","causes the death of another person, shall be","causes the death of another person, shall be","causes the death of another person, shall be","causes the death of another person, shall be","causes the death of another person, shall be","causes the death of another person, shall be","causes the death of another person, shall be"
collision deaths could have been prevented through,collision deaths could have been prevented through,collision deaths could have been prevented through,collision deaths could have been prevented through,collision deaths could have been prevented through,collision deaths could have been prevented through,collision deaths could have been prevented through,collision deaths could have been prevented through,collision deaths could have been prevented through,collision deaths could have been prevented through,collision deaths could have been prevented through,guilty of involuntary manslaughter.,guilty of involuntary manslaughter.,guilty of involuntary manslaughter.,guilty of involuntary manslaughter.,guilty of involuntary manslaughter.,guilty of involuntary manslaughter.,guilty of involuntary manslaughter.,,
changes,changes,in,"policy,","law,","education,","education,","education,",and,behavior.,behavior.,,,,,,,,,
"Second, child deaths in and around motor vehicles","Second, child deaths in and around motor vehicles","Second, child deaths in and around motor vehicles","Second, child deaths in and around motor vehicles","Second, child deaths in and around motor vehicles","Second, child deaths in and around motor vehicles","Second, child deaths in and around motor vehicles","Second, child deaths in and around motor vehicles","Second, child deaths in and around motor vehicles","Second, child deaths in and around motor vehicles","Second, child deaths in and around motor vehicles","B. If, in addition, the conduct of the defendant","B. If, in addition, the conduct of the defendant","B. If, in addition, the conduct of the defendant","B. If, in addition, the conduct of the defendant","B. If, in addition, the conduct of the defendant","B. If, in addition, the conduct of the defendant","B. If, in addition, the conduct of the defendant","B. If, in addition, the conduct of the defendant","B. If, in addition, the conduct of the defendant"
"occur when drivers, passengers and pedestrians do","occur when drivers, passengers and pedestrians do","occur when drivers, passengers and pedestrians do","occur when drivers, passengers and pedestrians do","occur when drivers, passengers and pedestrians do","occur when drivers, passengers and pedestrians do","occur when drivers, passengers and pedestrians do","occur when drivers, passengers and pedestrians do","occur when drivers, passengers and pedestrians do","occur when drivers, passengers and pedestrians do","occur when drivers, passengers and pedestrians do","was so gross, wanton and culpable as to show","was so gross, wanton and culpable as to show","was so gross, wanton and culpable as to show","was so gross, wanton and culpable as to show","was so gross, wanton and culpable as to show","was so gross, wanton and culpable as to show","was so gross, wanton and culpable as to show","was so gross, wanton and culpable as to show","was so gross, wanton and culpable as to show"
not follow simple safety practices. Many of these,not follow simple safety practices. Many of these,not follow simple safety practices. Many of these,not follow simple safety practices. Many of these,not follow simple safety practices. Many of these,not follow simple safety practices. Many of these,not follow simple safety practices. Many of these,not follow simple safety practices. Many of these,not follow simple safety practices. Many of these,not follow simple safety practices. Many of these,not follow simple safety practices. Many of these,"a reckless disregard for human life, he shall be","a reckless disregard for human life, he shall be","a reckless disregard for human life, he shall be","a reckless disregard for human life, he shall be","a reckless disregard for human life, he shall be","a reckless disregard for human life, he shall be","a reckless disregard for human life, he shall be","a reckless disregard for human life, he shall be","a reckless disregard for human life, he shall be"
deaths,deaths,result,,from,unsafe,,,,,,"guilty of aggravated involuntary manslaughter,","guilty of aggravated involuntary manslaughter,","guilty of aggravated involuntary manslaughter,","guilty of aggravated involuntary manslaughter,","guilty of aggravated involuntary manslaughter,","guilty of aggravated involuntary manslaughter,","guilty of aggravated involuntary manslaughter,","guilty of aggravated involuntary manslaughter,","guilty of aggravated involuntary manslaughter,"
driving,driving,practices,practices,such,as,,,,,,a felony punishable by a term of imprisonment,a felony punishable by a term of imprisonment,a felony punishable by a term of imprisonment,a felony punishable by a term of imprisonment,a felony punishable by a term of imprisonment,a felony punishable by a term of imprisonment,a felony punishable by a term of imprisonment,a felony punishable by a term of imprisonment,a felony punishable by a term of imprisonment
,,,,,,,Effective and,Effective and,Effective and,Effective and,,,,,,,,,
speeding and overcorrection;,speeding and overcorrection;,speeding and overcorrection;,speeding and overcorrection;,speeding and overcorrection;,speeding and overcorrection;,,,,,,"of not less than one nor more than 20 years, one","of not less than one nor more than 20 years, one","of not less than one nor more than 20 years, one","of not less than one nor more than 20 years, one","of not less than one nor more than 20 years, one","of not less than one nor more than 20 years, one","of not less than one nor more than 20 years, one","of not less than one nor more than 20 years, one","of not less than one nor more than 20 years, one"
the,failure,failure,to,obey,traffic,,substantive,substantive,substantive,,year of which shall be a mandatory minimum,year of which shall be a mandatory minimum,year of which shall be a mandatory minimum,year of which shall be a mandatory minimum,year of which shall be a mandatory minimum,year of which shall be a mandatory minimum,year of which shall be a mandatory minimum,year of which shall be a mandatory minimum,year of which shall be a mandatory minimum
signs and signals; the nonuse,signs and signals; the nonuse,signs and signals; the nonuse,signs and signals; the nonuse,signs and signals; the nonuse,signs and signals; the nonuse,,education,education,,,term of imprisonment.,term of imprisonment.,term of imprisonment.,term of imprisonment.,,,,,
or improper use of seat belts,or improper use of seat belts,or improper use of seat belts,or improper use of seat belts,or improper use of seat belts,or improper use of seat belts,,,,,,,,,,,,,,
and other safety equipment;,and other safety equipment;,and other safety equipment;,and other safety equipment;,and other safety equipment;,and other safety equipment;,,for new,for new,,,C. If a person knowingly supplies alcohol to,C. If a person knowingly supplies alcohol to,C. If a person knowingly supplies alcohol to,C. If a person knowingly supplies alcohol to,C. If a person knowingly supplies alcohol to,C. If a person knowingly supplies alcohol to,C. If a person knowingly supplies alcohol to,C. If a person knowingly supplies alcohol to,C. If a person knowingly supplies alcohol to
operation of a motor vehicle,operation of a motor vehicle,operation of a motor vehicle,operation of a motor vehicle,operation of a motor vehicle,operation of a motor vehicle,,,,,,a person under age 21 in violation of clause,a person under age 21 in violation of clause,a person under age 21 in violation of clause,a person under age 21 in violation of clause,a person under age 21 in violation of clause,a person under age 21 in violation of clause,a person under age 21 in violation of clause,a person under age 21 in violation of clause,a person under age 21 in violation of clause
by,an,unlicensed,unlicensed,,driver;,,and teenage,and teenage,and teenage,,(A1) of § 4.1-306 and that person subsequently,(A1) of § 4.1-306 and that person subsequently,(A1) of § 4.1-306 and that person subsequently,(A1) of § 4.1-306 and that person subsequently,(A1) of § 4.1-306 and that person subsequently,(A1) of § 4.1-306 and that person subsequently,(A1) of § 4.1-306 and that person subsequently,(A1) of § 4.1-306 and that person subsequently,(A1) of § 4.1-306 and that person subsequently
and,inadequate,inadequate,inadequate,supervision,supervision,,drivers is,drivers is,,,operates a motor vehicle after having consumed,operates a motor vehicle after having consumed,operates a motor vehicle after having consumed,operates a motor vehicle after having consumed,operates a motor vehicle after having consumed,operates a motor vehicle after having consumed,operates a motor vehicle after having consumed,operates a motor vehicle after having consumed,operates a motor vehicle after having consumed
of,toddlers,toddlers,in,and,around,,,,,,the,supplied,alcohol,alcohol,and,causes,causes,a,"death,"
motor,motor,vehicles.,vehicles.,Effective,Effective,,critical to,critical to,,,the supplier of the alcohol shall be guilty of,the supplier of the alcohol shall be guilty of,the supplier of the alcohol shall be guilty of,the supplier of the alcohol shall be guilty of,the supplier of the alcohol shall be guilty of,the supplier of the alcohol shall be guilty of,the supplier of the alcohol shall be guilty of,the supplier of the alcohol shall be guilty of,the supplier of the alcohol shall be guilty of
and,substantive,substantive,substantive,education,education,,the safety of,the safety of,the safety of,the safety of,involuntary manslaughter.,involuntary manslaughter.,involuntary manslaughter.,involuntary manslaughter.,involuntary manslaughter.,,,,
for new and teenage drivers,for new and teenage drivers,for new and teenage drivers,for new and teenage drivers,for new and teenage drivers,for new and teenage drivers,,these children,these children,these children,these children,C. D. The provisions of this section shall not,C. D. The provisions of this section shall not,C. D. The provisions of this section shall not,C. D. The provisions of this section shall not,C. D. The provisions of this section shall not,C. D. The provisions of this section shall not,C. D. The provisions of this section shall not,C. D. The provisions of this section shall not,C. D. The provisions of this section shall not
is,critical,to,the,safety,of,,,,,,,,,,,,,,
,,,,,,,,,,,preclude prosecution under any other homicide,preclude prosecution under any other homicide,preclude prosecution under any other homicide,preclude prosecution under any other homicide,preclude prosecution under any other homicide,preclude prosecution under any other homicide,preclude prosecution under any other homicide,preclude prosecution under any other homicide,preclude prosecution under any other homicide
these,,children,children,and,their,,and their,and their,,,,,,,,,,,
,,,,,,,,,,,statute. This section shall not preclude any,statute. This section shall not preclude any,statute. This section shall not preclude any,statute. This section shall not preclude any,statute. This section shall not preclude any,statute. This section shall not preclude any,statute. This section shall not preclude any,statute. This section shall not preclude any,statute. This section shall not preclude any
"passengers. In case after case,","passengers. In case after case,","passengers. In case after case,","passengers. In case after case,","passengers. In case after case,","passengers. In case after case,",,,,,,,,,,,,,,
,,,,,,,passengers.,passengers.,passengers.,,other revocation or suspension required by law.,other revocation or suspension required by law.,other revocation or suspension required by law.,other revocation or suspension required by law.,other revocation or suspension required by law.,other revocation or suspension required by law.,other revocation or suspension required by law.,other revocation or suspension required by law.,other revocation or suspension required by law.
Team members discussed the,Team members discussed the,Team members discussed the,Team members discussed the,Team members discussed the,Team members discussed the,,,,,,,,,,,,,,
,,,,,,,,,,,The driver’s license of any person convicted,The driver’s license of any person convicted,The driver’s license of any person convicted,The driver’s license of any person convicted,The driver’s license of any person convicted,The driver’s license of any person convicted,The driver’s license of any person convicted,The driver’s license of any person convicted,The driver’s license of any person convicted
need,for,a,common,common,"sense,",,,,,,,,,,,,,,
,,,,,,,,,,,under this section shall be revoked pursuant to,under this section shall be revoked pursuant to,under this section shall be revoked pursuant to,under this section shall be revoked pursuant to,under this section shall be revoked pursuant to,under this section shall be revoked pursuant to,under this section shall be revoked pursuant to,under this section shall be revoked pursuant to,under this section shall be revoked pursuant to
"patient, and diligent approach to driving among all","patient, and diligent approach to driving among all","patient, and diligent approach to driving among all","patient, and diligent approach to driving among all","patient, and diligent approach to driving among all","patient, and diligent approach to driving among all","patient, and diligent approach to driving among all","patient, and diligent approach to driving among all","patient, and diligent approach to driving among all","patient, and diligent approach to driving among all","patient, and diligent approach to driving among all",,,,,,,,,
,,,,,,,,,,,subsection B of § 46.2-391.,subsection B of § 46.2-391.,subsection B of § 46.2-391.,subsection B of § 46.2-391.,subsection B of § 46.2-391.,,,,
persons using Virginia roadways. They concluded,persons using Virginia roadways. They concluded,persons using Virginia roadways. They concluded,persons using Virginia roadways. They concluded,persons using Virginia roadways. They concluded,persons using Virginia roadways. They concluded,persons using Virginia roadways. They concluded,persons using Virginia roadways. They concluded,persons using Virginia roadways. They concluded,persons using Virginia roadways. They concluded,persons using Virginia roadways. They concluded,,,,,,,,,
that effective strategies for the prevention of motor,that effective strategies for the prevention of motor,that effective strategies for the prevention of motor,that effective strategies for the prevention of motor,that effective strategies for the prevention of motor,that effective strategies for the prevention of motor,that effective strategies for the prevention of motor,that effective strategies for the prevention of motor,that effective strategies for the prevention of motor,that effective strategies for the prevention of motor,that effective strategies for the prevention of motor,2. The Virginia General Assembly should increase,2. The Virginia General Assembly should increase,2. The Virginia General Assembly should increase,2. The Virginia General Assembly should increase,2. The Virginia General Assembly should increase,2. The Virginia General Assembly should increase,2. The Virginia General Assembly should increase,2. The Virginia General Assembly should increase,2. The Virginia General Assembly should increase
vehicle deaths must be multi-faceted and target public,vehicle deaths must be multi-faceted and target public,vehicle deaths must be multi-faceted and target public,vehicle deaths must be multi-faceted and target public,vehicle deaths must be multi-faceted and target public,vehicle deaths must be multi-faceted and target public,vehicle deaths must be multi-faceted and target public,vehicle deaths must be multi-faceted and target public,vehicle deaths must be multi-faceted and target public,vehicle deaths must be multi-faceted and target public,vehicle deaths must be multi-faceted and target public,penalties for impaired driving as outlined,penalties for impaired driving as outlined,penalties for impaired driving as outlined,penalties for impaired driving as outlined,penalties for impaired driving as outlined,penalties for impaired driving as outlined,penalties for impaired driving as outlined,penalties for impaired driving as outlined,penalties for impaired driving as outlined
"awareness, attitudes and behaviors.","awareness, attitudes and behaviors.","awareness, attitudes and behaviors.","awareness, attitudes and behaviors.","awareness, attitudes and behaviors.","awareness, attitudes and behaviors.","awareness, attitudes and behaviors.",,,,,in,§,18.2-266.1,of,the,Code,of,Virginia.,Virginia.
"In light of its findings, the Team offers the following","In light of its findings, the Team offers the following","In light of its findings, the Team offers the following","In light of its findings, the Team offers the following","In light of its findings, the Team offers the following","In light of its findings, the Team offers the following","In light of its findings, the Team offers the following","In light of its findings, the Team offers the following","In light of its findings, the Team offers the following","In light of its findings, the Team offers the following","In light of its findings, the Team offers the following",Recommended changes are listed below:,Recommended changes are listed below:,Recommended changes are listed below:,Recommended changes are listed below:,Recommended changes are listed below:,Recommended changes are listed below:,Recommended changes are listed below:,Recommended changes are listed below:,Recommended changes are listed below:
recommendations to reduce the number of motor,recommendations to reduce the number of motor,recommendations to reduce the number of motor,recommendations to reduce the number of motor,recommendations to reduce the number of motor,recommendations to reduce the number of motor,recommendations to reduce the number of motor,recommendations to reduce the number of motor,recommendations to reduce the number of motor,recommendations to reduce the number of motor,recommendations to reduce the number of motor,"§ 18.2-266.1. (Expires July 1, 2010) Persons","§ 18.2-266.1. (Expires July 1, 2010) Persons","§ 18.2-266.1. (Expires July 1, 2010) Persons","§ 18.2-266.1. (Expires July 1, 2010) Persons","§ 18.2-266.1. (Expires July 1, 2010) Persons","§ 18.2-266.1. (Expires July 1, 2010) Persons","§ 18.2-266.1. (Expires July 1, 2010) Persons","§ 18.2-266.1. (Expires July 1, 2010) Persons","§ 18.2-266.1. (Expires July 1, 2010) Persons"
vehicle deaths to children in Virginia:,vehicle deaths to children in Virginia:,vehicle deaths to children in Virginia:,vehicle deaths to children in Virginia:,vehicle deaths to children in Virginia:,vehicle deaths to children in Virginia:,vehicle deaths to children in Virginia:,vehicle deaths to children in Virginia:,,,,under age 21 driving after illegally consuming,under age 21 driving after illegally consuming,under age 21 driving after illegally consuming,under age 21 driving after illegally consuming,under age 21 driving after illegally consuming,under age 21 driving after illegally consuming,under age 21 driving after illegally consuming,under age 21 driving after illegally consuming,under age 21 driving after illegally consuming
Legislative Changes,Legislative Changes,Legislative Changes,Legislative Changes,,,,,,,,alcohol; penalty.,alcohol; penalty.,alcohol; penalty.,,,,,,
The State Child Fatality Review Team supports the,The State Child Fatality Review Team supports the,The State Child Fatality Review Team supports the,The State Child Fatality Review Team supports the,The State Child Fatality Review Team supports the,The State Child Fatality Review Team supports the,The State Child Fatality Review Team supports the,The State Child Fatality Review Team supports the,The State Child Fatality Review Team supports the,The State Child Fatality Review Team supports the,The State Child Fatality Review Team supports the,A. It shall be unlawful for any person under,A. It shall be unlawful for any person under,A. It shall be unlawful for any person under,A. It shall be unlawful for any person under,A. It shall be unlawful for any person under,A. It shall be unlawful for any person under,A. It shall be unlawful for any person under,A. It shall be unlawful for any person under,A. It shall be unlawful for any person under
